user_input,retrieved_contexts,response,reference,context_recall,factual_correctness,faithfulness,semantic_similarity
ما هو علم العروض؟,"['العنوان: مقدمة\nالمحتوى: بسم الله الرحمن الرحيم هذه محاضرات في علم العروض والقافية ألقيتها على طلبة الصف الأول بقسم اللغة العربية في جامعة بيروت العربية.\nوقد حاولت جهدي عرض قضايا هذا العلم على نحو ييسر على دارسيه تفهمه والإلمام بأهم مصطلحاته وجوانبه التي لها أثر في موسيقي الشعر.\nولما كان تمثل الدارس للجانب النظري من هذا العلم لا يتم إلا إذا كان معززًا بالجانب التطبيقي، فقد أكثرت من الأمثلة والشواهد المختارة من قديم الشعر وحديثه.\nوعسى أن يجد القارئ في هذا الجهد المتواضع عونًا له على إدراك موسيقى الشعر ممثلة في أوزانه وقوافيه وكل ما يتصل بهما.\nالمؤلف\n\n', 'العنوان: تمهيد\nالمحتوى: 1 العروض والخليل بن أحمد:\nالعروض:\n""علم يُبْحث فيه عن أحوال الأوزان المعتبرة""\n1 أو\n""هو ميزان الشعر، به يعرف مكسوره من موزونه، كما أن النحو معيار الكلام به يعرف معربه من ملحونه""\n2.\nويرجع رجال التراجم الفضل في نشأة علم العروض إلى الخليل بن أحمد، أحد أئمة اللغة والأدب في القرن الثاني الهجري، فابن خلكان يذكر أن الخليل كان إمامًا في علم النحو، وأنه هو الذي استنبط علم العروض وأخرجه إلى الوجود وحصر أقسامه في خمس دوائر يستخرج منها خمسة عشر بحرًا، ثم زاد الأخفش بحرًا واحدًا وسماه الخبب، كما يذكر أن الخليل كان له معرفة بالإيقاع والنغم، وتلك المعرفة أحدثت له علم العروض، فإنهما متقاربان في المأخذ 3\n\n', 'العنوان: تمهيد\nالمحتوى: ويحدثنا ياقوت عن الخليل بن أحمد بأنه أول من استخرج العروض وضبط اللغة وحصر أشعار العرب، وأن معرفته بالإيقاع -بناء ألحان الغناء على موقعها وميزانها- هي التي أحدثت له علم العروض1.\nكذلك يحدثنا القفطيّ عن الخليل بأنه سيد الأدباء في علمه وزهده، وأنه نحويّ لغويّ عروضيّ، استنبط من العروض وعلله ما لم يستخرجه أحد، ولم يسبقه إلى علمه سابق من العلماء كلهم2.\nوروى ابن خلكان عن حمزة بن الحسن الأصفهاني نقلاً عن كتابه التنبيه على حدوث التصحيف.\nقوله:\nإن دولة الإسلام لم تخرج أبدع للعلوم التي لم يكن لها عند العرب أصول من الخليل، وليس على ذلك برهان أوضح من علم العروض الذي لا عن حكيم أخذه، ولا على مثال تقدمه احتذاه، وإنما اخترعه من ممر له بالصفارين، من وقع مطرقة على طست.\nمن ذلك يرى أن الخليل هو أول مبتكر لعلم العروض وحصر كل أشعار العرب في بحوره. ولم تقف عقليته المبتكرة عند هذا الحد، وإنما تجاوزته إلى ابتكار علوم أخرى، فهو أول مبتكر لفكرة المعاجم العربية بوضعه معجم العين، الذي يحصر لغة أمة من الأمم قاطبة، وهو الذي وضع أساس علم النحو باستخراج مسائله وتعليله، وإمداده سيبويه من علم النحو بما صنف منه كتابه الذي هو زينة لدولة الإسلام كما يذكر القفطيّ، ثم هو الذي اخترع علم الموسيقى العربية وجمع فيه أصناف النغم.\nولكن لا ينبغي أن يفهم من وضع الخليل لعلم العروض أن العرب لم تكن\n\n', 'العنوان: تمهيد\nالمحتوى: تعرف أوزان الشعر من قبل، فالواقع أنهم كانوا قبل وضع علم العروض على علم بأوزان الشعر العربي وبحوره على تباينها، وإن لم تكن تعرفها بالأسماء التي وضعها الخليل لها فيما بعد. وما أشبه علمها بذلك بعلمها بالإعراب في الكلام حين كانوا عن سليقة يرفعون أو ينصبون أو يجرون ما حقه الرفع أو النصب أو الجر دون علم بما وضعه النحاة فيما بعد من مصطلحات الإعراب وقواعده.\nكذلك كانوا بذوقهم وسيلقتهم يدركون ما يعتور الأوزان المختلفة من زحافات وعلل وإن لم يعطوها أسماء ومصطلحات خاصة كما فعل العروضيون.\nوإذا كان الخليل بن أحمد غير مسبوق في وضع علم العروض، فإن أبا عمرو بن العلاء قد سبقه في الكلام عن القوافي وقواعدها ووضع لها أسماء ومصطلحات خاصة.\nوالرواة مختلفون بشأن الباعث الذي دعا الخليل إلى التفكير في علم العروض ووضع قواعده.\nفمن قائل:\nإنه دعا بمكة أن يرزقه الله علمًا لم يسبقه إليه أحد ولا يؤخذ إلا عنه، فرجع من حجه، ففتح عليه بعلم العروض1.\nومن قائل:\nإن الدافع هو إشفاقه من اتجاه بعض شعراء عصره إلى نظم الشعر على أوزان لم يعرفها العرب ولم تسمع عنهم؛ ولهذا راح يقضي الساعات والأيام يوقع بأصابعه ويحركها حتى حصر أوزان الشعر العربي وضبط أحوال قوافيه.\nومن قائل:\nإنه وجد نفسه وهو بمكة يعيش في بيئة يشيع فيها الغناء فدفعه ذلك إلى التفكير في الوزن الشعري وما يمكن أن يخضع له من قواعد\n\n', 'العنوان: تمهيد\nالمحتوى: وأصول. وقد عكف أيامًا وليالي يستعرض فيها ما روي من أشعار ذات أنغام موسيقية متعددة،\nثم خرج على الناس بقواعد مضبوطة وأصول محكمة سماها:\nعلم العروض.\nوأيًّا كان الدافع فالثابت أن الخليل هو واضع أصول علم العروض وقوانينه التي لم يطرأ تغيير جوهري عليها، وأن الناس ظلوا حتى اليوم يتدارسونها ويتفهمونها من غير أن يزيد عليها أحد شيئًا. فلا تزال الوحدات القياسية للأوزان هي التفعيلات التي اخترعها الخليل، ولا تزال المقاطع الصوتية التي تتألف منها التفعيلات هي الأسباب والأوتاد، كما أن عدد البحور لا يزال ثابتًا عند البحور الخمسة عشر التي وضعها الخليل وبحر الخبب أو المتدارك الذي وضعه تلميذه الأخفش الأوسط أبو الحسن سعيد بن مسعدة، ولا يرد علينا هنا بما استحدث من أوزان في العصر العباسي؛ لأن هذه يمكن إرجاع أصولها إلى أوزان الخليل.\nوتجدر الإشارة إلى أن هناك فارقًا ملحوظًا بين علم العروض وعلوم العربية الأخرى من حيث النشأة. فعلوم النحو والصرف والبلاغة واللغة مثلاً قد استحدثت ثم أخذت تنمو جيلاً بعد جيل وعصرًا بعد عصر حتى بلغت ذروة اكتمالها، أما العروض فقد أخرجه الخليل علمًا يكاد يكون متكاملاً، ولعل ذلك هو السر في أن من أتى بعد الخليل من العروضيين لم يستطيعوا أن يزيدوا على عروضه أي زيادة تذكر أو تمس الجوهر.\nوكما اختلفت الآراء بالنسبة إلى الباعث الذي دعا الخليل إلى التفكير في علم العروض، اختلفت كذلك بالنسبة إلى سبب تسمية هذا العلم بالعروض.\nفمن قائل:\nإن من معاني العروض مكة لاعتراضها وسط البلاد، ومن ثم أطلق الخليل على علم ميزان الشعر الذي اخترعه اسم المكان الذي ألهم فيه قواعده وأصوله.\n\n', 'العنوان: تمهيد\nالمحتوى: ومن قائل:\nإنه سمي عروضًا باسم عمان التي كان يقيم فيها واضعه ومخترعه الخليل بن أحمد. ويذكر صاحب لسان العرب أنه سمي عروضًا؛ لأن الشعر يعرض عليه،\nأي:\nيوزن بواسطته.\n2 الحاجة إلى علم العروض:\nعرفنا مما سبق أن العروض هو علم ميزان الشعر أو موسيقى الشعر، وهو علم له قواعده وأصوله ونظرياته التي تحصل وتكتسب بالتعلم، وإذا كان الشعر من الناحية العملية هو الجانب التطبيقي لقواعد العروض وأصوله ونظرياته، فإنه قبل ذلك فن كسائر الفنون مصدره الموهبة والاستعداد.\nوقد يستطيع الشاعر الموهوب بما له من أذن موسيقية وحس وذوق مرهفين أن يقول الشعر دون علم بالعروض وحاجة إلى قوانينه، ولكنه مع ذلك يظل بحاجة إلى دراسة علم العروض والإلمام بأصوله.\nفأذن الشاعر الموسيقية -مهما كانت درجة رهافتها وحساسيتها- قد تخذل صاحبها أحيانًا في التمييز بين الأوزان المتقاربة أو بين قافية سليمة وأخرى معيبة، أو بين زحاف جائز وآخر غير جائز.\nوجهل الشاعر الموهوب بأوزان الشعر وبحوره المختلفة من تامة ومجزوءة ومشطورة ومنهوكة قد يحصر شعره في بعض أوزان خاصة، وبذلك يحرم نفسه من العزف على أوتار شتى تجعل شعره منوع الأنغام والألحان من ذلك تتجلى أهمية دراسة الشاعر للعروض والإلمام بقوانينه وأصوله.\nوإذا كان العروض إلى هذا القدر لازمًا للشاعر الملهم الموهوب، فإنه يكون أشد لزومًا لغيره. فهو أشد لزومًا لطلاب اللغة والتخصص فيها؛ لأنه يعينهم على فهم الشعر العربي وقراءته قراءة صحيحة والتمييز بين سليمه ومختله وزنًا.\n\n', 'العنوان: تمهيد\nالمحتوى: وهو كذلك أشد لزومًا للدارسين والمتخصصين في فروع الثقافة العربية من تاريخ واجتماع وأدب وبلاغة ومذاهب دينية أو عقلية. فالباحثون في أمثال هذه العلوم العربية لا غنى لهم عن تفهم ما يرد من شعر في المراجع والكتب المختصة بهذه العلوم. وفهم أولئك للشعر متوقف على صحة قراءته، وهذه لا تتأتى إلا لمن لديه القدرة على معرفة صحيح الأوزان والتمييز بين أنواعها المختلفة.\nمن أجل ذلك كله ندرك ضرورة الإلمام بعلم العروض أو علم موسيقى الشعر وأصوله، لا بالنسبة للشعراء فحسب، ولكن بالنسبة أيضًا لذوي التخصص في علوم العربية. وإذا جاز أن يغتفر لغير متخصص ألا يقيم وزن الشعر وألا يقرأه قراءة صحيحة، فإن ذلك لا يمكن أن يغتفر مطلقًا للمتخصص.\n3 الصلة بين العروض والموسيقى:\nعرفنا أن العروض هو علم موسيقى الشعر، وعلى ذلك يكون هناك صلة تجمع بينه وبين الموسيقى بصفة عامة، وهذه الصلة تتمثل في الجانب الصوتي.\nفالموسيقى تقوم على تقسيم الجمل إلى مقاطع صوتية تختلف طولاً وقصرًا، أو إلى وحدات صوتية معينة على نسق معين، بغض النظر عن بداية الكلمات ونهايتها.\nوكذلك شأن العروض، فالبيت من الشعر يقسم إلى وحدات صوتية معينة، أو إلى مقاطع صوتية تعرف بالتفاعيل بقطع النظر عن بداية الكلمات ونهايتها. فقد ينتهي المقطع الصوتي أو التفعيلة في آخر كلمة، وقد ينتهي في وسطها، وقد يبدأ من نهاية كلمة وينتهي ببدء الكلمة التي تليها.\nوهاكم مثالاً على ذلك:\nلا تسألي القوم ما مالي وما حسبي ... وسائلي للقوم ما حزمي وما خلقي\n\n', 'العنوان: تمهيد\nالمحتوى: فتقطيع هذا البيت أو تقسيمه إلى وحدات صوتية أو تفاعيل يكون كالآتي:\nلا تَسْأَلِلْ قَومَ مَا مَالِي َمَاحَسَبِي ... مستفعلن فاعلن مستفعلن فعلن\nوَسَائِلِلْ قَومَ ما حَزْمِي وَمَا خُلُقِي ... متفعلن فاعلن مستفعلن فعلن\nولكن تقطيع البيت أو تقسيمه إلى وحدات صوتية أو تفاعيل لا يتحقق إلا إذا كتب الشعر كتابة عروضية فما الكتابة العروضية؟\n4 الكتابة العروضية.\nأوضحنا فيما سبق الصلة الوثيقة التي بين العروض والموسيقى، وهي صلة الفرع المتولد من الأصل، فالعروض في الحقيقة أمره ليس إلا ضربًا من الموسيقى اختص بالشعر على أنه مقوم من مقوماته.\nوإذا كان للموسيقى عند كتابتها رموز خاصة يدل بها على الأنغام المختلفة، فإن للعروض كذلك رموزًا خاصة به في الكتابة تخالف الكتابة الإملائية التي تكون على حسب قواعد الإملاء المتعارف عليها. وهذه الرموز العروضية يدل بها على التفاعيل التي هي بمثابة أنغام الموسيقي المختلفة.\nوالكتابة العروضية تقوم على أمرين أساسيين هما:\n1 ما ينطق يكتب.\n2 ما لا ينطق لا يكتب.\nوتحقيق هذين الأمرين عند الكتابة العروضية يستلزم زيادة بعض أحرف\n\n', 'العنوان: تمهيد\nالمحتوى: لا تكتب إملائيًا وحذف بعض أحرف تكتب إملائيًا.\nوفيما يلي تفصيل للأحرف التي تزاد أوتحذف في الكتابة العروضية:\nأ-\nالحروف التي تزاد:\nتزاد في الكتابة العروضية ستة أحرف هي:\n1 إذا كان الحرف مشددًا فك التشديد ورسم الحرف أو كتب مرتين:\nمرة ساكنًا ومرة متحركًا،\nنحو:\nرق، وعد، وهز،\nفتكتب عروضيًّا:\nرقق، وعدد، وهزز.\n2 إذا كان الحرف منونًا كتب التنوين نونًا،\nنحو:\nجبل، وشجر، وأسد،\nفتكتب عروضيًّا:\nجبلن، وشجرن، وأسدن، رفعًا ونصبًا وجرًّا.\n3 تزاد ألف في بعض أسماء الإشارة،\nنحو:\nهذا، وهذه، وهذان، وهذين، وهؤلاء، وذلك،\nفتكتب عروضيًّا:\nهاذا، وهاذه، وهاذان، وهاذين، وهاؤلاء، وذالك. كذلك تزاد ألف في لفظ الجلالة، وفي لكن المخففة والمشددة،\nفهذه الكلمات:\nالله، ولكن، ولكن،\nتكتب عروضيًّا هكذا:\nاللاه، ولاكن، ولاكنن.\n4 تزاد واو في بعض الأسماء كما في:\nداود، وطاوس، وناوس،\nفتكتب عروضيًّا:\nداوود، وطاووس، وناووس.\n5 تكتب حركة حرف القافية حرفًا مجانسًا للحركة، فإذا كانت حركة حرف القافية ضمة كتبت هذه الضمة عروضيًّا واوًا، وإذا كانت كسرة كتبت ياء، وإذا كانت فتحة كتبت ألفًا.\n6 إذا أشبعت حركة هاء الضمير للمفرد المذكر الغائب، كتبت\n\n', 'العنوان: تمهيد\nالمحتوى: حرفًا مجانسًا للحركة.\nفالضمة التي على الهاء في:\nله، ومنه، وعنه،\nإذا أشبعت كتبت عروضيًّا واوًا هكذا:\nلهو، ومنهو، وعنهو.\nوكسرة الهاء في:\nبه وإليه، وفيه،\nإذا أشبعت كتبت عروضيًّا هكذا:\nبهي، وإليهي، وفيهي.\nأما كاف المخاطب أو المخاطبة فلا تشبع، وبالتالي لا يزاد بعدها أي حرف،\nنحو:\nبك، وبكِ، ومنك ومنكِ، وإليك وإليكِ.\nب-\nالأحرف التي تحذف:\n1 تحذف همزة الوصل، وهي الألف التي يتوصل بها إلى النطق بالساكن، إن كان قبلها متحرك.\nويكون ذلك في:\nأ- ماضي الأفعال الخماسية والسداسية المبدوءة بالهمزة، وفي أمرها ومصدرها،\nنحو:\nانْطَلَق، استغْفَر، انطلِق، استغفِر، انطلاق، استغفار.\nفألف الوصل في هذه الكلمات وأمثالها تحذف إن كان قبلها متحرك عند الكتابة العروضية هكذا:\nفنطلَق، فستغفَر، فنطلِق فستغفِر، فنطلاق، فستغفار.\nب-\nالأسماء العشرة المسموعة وهي:\nاسم، ابن، ابنة، امرؤ، امرأة، اثنان، اثنتان، أيمن المختصة بالقسم، است.\nفمثلاً:\nباسمك، وهذا أب وابن، والعام اثنا عشر شهرًا،\nتكتب عروضيًّا هكذا:\nبسمك، وهاذا أبن وبنن، والعام ثنا عشر شهرن.\nج- أمر الفعل الثلاثي الساكن ثاني مضارعه،\nنحو:\nفاسمع واكتب واقرأ،\nفإنها تكتب عروضيًّا هكذا:\nفسمعْ، وكتبْ، وقرأْ.\nد- ألف الوصل من أل المعرفة. فإذا كانت أل قمرية، كما\n\n']"," علم العروض هو فرع من فروع علم الشعر العربي يهتم بدراسة الأوزان الشعرية والقواعد التي تحكم تركيب القصائد والأبيات. يُعتبر العروض أساساً لفهم موسيقى الشعر العربي وتحليلها.

تم تطوير علم العروض على يد الخليل بن أحمد الفراهيدي في القرن الثاني الهجري، وهو يُعتبر مؤسس هذا العلم. يهدف العروض إلى مساعدة الشعراء على تنظيم قصائدهم بشكل متناسق وموسيقي، وكذلك يساعد الدارسين والباحثين على فهم وتحليل الشعر العربي بشكل أعمق.

يتضمن علم العروض دراسة البحور الشعرية والتفاعيل والأقدام الشعرية، بالإضافة إلى دراسة الزحافات والعلل التي تطرأ على الأوزان الشعرية. يُعتبر العروض أداة مهمة لفهم جماليات الشعر العربي وتطوير مهارات الكتابة الشعرية.

إذا كنت ترغب في معرفة المزيد عن علم العروض أو لديك أسئلة محددة حول هذا الموضوع، فلا تتردد في طرحها وسأكون سعيداً لمساعدتك. ",علم العروض هو علم يدرس أوزان الشعر العربي ويحدد قواعدها.,,0.36,0.8181818181818182,0.9444677344575887
من هو مؤسس علم العروض؟,"['العنوان: مقدمة\nالمحتوى: بسم الله الرحمن الرحيم هذه محاضرات في علم العروض والقافية ألقيتها على طلبة الصف الأول بقسم اللغة العربية في جامعة بيروت العربية.\nوقد حاولت جهدي عرض قضايا هذا العلم على نحو ييسر على دارسيه تفهمه والإلمام بأهم مصطلحاته وجوانبه التي لها أثر في موسيقي الشعر.\nولما كان تمثل الدارس للجانب النظري من هذا العلم لا يتم إلا إذا كان معززًا بالجانب التطبيقي، فقد أكثرت من الأمثلة والشواهد المختارة من قديم الشعر وحديثه.\nوعسى أن يجد القارئ في هذا الجهد المتواضع عونًا له على إدراك موسيقى الشعر ممثلة في أوزانه وقوافيه وكل ما يتصل بهما.\nالمؤلف\n\n', 'العنوان: تمهيد\nالمحتوى: 1 العروض والخليل بن أحمد:\nالعروض:\n""علم يُبْحث فيه عن أحوال الأوزان المعتبرة""\n1 أو\n""هو ميزان الشعر، به يعرف مكسوره من موزونه، كما أن النحو معيار الكلام به يعرف معربه من ملحونه""\n2.\nويرجع رجال التراجم الفضل في نشأة علم العروض إلى الخليل بن أحمد، أحد أئمة اللغة والأدب في القرن الثاني الهجري، فابن خلكان يذكر أن الخليل كان إمامًا في علم النحو، وأنه هو الذي استنبط علم العروض وأخرجه إلى الوجود وحصر أقسامه في خمس دوائر يستخرج منها خمسة عشر بحرًا، ثم زاد الأخفش بحرًا واحدًا وسماه الخبب، كما يذكر أن الخليل كان له معرفة بالإيقاع والنغم، وتلك المعرفة أحدثت له علم العروض، فإنهما متقاربان في المأخذ 3\n\n', 'العنوان: تمهيد\nالمحتوى: ويحدثنا ياقوت عن الخليل بن أحمد بأنه أول من استخرج العروض وضبط اللغة وحصر أشعار العرب، وأن معرفته بالإيقاع -بناء ألحان الغناء على موقعها وميزانها- هي التي أحدثت له علم العروض1.\nكذلك يحدثنا القفطيّ عن الخليل بأنه سيد الأدباء في علمه وزهده، وأنه نحويّ لغويّ عروضيّ، استنبط من العروض وعلله ما لم يستخرجه أحد، ولم يسبقه إلى علمه سابق من العلماء كلهم2.\nوروى ابن خلكان عن حمزة بن الحسن الأصفهاني نقلاً عن كتابه التنبيه على حدوث التصحيف.\nقوله:\nإن دولة الإسلام لم تخرج أبدع للعلوم التي لم يكن لها عند العرب أصول من الخليل، وليس على ذلك برهان أوضح من علم العروض الذي لا عن حكيم أخذه، ولا على مثال تقدمه احتذاه، وإنما اخترعه من ممر له بالصفارين، من وقع مطرقة على طست.\nمن ذلك يرى أن الخليل هو أول مبتكر لعلم العروض وحصر كل أشعار العرب في بحوره. ولم تقف عقليته المبتكرة عند هذا الحد، وإنما تجاوزته إلى ابتكار علوم أخرى، فهو أول مبتكر لفكرة المعاجم العربية بوضعه معجم العين، الذي يحصر لغة أمة من الأمم قاطبة، وهو الذي وضع أساس علم النحو باستخراج مسائله وتعليله، وإمداده سيبويه من علم النحو بما صنف منه كتابه الذي هو زينة لدولة الإسلام كما يذكر القفطيّ، ثم هو الذي اخترع علم الموسيقى العربية وجمع فيه أصناف النغم.\nولكن لا ينبغي أن يفهم من وضع الخليل لعلم العروض أن العرب لم تكن\n\n', 'العنوان: تمهيد\nالمحتوى: تعرف أوزان الشعر من قبل، فالواقع أنهم كانوا قبل وضع علم العروض على علم بأوزان الشعر العربي وبحوره على تباينها، وإن لم تكن تعرفها بالأسماء التي وضعها الخليل لها فيما بعد. وما أشبه علمها بذلك بعلمها بالإعراب في الكلام حين كانوا عن سليقة يرفعون أو ينصبون أو يجرون ما حقه الرفع أو النصب أو الجر دون علم بما وضعه النحاة فيما بعد من مصطلحات الإعراب وقواعده.\nكذلك كانوا بذوقهم وسيلقتهم يدركون ما يعتور الأوزان المختلفة من زحافات وعلل وإن لم يعطوها أسماء ومصطلحات خاصة كما فعل العروضيون.\nوإذا كان الخليل بن أحمد غير مسبوق في وضع علم العروض، فإن أبا عمرو بن العلاء قد سبقه في الكلام عن القوافي وقواعدها ووضع لها أسماء ومصطلحات خاصة.\nوالرواة مختلفون بشأن الباعث الذي دعا الخليل إلى التفكير في علم العروض ووضع قواعده.\nفمن قائل:\nإنه دعا بمكة أن يرزقه الله علمًا لم يسبقه إليه أحد ولا يؤخذ إلا عنه، فرجع من حجه، ففتح عليه بعلم العروض1.\nومن قائل:\nإن الدافع هو إشفاقه من اتجاه بعض شعراء عصره إلى نظم الشعر على أوزان لم يعرفها العرب ولم تسمع عنهم؛ ولهذا راح يقضي الساعات والأيام يوقع بأصابعه ويحركها حتى حصر أوزان الشعر العربي وضبط أحوال قوافيه.\nومن قائل:\nإنه وجد نفسه وهو بمكة يعيش في بيئة يشيع فيها الغناء فدفعه ذلك إلى التفكير في الوزن الشعري وما يمكن أن يخضع له من قواعد\n\n', 'العنوان: تمهيد\nالمحتوى: وأصول. وقد عكف أيامًا وليالي يستعرض فيها ما روي من أشعار ذات أنغام موسيقية متعددة،\nثم خرج على الناس بقواعد مضبوطة وأصول محكمة سماها:\nعلم العروض.\nوأيًّا كان الدافع فالثابت أن الخليل هو واضع أصول علم العروض وقوانينه التي لم يطرأ تغيير جوهري عليها، وأن الناس ظلوا حتى اليوم يتدارسونها ويتفهمونها من غير أن يزيد عليها أحد شيئًا. فلا تزال الوحدات القياسية للأوزان هي التفعيلات التي اخترعها الخليل، ولا تزال المقاطع الصوتية التي تتألف منها التفعيلات هي الأسباب والأوتاد، كما أن عدد البحور لا يزال ثابتًا عند البحور الخمسة عشر التي وضعها الخليل وبحر الخبب أو المتدارك الذي وضعه تلميذه الأخفش الأوسط أبو الحسن سعيد بن مسعدة، ولا يرد علينا هنا بما استحدث من أوزان في العصر العباسي؛ لأن هذه يمكن إرجاع أصولها إلى أوزان الخليل.\nوتجدر الإشارة إلى أن هناك فارقًا ملحوظًا بين علم العروض وعلوم العربية الأخرى من حيث النشأة. فعلوم النحو والصرف والبلاغة واللغة مثلاً قد استحدثت ثم أخذت تنمو جيلاً بعد جيل وعصرًا بعد عصر حتى بلغت ذروة اكتمالها، أما العروض فقد أخرجه الخليل علمًا يكاد يكون متكاملاً، ولعل ذلك هو السر في أن من أتى بعد الخليل من العروضيين لم يستطيعوا أن يزيدوا على عروضه أي زيادة تذكر أو تمس الجوهر.\nوكما اختلفت الآراء بالنسبة إلى الباعث الذي دعا الخليل إلى التفكير في علم العروض، اختلفت كذلك بالنسبة إلى سبب تسمية هذا العلم بالعروض.\nفمن قائل:\nإن من معاني العروض مكة لاعتراضها وسط البلاد، ومن ثم أطلق الخليل على علم ميزان الشعر الذي اخترعه اسم المكان الذي ألهم فيه قواعده وأصوله.\n\n', 'العنوان: تمهيد\nالمحتوى: ومن قائل:\nإنه سمي عروضًا باسم عمان التي كان يقيم فيها واضعه ومخترعه الخليل بن أحمد. ويذكر صاحب لسان العرب أنه سمي عروضًا؛ لأن الشعر يعرض عليه،\nأي:\nيوزن بواسطته.\n2 الحاجة إلى علم العروض:\nعرفنا مما سبق أن العروض هو علم ميزان الشعر أو موسيقى الشعر، وهو علم له قواعده وأصوله ونظرياته التي تحصل وتكتسب بالتعلم، وإذا كان الشعر من الناحية العملية هو الجانب التطبيقي لقواعد العروض وأصوله ونظرياته، فإنه قبل ذلك فن كسائر الفنون مصدره الموهبة والاستعداد.\nوقد يستطيع الشاعر الموهوب بما له من أذن موسيقية وحس وذوق مرهفين أن يقول الشعر دون علم بالعروض وحاجة إلى قوانينه، ولكنه مع ذلك يظل بحاجة إلى دراسة علم العروض والإلمام بأصوله.\nفأذن الشاعر الموسيقية -مهما كانت درجة رهافتها وحساسيتها- قد تخذل صاحبها أحيانًا في التمييز بين الأوزان المتقاربة أو بين قافية سليمة وأخرى معيبة، أو بين زحاف جائز وآخر غير جائز.\nوجهل الشاعر الموهوب بأوزان الشعر وبحوره المختلفة من تامة ومجزوءة ومشطورة ومنهوكة قد يحصر شعره في بعض أوزان خاصة، وبذلك يحرم نفسه من العزف على أوتار شتى تجعل شعره منوع الأنغام والألحان من ذلك تتجلى أهمية دراسة الشاعر للعروض والإلمام بقوانينه وأصوله.\nوإذا كان العروض إلى هذا القدر لازمًا للشاعر الملهم الموهوب، فإنه يكون أشد لزومًا لغيره. فهو أشد لزومًا لطلاب اللغة والتخصص فيها؛ لأنه يعينهم على فهم الشعر العربي وقراءته قراءة صحيحة والتمييز بين سليمه ومختله وزنًا.\n\n', 'العنوان: تمهيد\nالمحتوى: وهو كذلك أشد لزومًا للدارسين والمتخصصين في فروع الثقافة العربية من تاريخ واجتماع وأدب وبلاغة ومذاهب دينية أو عقلية. فالباحثون في أمثال هذه العلوم العربية لا غنى لهم عن تفهم ما يرد من شعر في المراجع والكتب المختصة بهذه العلوم. وفهم أولئك للشعر متوقف على صحة قراءته، وهذه لا تتأتى إلا لمن لديه القدرة على معرفة صحيح الأوزان والتمييز بين أنواعها المختلفة.\nمن أجل ذلك كله ندرك ضرورة الإلمام بعلم العروض أو علم موسيقى الشعر وأصوله، لا بالنسبة للشعراء فحسب، ولكن بالنسبة أيضًا لذوي التخصص في علوم العربية. وإذا جاز أن يغتفر لغير متخصص ألا يقيم وزن الشعر وألا يقرأه قراءة صحيحة، فإن ذلك لا يمكن أن يغتفر مطلقًا للمتخصص.\n3 الصلة بين العروض والموسيقى:\nعرفنا أن العروض هو علم موسيقى الشعر، وعلى ذلك يكون هناك صلة تجمع بينه وبين الموسيقى بصفة عامة، وهذه الصلة تتمثل في الجانب الصوتي.\nفالموسيقى تقوم على تقسيم الجمل إلى مقاطع صوتية تختلف طولاً وقصرًا، أو إلى وحدات صوتية معينة على نسق معين، بغض النظر عن بداية الكلمات ونهايتها.\nوكذلك شأن العروض، فالبيت من الشعر يقسم إلى وحدات صوتية معينة، أو إلى مقاطع صوتية تعرف بالتفاعيل بقطع النظر عن بداية الكلمات ونهايتها. فقد ينتهي المقطع الصوتي أو التفعيلة في آخر كلمة، وقد ينتهي في وسطها، وقد يبدأ من نهاية كلمة وينتهي ببدء الكلمة التي تليها.\nوهاكم مثالاً على ذلك:\nلا تسألي القوم ما مالي وما حسبي ... وسائلي للقوم ما حزمي وما خلقي\n\n', 'العنوان: تمهيد\nالمحتوى: فتقطيع هذا البيت أو تقسيمه إلى وحدات صوتية أو تفاعيل يكون كالآتي:\nلا تَسْأَلِلْ قَومَ مَا مَالِي َمَاحَسَبِي ... مستفعلن فاعلن مستفعلن فعلن\nوَسَائِلِلْ قَومَ ما حَزْمِي وَمَا خُلُقِي ... متفعلن فاعلن مستفعلن فعلن\nولكن تقطيع البيت أو تقسيمه إلى وحدات صوتية أو تفاعيل لا يتحقق إلا إذا كتب الشعر كتابة عروضية فما الكتابة العروضية؟\n4 الكتابة العروضية.\nأوضحنا فيما سبق الصلة الوثيقة التي بين العروض والموسيقى، وهي صلة الفرع المتولد من الأصل، فالعروض في الحقيقة أمره ليس إلا ضربًا من الموسيقى اختص بالشعر على أنه مقوم من مقوماته.\nوإذا كان للموسيقى عند كتابتها رموز خاصة يدل بها على الأنغام المختلفة، فإن للعروض كذلك رموزًا خاصة به في الكتابة تخالف الكتابة الإملائية التي تكون على حسب قواعد الإملاء المتعارف عليها. وهذه الرموز العروضية يدل بها على التفاعيل التي هي بمثابة أنغام الموسيقي المختلفة.\nوالكتابة العروضية تقوم على أمرين أساسيين هما:\n1 ما ينطق يكتب.\n2 ما لا ينطق لا يكتب.\nوتحقيق هذين الأمرين عند الكتابة العروضية يستلزم زيادة بعض أحرف\n\n', 'العنوان: تمهيد\nالمحتوى: لا تكتب إملائيًا وحذف بعض أحرف تكتب إملائيًا.\nوفيما يلي تفصيل للأحرف التي تزاد أوتحذف في الكتابة العروضية:\nأ-\nالحروف التي تزاد:\nتزاد في الكتابة العروضية ستة أحرف هي:\n1 إذا كان الحرف مشددًا فك التشديد ورسم الحرف أو كتب مرتين:\nمرة ساكنًا ومرة متحركًا،\nنحو:\nرق، وعد، وهز،\nفتكتب عروضيًّا:\nرقق، وعدد، وهزز.\n2 إذا كان الحرف منونًا كتب التنوين نونًا،\nنحو:\nجبل، وشجر، وأسد،\nفتكتب عروضيًّا:\nجبلن، وشجرن، وأسدن، رفعًا ونصبًا وجرًّا.\n3 تزاد ألف في بعض أسماء الإشارة،\nنحو:\nهذا، وهذه، وهذان، وهذين، وهؤلاء، وذلك،\nفتكتب عروضيًّا:\nهاذا، وهاذه، وهاذان، وهاذين، وهاؤلاء، وذالك. كذلك تزاد ألف في لفظ الجلالة، وفي لكن المخففة والمشددة،\nفهذه الكلمات:\nالله، ولكن، ولكن،\nتكتب عروضيًّا هكذا:\nاللاه، ولاكن، ولاكنن.\n4 تزاد واو في بعض الأسماء كما في:\nداود، وطاوس، وناوس،\nفتكتب عروضيًّا:\nداوود، وطاووس، وناووس.\n5 تكتب حركة حرف القافية حرفًا مجانسًا للحركة، فإذا كانت حركة حرف القافية ضمة كتبت هذه الضمة عروضيًّا واوًا، وإذا كانت كسرة كتبت ياء، وإذا كانت فتحة كتبت ألفًا.\n6 إذا أشبعت حركة هاء الضمير للمفرد المذكر الغائب، كتبت\n\n', 'العنوان: تمهيد\nالمحتوى: حرفًا مجانسًا للحركة.\nفالضمة التي على الهاء في:\nله، ومنه، وعنه،\nإذا أشبعت كتبت عروضيًّا واوًا هكذا:\nلهو، ومنهو، وعنهو.\nوكسرة الهاء في:\nبه وإليه، وفيه،\nإذا أشبعت كتبت عروضيًّا هكذا:\nبهي، وإليهي، وفيهي.\nأما كاف المخاطب أو المخاطبة فلا تشبع، وبالتالي لا يزاد بعدها أي حرف،\nنحو:\nبك، وبكِ، ومنك ومنكِ، وإليك وإليكِ.\nب-\nالأحرف التي تحذف:\n1 تحذف همزة الوصل، وهي الألف التي يتوصل بها إلى النطق بالساكن، إن كان قبلها متحرك.\nويكون ذلك في:\nأ- ماضي الأفعال الخماسية والسداسية المبدوءة بالهمزة، وفي أمرها ومصدرها،\nنحو:\nانْطَلَق، استغْفَر، انطلِق، استغفِر، انطلاق، استغفار.\nفألف الوصل في هذه الكلمات وأمثالها تحذف إن كان قبلها متحرك عند الكتابة العروضية هكذا:\nفنطلَق، فستغفَر، فنطلِق فستغفِر، فنطلاق، فستغفار.\nب-\nالأسماء العشرة المسموعة وهي:\nاسم، ابن، ابنة، امرؤ، امرأة، اثنان، اثنتان، أيمن المختصة بالقسم، است.\nفمثلاً:\nباسمك، وهذا أب وابن، والعام اثنا عشر شهرًا،\nتكتب عروضيًّا هكذا:\nبسمك، وهاذا أبن وبنن، والعام ثنا عشر شهرن.\nج- أمر الفعل الثلاثي الساكن ثاني مضارعه،\nنحو:\nفاسمع واكتب واقرأ،\nفإنها تكتب عروضيًّا هكذا:\nفسمعْ، وكتبْ، وقرأْ.\nد- ألف الوصل من أل المعرفة. فإذا كانت أل قمرية، كما\n\n']", مؤسس علم العروض هو الخليل بن أحمد الفراهيدي، وهو أحد أئمة اللغة والأدب في القرن الثاني الهجري. يعتبر الخليل بن أحمد مبتكر هذا العلم الذي يهتم بدراسة الأوزان المعتبرة في الشعر العربي وتحديد قواعدها وأصولها. ,مؤسس علم العروض هو الخليل بن أحمد الفراهيدي.,1.0,0.57,1.0,0.9263895408654663
ما معنى التفعيلة في الشعر؟,"['العنوان: مقدمة\nالمحتوى: بسم الله الرحمن الرحيم هذه محاضرات في علم العروض والقافية ألقيتها على طلبة الصف الأول بقسم اللغة العربية في جامعة بيروت العربية.\nوقد حاولت جهدي عرض قضايا هذا العلم على نحو ييسر على دارسيه تفهمه والإلمام بأهم مصطلحاته وجوانبه التي لها أثر في موسيقي الشعر.\nولما كان تمثل الدارس للجانب النظري من هذا العلم لا يتم إلا إذا كان معززًا بالجانب التطبيقي، فقد أكثرت من الأمثلة والشواهد المختارة من قديم الشعر وحديثه.\nوعسى أن يجد القارئ في هذا الجهد المتواضع عونًا له على إدراك موسيقى الشعر ممثلة في أوزانه وقوافيه وكل ما يتصل بهما.\nالمؤلف\n\n', 'العنوان: تمهيد\nالمحتوى: 1 العروض والخليل بن أحمد:\nالعروض:\n""علم يُبْحث فيه عن أحوال الأوزان المعتبرة""\n1 أو\n""هو ميزان الشعر، به يعرف مكسوره من موزونه، كما أن النحو معيار الكلام به يعرف معربه من ملحونه""\n2.\nويرجع رجال التراجم الفضل في نشأة علم العروض إلى الخليل بن أحمد، أحد أئمة اللغة والأدب في القرن الثاني الهجري، فابن خلكان يذكر أن الخليل كان إمامًا في علم النحو، وأنه هو الذي استنبط علم العروض وأخرجه إلى الوجود وحصر أقسامه في خمس دوائر يستخرج منها خمسة عشر بحرًا، ثم زاد الأخفش بحرًا واحدًا وسماه الخبب، كما يذكر أن الخليل كان له معرفة بالإيقاع والنغم، وتلك المعرفة أحدثت له علم العروض، فإنهما متقاربان في المأخذ 3\n\n', 'العنوان: تمهيد\nالمحتوى: ويحدثنا ياقوت عن الخليل بن أحمد بأنه أول من استخرج العروض وضبط اللغة وحصر أشعار العرب، وأن معرفته بالإيقاع -بناء ألحان الغناء على موقعها وميزانها- هي التي أحدثت له علم العروض1.\nكذلك يحدثنا القفطيّ عن الخليل بأنه سيد الأدباء في علمه وزهده، وأنه نحويّ لغويّ عروضيّ، استنبط من العروض وعلله ما لم يستخرجه أحد، ولم يسبقه إلى علمه سابق من العلماء كلهم2.\nوروى ابن خلكان عن حمزة بن الحسن الأصفهاني نقلاً عن كتابه التنبيه على حدوث التصحيف.\nقوله:\nإن دولة الإسلام لم تخرج أبدع للعلوم التي لم يكن لها عند العرب أصول من الخليل، وليس على ذلك برهان أوضح من علم العروض الذي لا عن حكيم أخذه، ولا على مثال تقدمه احتذاه، وإنما اخترعه من ممر له بالصفارين، من وقع مطرقة على طست.\nمن ذلك يرى أن الخليل هو أول مبتكر لعلم العروض وحصر كل أشعار العرب في بحوره. ولم تقف عقليته المبتكرة عند هذا الحد، وإنما تجاوزته إلى ابتكار علوم أخرى، فهو أول مبتكر لفكرة المعاجم العربية بوضعه معجم العين، الذي يحصر لغة أمة من الأمم قاطبة، وهو الذي وضع أساس علم النحو باستخراج مسائله وتعليله، وإمداده سيبويه من علم النحو بما صنف منه كتابه الذي هو زينة لدولة الإسلام كما يذكر القفطيّ، ثم هو الذي اخترع علم الموسيقى العربية وجمع فيه أصناف النغم.\nولكن لا ينبغي أن يفهم من وضع الخليل لعلم العروض أن العرب لم تكن\n\n', 'العنوان: تمهيد\nالمحتوى: تعرف أوزان الشعر من قبل، فالواقع أنهم كانوا قبل وضع علم العروض على علم بأوزان الشعر العربي وبحوره على تباينها، وإن لم تكن تعرفها بالأسماء التي وضعها الخليل لها فيما بعد. وما أشبه علمها بذلك بعلمها بالإعراب في الكلام حين كانوا عن سليقة يرفعون أو ينصبون أو يجرون ما حقه الرفع أو النصب أو الجر دون علم بما وضعه النحاة فيما بعد من مصطلحات الإعراب وقواعده.\nكذلك كانوا بذوقهم وسيلقتهم يدركون ما يعتور الأوزان المختلفة من زحافات وعلل وإن لم يعطوها أسماء ومصطلحات خاصة كما فعل العروضيون.\nوإذا كان الخليل بن أحمد غير مسبوق في وضع علم العروض، فإن أبا عمرو بن العلاء قد سبقه في الكلام عن القوافي وقواعدها ووضع لها أسماء ومصطلحات خاصة.\nوالرواة مختلفون بشأن الباعث الذي دعا الخليل إلى التفكير في علم العروض ووضع قواعده.\nفمن قائل:\nإنه دعا بمكة أن يرزقه الله علمًا لم يسبقه إليه أحد ولا يؤخذ إلا عنه، فرجع من حجه، ففتح عليه بعلم العروض1.\nومن قائل:\nإن الدافع هو إشفاقه من اتجاه بعض شعراء عصره إلى نظم الشعر على أوزان لم يعرفها العرب ولم تسمع عنهم؛ ولهذا راح يقضي الساعات والأيام يوقع بأصابعه ويحركها حتى حصر أوزان الشعر العربي وضبط أحوال قوافيه.\nومن قائل:\nإنه وجد نفسه وهو بمكة يعيش في بيئة يشيع فيها الغناء فدفعه ذلك إلى التفكير في الوزن الشعري وما يمكن أن يخضع له من قواعد\n\n', 'العنوان: تمهيد\nالمحتوى: وأصول. وقد عكف أيامًا وليالي يستعرض فيها ما روي من أشعار ذات أنغام موسيقية متعددة،\nثم خرج على الناس بقواعد مضبوطة وأصول محكمة سماها:\nعلم العروض.\nوأيًّا كان الدافع فالثابت أن الخليل هو واضع أصول علم العروض وقوانينه التي لم يطرأ تغيير جوهري عليها، وأن الناس ظلوا حتى اليوم يتدارسونها ويتفهمونها من غير أن يزيد عليها أحد شيئًا. فلا تزال الوحدات القياسية للأوزان هي التفعيلات التي اخترعها الخليل، ولا تزال المقاطع الصوتية التي تتألف منها التفعيلات هي الأسباب والأوتاد، كما أن عدد البحور لا يزال ثابتًا عند البحور الخمسة عشر التي وضعها الخليل وبحر الخبب أو المتدارك الذي وضعه تلميذه الأخفش الأوسط أبو الحسن سعيد بن مسعدة، ولا يرد علينا هنا بما استحدث من أوزان في العصر العباسي؛ لأن هذه يمكن إرجاع أصولها إلى أوزان الخليل.\nوتجدر الإشارة إلى أن هناك فارقًا ملحوظًا بين علم العروض وعلوم العربية الأخرى من حيث النشأة. فعلوم النحو والصرف والبلاغة واللغة مثلاً قد استحدثت ثم أخذت تنمو جيلاً بعد جيل وعصرًا بعد عصر حتى بلغت ذروة اكتمالها، أما العروض فقد أخرجه الخليل علمًا يكاد يكون متكاملاً، ولعل ذلك هو السر في أن من أتى بعد الخليل من العروضيين لم يستطيعوا أن يزيدوا على عروضه أي زيادة تذكر أو تمس الجوهر.\nوكما اختلفت الآراء بالنسبة إلى الباعث الذي دعا الخليل إلى التفكير في علم العروض، اختلفت كذلك بالنسبة إلى سبب تسمية هذا العلم بالعروض.\nفمن قائل:\nإن من معاني العروض مكة لاعتراضها وسط البلاد، ومن ثم أطلق الخليل على علم ميزان الشعر الذي اخترعه اسم المكان الذي ألهم فيه قواعده وأصوله.\n\n', 'العنوان: تمهيد\nالمحتوى: ومن قائل:\nإنه سمي عروضًا باسم عمان التي كان يقيم فيها واضعه ومخترعه الخليل بن أحمد. ويذكر صاحب لسان العرب أنه سمي عروضًا؛ لأن الشعر يعرض عليه،\nأي:\nيوزن بواسطته.\n2 الحاجة إلى علم العروض:\nعرفنا مما سبق أن العروض هو علم ميزان الشعر أو موسيقى الشعر، وهو علم له قواعده وأصوله ونظرياته التي تحصل وتكتسب بالتعلم، وإذا كان الشعر من الناحية العملية هو الجانب التطبيقي لقواعد العروض وأصوله ونظرياته، فإنه قبل ذلك فن كسائر الفنون مصدره الموهبة والاستعداد.\nوقد يستطيع الشاعر الموهوب بما له من أذن موسيقية وحس وذوق مرهفين أن يقول الشعر دون علم بالعروض وحاجة إلى قوانينه، ولكنه مع ذلك يظل بحاجة إلى دراسة علم العروض والإلمام بأصوله.\nفأذن الشاعر الموسيقية -مهما كانت درجة رهافتها وحساسيتها- قد تخذل صاحبها أحيانًا في التمييز بين الأوزان المتقاربة أو بين قافية سليمة وأخرى معيبة، أو بين زحاف جائز وآخر غير جائز.\nوجهل الشاعر الموهوب بأوزان الشعر وبحوره المختلفة من تامة ومجزوءة ومشطورة ومنهوكة قد يحصر شعره في بعض أوزان خاصة، وبذلك يحرم نفسه من العزف على أوتار شتى تجعل شعره منوع الأنغام والألحان من ذلك تتجلى أهمية دراسة الشاعر للعروض والإلمام بقوانينه وأصوله.\nوإذا كان العروض إلى هذا القدر لازمًا للشاعر الملهم الموهوب، فإنه يكون أشد لزومًا لغيره. فهو أشد لزومًا لطلاب اللغة والتخصص فيها؛ لأنه يعينهم على فهم الشعر العربي وقراءته قراءة صحيحة والتمييز بين سليمه ومختله وزنًا.\n\n', 'العنوان: تمهيد\nالمحتوى: وهو كذلك أشد لزومًا للدارسين والمتخصصين في فروع الثقافة العربية من تاريخ واجتماع وأدب وبلاغة ومذاهب دينية أو عقلية. فالباحثون في أمثال هذه العلوم العربية لا غنى لهم عن تفهم ما يرد من شعر في المراجع والكتب المختصة بهذه العلوم. وفهم أولئك للشعر متوقف على صحة قراءته، وهذه لا تتأتى إلا لمن لديه القدرة على معرفة صحيح الأوزان والتمييز بين أنواعها المختلفة.\nمن أجل ذلك كله ندرك ضرورة الإلمام بعلم العروض أو علم موسيقى الشعر وأصوله، لا بالنسبة للشعراء فحسب، ولكن بالنسبة أيضًا لذوي التخصص في علوم العربية. وإذا جاز أن يغتفر لغير متخصص ألا يقيم وزن الشعر وألا يقرأه قراءة صحيحة، فإن ذلك لا يمكن أن يغتفر مطلقًا للمتخصص.\n3 الصلة بين العروض والموسيقى:\nعرفنا أن العروض هو علم موسيقى الشعر، وعلى ذلك يكون هناك صلة تجمع بينه وبين الموسيقى بصفة عامة، وهذه الصلة تتمثل في الجانب الصوتي.\nفالموسيقى تقوم على تقسيم الجمل إلى مقاطع صوتية تختلف طولاً وقصرًا، أو إلى وحدات صوتية معينة على نسق معين، بغض النظر عن بداية الكلمات ونهايتها.\nوكذلك شأن العروض، فالبيت من الشعر يقسم إلى وحدات صوتية معينة، أو إلى مقاطع صوتية تعرف بالتفاعيل بقطع النظر عن بداية الكلمات ونهايتها. فقد ينتهي المقطع الصوتي أو التفعيلة في آخر كلمة، وقد ينتهي في وسطها، وقد يبدأ من نهاية كلمة وينتهي ببدء الكلمة التي تليها.\nوهاكم مثالاً على ذلك:\nلا تسألي القوم ما مالي وما حسبي ... وسائلي للقوم ما حزمي وما خلقي\n\n', 'العنوان: تمهيد\nالمحتوى: فتقطيع هذا البيت أو تقسيمه إلى وحدات صوتية أو تفاعيل يكون كالآتي:\nلا تَسْأَلِلْ قَومَ مَا مَالِي َمَاحَسَبِي ... مستفعلن فاعلن مستفعلن فعلن\nوَسَائِلِلْ قَومَ ما حَزْمِي وَمَا خُلُقِي ... متفعلن فاعلن مستفعلن فعلن\nولكن تقطيع البيت أو تقسيمه إلى وحدات صوتية أو تفاعيل لا يتحقق إلا إذا كتب الشعر كتابة عروضية فما الكتابة العروضية؟\n4 الكتابة العروضية.\nأوضحنا فيما سبق الصلة الوثيقة التي بين العروض والموسيقى، وهي صلة الفرع المتولد من الأصل، فالعروض في الحقيقة أمره ليس إلا ضربًا من الموسيقى اختص بالشعر على أنه مقوم من مقوماته.\nوإذا كان للموسيقى عند كتابتها رموز خاصة يدل بها على الأنغام المختلفة، فإن للعروض كذلك رموزًا خاصة به في الكتابة تخالف الكتابة الإملائية التي تكون على حسب قواعد الإملاء المتعارف عليها. وهذه الرموز العروضية يدل بها على التفاعيل التي هي بمثابة أنغام الموسيقي المختلفة.\nوالكتابة العروضية تقوم على أمرين أساسيين هما:\n1 ما ينطق يكتب.\n2 ما لا ينطق لا يكتب.\nوتحقيق هذين الأمرين عند الكتابة العروضية يستلزم زيادة بعض أحرف\n\n', 'العنوان: تمهيد\nالمحتوى: لا تكتب إملائيًا وحذف بعض أحرف تكتب إملائيًا.\nوفيما يلي تفصيل للأحرف التي تزاد أوتحذف في الكتابة العروضية:\nأ-\nالحروف التي تزاد:\nتزاد في الكتابة العروضية ستة أحرف هي:\n1 إذا كان الحرف مشددًا فك التشديد ورسم الحرف أو كتب مرتين:\nمرة ساكنًا ومرة متحركًا،\nنحو:\nرق، وعد، وهز،\nفتكتب عروضيًّا:\nرقق، وعدد، وهزز.\n2 إذا كان الحرف منونًا كتب التنوين نونًا،\nنحو:\nجبل، وشجر، وأسد،\nفتكتب عروضيًّا:\nجبلن، وشجرن، وأسدن، رفعًا ونصبًا وجرًّا.\n3 تزاد ألف في بعض أسماء الإشارة،\nنحو:\nهذا، وهذه، وهذان، وهذين، وهؤلاء، وذلك،\nفتكتب عروضيًّا:\nهاذا، وهاذه، وهاذان، وهاذين، وهاؤلاء، وذالك. كذلك تزاد ألف في لفظ الجلالة، وفي لكن المخففة والمشددة،\nفهذه الكلمات:\nالله، ولكن، ولكن،\nتكتب عروضيًّا هكذا:\nاللاه، ولاكن، ولاكنن.\n4 تزاد واو في بعض الأسماء كما في:\nداود، وطاوس، وناوس،\nفتكتب عروضيًّا:\nداوود، وطاووس، وناووس.\n5 تكتب حركة حرف القافية حرفًا مجانسًا للحركة، فإذا كانت حركة حرف القافية ضمة كتبت هذه الضمة عروضيًّا واوًا، وإذا كانت كسرة كتبت ياء، وإذا كانت فتحة كتبت ألفًا.\n6 إذا أشبعت حركة هاء الضمير للمفرد المذكر الغائب، كتبت\n\n', 'العنوان: تمهيد\nالمحتوى: حرفًا مجانسًا للحركة.\nفالضمة التي على الهاء في:\nله، ومنه، وعنه،\nإذا أشبعت كتبت عروضيًّا واوًا هكذا:\nلهو، ومنهو، وعنهو.\nوكسرة الهاء في:\nبه وإليه، وفيه،\nإذا أشبعت كتبت عروضيًّا هكذا:\nبهي، وإليهي، وفيهي.\nأما كاف المخاطب أو المخاطبة فلا تشبع، وبالتالي لا يزاد بعدها أي حرف،\nنحو:\nبك، وبكِ، ومنك ومنكِ، وإليك وإليكِ.\nب-\nالأحرف التي تحذف:\n1 تحذف همزة الوصل، وهي الألف التي يتوصل بها إلى النطق بالساكن، إن كان قبلها متحرك.\nويكون ذلك في:\nأ- ماضي الأفعال الخماسية والسداسية المبدوءة بالهمزة، وفي أمرها ومصدرها،\nنحو:\nانْطَلَق، استغْفَر، انطلِق، استغفِر، انطلاق، استغفار.\nفألف الوصل في هذه الكلمات وأمثالها تحذف إن كان قبلها متحرك عند الكتابة العروضية هكذا:\nفنطلَق، فستغفَر، فنطلِق فستغفِر، فنطلاق، فستغفار.\nب-\nالأسماء العشرة المسموعة وهي:\nاسم، ابن، ابنة، امرؤ، امرأة، اثنان، اثنتان، أيمن المختصة بالقسم، است.\nفمثلاً:\nباسمك، وهذا أب وابن، والعام اثنا عشر شهرًا،\nتكتب عروضيًّا هكذا:\nبسمك، وهاذا أبن وبنن، والعام ثنا عشر شهرن.\nج- أمر الفعل الثلاثي الساكن ثاني مضارعه،\nنحو:\nفاسمع واكتب واقرأ،\nفإنها تكتب عروضيًّا هكذا:\nفسمعْ، وكتبْ، وقرأْ.\nد- ألف الوصل من أل المعرفة. فإذا كانت أل قمرية، كما\n\n']"," التفعيلة في الشعر العربي هي وحدة أساسية تتكون من مجموعة من الحركات والسكون. تعتبر التفعيلة جزءًا من العروض، وهو علم يهتم بدراسة الأوزان الشعرية والموسيقى في الشعر العربي.

تتكون التفعيلة من مجموعة من المقاطع الصوتية التي تتنوع بين الحركات (فتحة، ضمة، كسرة) والسكون. تُستخدم التفعيلات لتحديد الأوزان الشعرية وتنظيم الإيقاع في القصائد.

في الشعر العربي، هناك عدة أنواع من التفعيلات، وأشهرها هي:

1. فعولن (فعولُن): تتكون من مقطعين: متحرك وساكن، مثل: ""فعولُن"" في بحر الطويل.
2. مفاعيلن (مَفاعِيلُن): تتكون من ثلاثة مقاطع: متحرك وساكن ومتحرك وساكن، مثل: ""مَفاعِيلُن"" في بحر الطويل.
3. مستفعلن (مُسْتَفْعِلُن): تتكون من أربعة مقاطع: متحرك وساكن ومتحرك وساكن ومتحرك وساكن، مثل: ""مُسْتَفْعِلُن"" في بحر البسيط.
4. فاعلن (فاعِلُن): تتكون من ثلاثة مقاطع: متحرك وساكن ومتحرك وساكن، مثل: ""فاعِلُن"" في بحر الرجز.

تختلف التفعيلات بناءً على البحر الشعري الذي تنتمي إليه، ولكل بحر مجموعة محددة من التفعيلات التي تميزه عن غيره من البحور.

عند كتابة الشعر العربي، يتم استخدام الكتابة العروضية لتمثيل التفعيلات بشكل دقيق. في الكتابة العروضية، يتم تمثيل الحركات والسكون بواسطة رموز خاصة، مما يساعد على تحليل الأوزان الشعرية وفهم الإيقاع الموسيقي للقصيدة. ",التفعيلة هي الوحدة الوزنية الأساسية التي يتكون منها البيت الشعري.,1.0,0.08,,0.8738939586895947
ما هي البحور الشعرية؟,"['العنوان: مقدمة\nالمحتوى: بسم الله الرحمن الرحيم هذه محاضرات في علم العروض والقافية ألقيتها على طلبة الصف الأول بقسم اللغة العربية في جامعة بيروت العربية.\nوقد حاولت جهدي عرض قضايا هذا العلم على نحو ييسر على دارسيه تفهمه والإلمام بأهم مصطلحاته وجوانبه التي لها أثر في موسيقي الشعر.\nولما كان تمثل الدارس للجانب النظري من هذا العلم لا يتم إلا إذا كان معززًا بالجانب التطبيقي، فقد أكثرت من الأمثلة والشواهد المختارة من قديم الشعر وحديثه.\nوعسى أن يجد القارئ في هذا الجهد المتواضع عونًا له على إدراك موسيقى الشعر ممثلة في أوزانه وقوافيه وكل ما يتصل بهما.\nالمؤلف\n\n', 'العنوان: تمهيد\nالمحتوى: 1 العروض والخليل بن أحمد:\nالعروض:\n""علم يُبْحث فيه عن أحوال الأوزان المعتبرة""\n1 أو\n""هو ميزان الشعر، به يعرف مكسوره من موزونه، كما أن النحو معيار الكلام به يعرف معربه من ملحونه""\n2.\nويرجع رجال التراجم الفضل في نشأة علم العروض إلى الخليل بن أحمد، أحد أئمة اللغة والأدب في القرن الثاني الهجري، فابن خلكان يذكر أن الخليل كان إمامًا في علم النحو، وأنه هو الذي استنبط علم العروض وأخرجه إلى الوجود وحصر أقسامه في خمس دوائر يستخرج منها خمسة عشر بحرًا، ثم زاد الأخفش بحرًا واحدًا وسماه الخبب، كما يذكر أن الخليل كان له معرفة بالإيقاع والنغم، وتلك المعرفة أحدثت له علم العروض، فإنهما متقاربان في المأخذ 3\n\n', 'العنوان: تمهيد\nالمحتوى: ويحدثنا ياقوت عن الخليل بن أحمد بأنه أول من استخرج العروض وضبط اللغة وحصر أشعار العرب، وأن معرفته بالإيقاع -بناء ألحان الغناء على موقعها وميزانها- هي التي أحدثت له علم العروض1.\nكذلك يحدثنا القفطيّ عن الخليل بأنه سيد الأدباء في علمه وزهده، وأنه نحويّ لغويّ عروضيّ، استنبط من العروض وعلله ما لم يستخرجه أحد، ولم يسبقه إلى علمه سابق من العلماء كلهم2.\nوروى ابن خلكان عن حمزة بن الحسن الأصفهاني نقلاً عن كتابه التنبيه على حدوث التصحيف.\nقوله:\nإن دولة الإسلام لم تخرج أبدع للعلوم التي لم يكن لها عند العرب أصول من الخليل، وليس على ذلك برهان أوضح من علم العروض الذي لا عن حكيم أخذه، ولا على مثال تقدمه احتذاه، وإنما اخترعه من ممر له بالصفارين، من وقع مطرقة على طست.\nمن ذلك يرى أن الخليل هو أول مبتكر لعلم العروض وحصر كل أشعار العرب في بحوره. ولم تقف عقليته المبتكرة عند هذا الحد، وإنما تجاوزته إلى ابتكار علوم أخرى، فهو أول مبتكر لفكرة المعاجم العربية بوضعه معجم العين، الذي يحصر لغة أمة من الأمم قاطبة، وهو الذي وضع أساس علم النحو باستخراج مسائله وتعليله، وإمداده سيبويه من علم النحو بما صنف منه كتابه الذي هو زينة لدولة الإسلام كما يذكر القفطيّ، ثم هو الذي اخترع علم الموسيقى العربية وجمع فيه أصناف النغم.\nولكن لا ينبغي أن يفهم من وضع الخليل لعلم العروض أن العرب لم تكن\n\n', 'العنوان: تمهيد\nالمحتوى: تعرف أوزان الشعر من قبل، فالواقع أنهم كانوا قبل وضع علم العروض على علم بأوزان الشعر العربي وبحوره على تباينها، وإن لم تكن تعرفها بالأسماء التي وضعها الخليل لها فيما بعد. وما أشبه علمها بذلك بعلمها بالإعراب في الكلام حين كانوا عن سليقة يرفعون أو ينصبون أو يجرون ما حقه الرفع أو النصب أو الجر دون علم بما وضعه النحاة فيما بعد من مصطلحات الإعراب وقواعده.\nكذلك كانوا بذوقهم وسيلقتهم يدركون ما يعتور الأوزان المختلفة من زحافات وعلل وإن لم يعطوها أسماء ومصطلحات خاصة كما فعل العروضيون.\nوإذا كان الخليل بن أحمد غير مسبوق في وضع علم العروض، فإن أبا عمرو بن العلاء قد سبقه في الكلام عن القوافي وقواعدها ووضع لها أسماء ومصطلحات خاصة.\nوالرواة مختلفون بشأن الباعث الذي دعا الخليل إلى التفكير في علم العروض ووضع قواعده.\nفمن قائل:\nإنه دعا بمكة أن يرزقه الله علمًا لم يسبقه إليه أحد ولا يؤخذ إلا عنه، فرجع من حجه، ففتح عليه بعلم العروض1.\nومن قائل:\nإن الدافع هو إشفاقه من اتجاه بعض شعراء عصره إلى نظم الشعر على أوزان لم يعرفها العرب ولم تسمع عنهم؛ ولهذا راح يقضي الساعات والأيام يوقع بأصابعه ويحركها حتى حصر أوزان الشعر العربي وضبط أحوال قوافيه.\nومن قائل:\nإنه وجد نفسه وهو بمكة يعيش في بيئة يشيع فيها الغناء فدفعه ذلك إلى التفكير في الوزن الشعري وما يمكن أن يخضع له من قواعد\n\n', 'العنوان: تمهيد\nالمحتوى: وأصول. وقد عكف أيامًا وليالي يستعرض فيها ما روي من أشعار ذات أنغام موسيقية متعددة،\nثم خرج على الناس بقواعد مضبوطة وأصول محكمة سماها:\nعلم العروض.\nوأيًّا كان الدافع فالثابت أن الخليل هو واضع أصول علم العروض وقوانينه التي لم يطرأ تغيير جوهري عليها، وأن الناس ظلوا حتى اليوم يتدارسونها ويتفهمونها من غير أن يزيد عليها أحد شيئًا. فلا تزال الوحدات القياسية للأوزان هي التفعيلات التي اخترعها الخليل، ولا تزال المقاطع الصوتية التي تتألف منها التفعيلات هي الأسباب والأوتاد، كما أن عدد البحور لا يزال ثابتًا عند البحور الخمسة عشر التي وضعها الخليل وبحر الخبب أو المتدارك الذي وضعه تلميذه الأخفش الأوسط أبو الحسن سعيد بن مسعدة، ولا يرد علينا هنا بما استحدث من أوزان في العصر العباسي؛ لأن هذه يمكن إرجاع أصولها إلى أوزان الخليل.\nوتجدر الإشارة إلى أن هناك فارقًا ملحوظًا بين علم العروض وعلوم العربية الأخرى من حيث النشأة. فعلوم النحو والصرف والبلاغة واللغة مثلاً قد استحدثت ثم أخذت تنمو جيلاً بعد جيل وعصرًا بعد عصر حتى بلغت ذروة اكتمالها، أما العروض فقد أخرجه الخليل علمًا يكاد يكون متكاملاً، ولعل ذلك هو السر في أن من أتى بعد الخليل من العروضيين لم يستطيعوا أن يزيدوا على عروضه أي زيادة تذكر أو تمس الجوهر.\nوكما اختلفت الآراء بالنسبة إلى الباعث الذي دعا الخليل إلى التفكير في علم العروض، اختلفت كذلك بالنسبة إلى سبب تسمية هذا العلم بالعروض.\nفمن قائل:\nإن من معاني العروض مكة لاعتراضها وسط البلاد، ومن ثم أطلق الخليل على علم ميزان الشعر الذي اخترعه اسم المكان الذي ألهم فيه قواعده وأصوله.\n\n', 'العنوان: تمهيد\nالمحتوى: ومن قائل:\nإنه سمي عروضًا باسم عمان التي كان يقيم فيها واضعه ومخترعه الخليل بن أحمد. ويذكر صاحب لسان العرب أنه سمي عروضًا؛ لأن الشعر يعرض عليه،\nأي:\nيوزن بواسطته.\n2 الحاجة إلى علم العروض:\nعرفنا مما سبق أن العروض هو علم ميزان الشعر أو موسيقى الشعر، وهو علم له قواعده وأصوله ونظرياته التي تحصل وتكتسب بالتعلم، وإذا كان الشعر من الناحية العملية هو الجانب التطبيقي لقواعد العروض وأصوله ونظرياته، فإنه قبل ذلك فن كسائر الفنون مصدره الموهبة والاستعداد.\nوقد يستطيع الشاعر الموهوب بما له من أذن موسيقية وحس وذوق مرهفين أن يقول الشعر دون علم بالعروض وحاجة إلى قوانينه، ولكنه مع ذلك يظل بحاجة إلى دراسة علم العروض والإلمام بأصوله.\nفأذن الشاعر الموسيقية -مهما كانت درجة رهافتها وحساسيتها- قد تخذل صاحبها أحيانًا في التمييز بين الأوزان المتقاربة أو بين قافية سليمة وأخرى معيبة، أو بين زحاف جائز وآخر غير جائز.\nوجهل الشاعر الموهوب بأوزان الشعر وبحوره المختلفة من تامة ومجزوءة ومشطورة ومنهوكة قد يحصر شعره في بعض أوزان خاصة، وبذلك يحرم نفسه من العزف على أوتار شتى تجعل شعره منوع الأنغام والألحان من ذلك تتجلى أهمية دراسة الشاعر للعروض والإلمام بقوانينه وأصوله.\nوإذا كان العروض إلى هذا القدر لازمًا للشاعر الملهم الموهوب، فإنه يكون أشد لزومًا لغيره. فهو أشد لزومًا لطلاب اللغة والتخصص فيها؛ لأنه يعينهم على فهم الشعر العربي وقراءته قراءة صحيحة والتمييز بين سليمه ومختله وزنًا.\n\n', 'العنوان: تمهيد\nالمحتوى: وهو كذلك أشد لزومًا للدارسين والمتخصصين في فروع الثقافة العربية من تاريخ واجتماع وأدب وبلاغة ومذاهب دينية أو عقلية. فالباحثون في أمثال هذه العلوم العربية لا غنى لهم عن تفهم ما يرد من شعر في المراجع والكتب المختصة بهذه العلوم. وفهم أولئك للشعر متوقف على صحة قراءته، وهذه لا تتأتى إلا لمن لديه القدرة على معرفة صحيح الأوزان والتمييز بين أنواعها المختلفة.\nمن أجل ذلك كله ندرك ضرورة الإلمام بعلم العروض أو علم موسيقى الشعر وأصوله، لا بالنسبة للشعراء فحسب، ولكن بالنسبة أيضًا لذوي التخصص في علوم العربية. وإذا جاز أن يغتفر لغير متخصص ألا يقيم وزن الشعر وألا يقرأه قراءة صحيحة، فإن ذلك لا يمكن أن يغتفر مطلقًا للمتخصص.\n3 الصلة بين العروض والموسيقى:\nعرفنا أن العروض هو علم موسيقى الشعر، وعلى ذلك يكون هناك صلة تجمع بينه وبين الموسيقى بصفة عامة، وهذه الصلة تتمثل في الجانب الصوتي.\nفالموسيقى تقوم على تقسيم الجمل إلى مقاطع صوتية تختلف طولاً وقصرًا، أو إلى وحدات صوتية معينة على نسق معين، بغض النظر عن بداية الكلمات ونهايتها.\nوكذلك شأن العروض، فالبيت من الشعر يقسم إلى وحدات صوتية معينة، أو إلى مقاطع صوتية تعرف بالتفاعيل بقطع النظر عن بداية الكلمات ونهايتها. فقد ينتهي المقطع الصوتي أو التفعيلة في آخر كلمة، وقد ينتهي في وسطها، وقد يبدأ من نهاية كلمة وينتهي ببدء الكلمة التي تليها.\nوهاكم مثالاً على ذلك:\nلا تسألي القوم ما مالي وما حسبي ... وسائلي للقوم ما حزمي وما خلقي\n\n', 'العنوان: تمهيد\nالمحتوى: فتقطيع هذا البيت أو تقسيمه إلى وحدات صوتية أو تفاعيل يكون كالآتي:\nلا تَسْأَلِلْ قَومَ مَا مَالِي َمَاحَسَبِي ... مستفعلن فاعلن مستفعلن فعلن\nوَسَائِلِلْ قَومَ ما حَزْمِي وَمَا خُلُقِي ... متفعلن فاعلن مستفعلن فعلن\nولكن تقطيع البيت أو تقسيمه إلى وحدات صوتية أو تفاعيل لا يتحقق إلا إذا كتب الشعر كتابة عروضية فما الكتابة العروضية؟\n4 الكتابة العروضية.\nأوضحنا فيما سبق الصلة الوثيقة التي بين العروض والموسيقى، وهي صلة الفرع المتولد من الأصل، فالعروض في الحقيقة أمره ليس إلا ضربًا من الموسيقى اختص بالشعر على أنه مقوم من مقوماته.\nوإذا كان للموسيقى عند كتابتها رموز خاصة يدل بها على الأنغام المختلفة، فإن للعروض كذلك رموزًا خاصة به في الكتابة تخالف الكتابة الإملائية التي تكون على حسب قواعد الإملاء المتعارف عليها. وهذه الرموز العروضية يدل بها على التفاعيل التي هي بمثابة أنغام الموسيقي المختلفة.\nوالكتابة العروضية تقوم على أمرين أساسيين هما:\n1 ما ينطق يكتب.\n2 ما لا ينطق لا يكتب.\nوتحقيق هذين الأمرين عند الكتابة العروضية يستلزم زيادة بعض أحرف\n\n', 'العنوان: تمهيد\nالمحتوى: لا تكتب إملائيًا وحذف بعض أحرف تكتب إملائيًا.\nوفيما يلي تفصيل للأحرف التي تزاد أوتحذف في الكتابة العروضية:\nأ-\nالحروف التي تزاد:\nتزاد في الكتابة العروضية ستة أحرف هي:\n1 إذا كان الحرف مشددًا فك التشديد ورسم الحرف أو كتب مرتين:\nمرة ساكنًا ومرة متحركًا،\nنحو:\nرق، وعد، وهز،\nفتكتب عروضيًّا:\nرقق، وعدد، وهزز.\n2 إذا كان الحرف منونًا كتب التنوين نونًا،\nنحو:\nجبل، وشجر، وأسد،\nفتكتب عروضيًّا:\nجبلن، وشجرن، وأسدن، رفعًا ونصبًا وجرًّا.\n3 تزاد ألف في بعض أسماء الإشارة،\nنحو:\nهذا، وهذه، وهذان، وهذين، وهؤلاء، وذلك،\nفتكتب عروضيًّا:\nهاذا، وهاذه، وهاذان، وهاذين، وهاؤلاء، وذالك. كذلك تزاد ألف في لفظ الجلالة، وفي لكن المخففة والمشددة،\nفهذه الكلمات:\nالله، ولكن، ولكن،\nتكتب عروضيًّا هكذا:\nاللاه، ولاكن، ولاكنن.\n4 تزاد واو في بعض الأسماء كما في:\nداود، وطاوس، وناوس،\nفتكتب عروضيًّا:\nداوود، وطاووس، وناووس.\n5 تكتب حركة حرف القافية حرفًا مجانسًا للحركة، فإذا كانت حركة حرف القافية ضمة كتبت هذه الضمة عروضيًّا واوًا، وإذا كانت كسرة كتبت ياء، وإذا كانت فتحة كتبت ألفًا.\n6 إذا أشبعت حركة هاء الضمير للمفرد المذكر الغائب، كتبت\n\n', 'العنوان: تمهيد\nالمحتوى: حرفًا مجانسًا للحركة.\nفالضمة التي على الهاء في:\nله، ومنه، وعنه،\nإذا أشبعت كتبت عروضيًّا واوًا هكذا:\nلهو، ومنهو، وعنهو.\nوكسرة الهاء في:\nبه وإليه، وفيه،\nإذا أشبعت كتبت عروضيًّا هكذا:\nبهي، وإليهي، وفيهي.\nأما كاف المخاطب أو المخاطبة فلا تشبع، وبالتالي لا يزاد بعدها أي حرف،\nنحو:\nبك، وبكِ، ومنك ومنكِ، وإليك وإليكِ.\nب-\nالأحرف التي تحذف:\n1 تحذف همزة الوصل، وهي الألف التي يتوصل بها إلى النطق بالساكن، إن كان قبلها متحرك.\nويكون ذلك في:\nأ- ماضي الأفعال الخماسية والسداسية المبدوءة بالهمزة، وفي أمرها ومصدرها،\nنحو:\nانْطَلَق، استغْفَر، انطلِق، استغفِر، انطلاق، استغفار.\nفألف الوصل في هذه الكلمات وأمثالها تحذف إن كان قبلها متحرك عند الكتابة العروضية هكذا:\nفنطلَق، فستغفَر، فنطلِق فستغفِر، فنطلاق، فستغفار.\nب-\nالأسماء العشرة المسموعة وهي:\nاسم، ابن، ابنة، امرؤ، امرأة، اثنان، اثنتان، أيمن المختصة بالقسم، است.\nفمثلاً:\nباسمك، وهذا أب وابن، والعام اثنا عشر شهرًا،\nتكتب عروضيًّا هكذا:\nبسمك، وهاذا أبن وبنن، والعام ثنا عشر شهرن.\nج- أمر الفعل الثلاثي الساكن ثاني مضارعه،\nنحو:\nفاسمع واكتب واقرأ،\nفإنها تكتب عروضيًّا هكذا:\nفسمعْ، وكتبْ، وقرأْ.\nد- ألف الوصل من أل المعرفة. فإذا كانت أل قمرية، كما\n\n']"," البحور الشعرية هي الأوزان الشعرية التي يستخدمها الشعراء في كتابة قصائدهم. تعتبر البحور الشعرية أساساً لتنظيم الأبيات الشعرية وتحديد إيقاعها الموسيقي. هناك ستة عشر بحراً شعرياً أساسياً في علم العروض، وهي:

1. الطويل
2. المديد
3. البسيط
4. الوافر
5. الكامل
6. الهزج
7. الرجز
8. الرمل
9. السريع
10. المنسرح
11. الخفيف
12. المضارع
13. المقتضب
14. المجتث
15. المتقارب
16. المتدارك

كل بحر شعري يتميز بخصائصه الموسيقية والإيقاعية، ويمكن للشعراء استخدام هذه البحور بطرق مختلفة لابتكار قصائد متنوعة ومتناسقة. ",البحور الشعرية هي الأوزان التي تُبنى عليها أبيات الشعر وعددها 16 بحرًا.,,0.23,,0.9121212244893773
ما الفرق بين البحر الطويل والبحر الكامل؟,"['العنوان: أوزان البحور\nالمحتوى: ... 1 مقدمة.\n2 البحر الأول:\nبحر الطويل.\nمقدمة:\nأشرنا سابقًا إلى أن الخليل بن أحمد وضع خمسة عشر بحرًا وأن تلميذه الأخفش زاد عليها بحرًا سماه:\nالمتدارك، وبذلك أصبح مجموع البحور ستة عشر بحرًا.\nوبعد هذه البحور كما ذكرنا من قبل تشترك تفعيلاتها في عدد المقاطع بحيث إذا قدمنا مقطعًا متأخرًا أو أخرنا مقطعًا متقدمًا تولد عن ذلك البحر المماثل.\nفالتفعيلة فعولن مثلاً مكونة من وتد مجموع فسبب خفيف، فإذا تكررت ثماني مرات فإنه ينتج عنها بحر المتقارب، أما إذا قدمنا السبب الخفيف على الوتد المجموع في التفعيلة ذاتها فإن فعولن تصبح فاعلن، وهذه إذا تكررت كذلك ثماني مرات فإنه يتولد عنها بحر المتدارك.\n\n', 'العنوان: أوزان البحور\nالمحتوى: وكذلك متفاعلن إذا عكست تصير مفاعلتن وتكوِّن بتكرارها مع تفعيلة من نوع آخر بحرًا يسمى:\nالوافر،\nبينما تكرار متفاعلن ست مرات يولد بحرًا آخر هو:\nالكامل، وهكذا.\nوقد رتب العروضيون بحور الشعر الستة عشر على حسب اشتراك كل مجموعة منها في دائرة عروضية واحدة على الوجه التالي:\n1 الطويل، والمديد، والبسيط.\n2 الوافر، والكامل.\n3 الهزج، والرجز، والرمل.\n4 السريع والمنسرح، والخفيف، والمضارع، والمقتضب، والمجتث.\n5 المتقارب، والمتدارك.\nوهذا الترتيب كما ذكرت هو بحسب اشتراك كل مجموعة من البحور في دائرة عروضية لا بحسب كثرة استعمالها أو قلة استعمالها، وسوف نفصل الكلام عن الدوائر العروضية فيما بعد.\nأجزاء البيت:\nينقسم البيت الشعري إلى قسمين متساويين من حيث النغم والقياس الموسيقي، ويعرف كل قسم بالمصراع تشبيهًا بمصراعي الباب، أو بالشطر،\nفيقال:\nالشطر الأول أو الثاني،\nكما يقال:\nالمصراع الأول أو الثاني من البيت.\nالتفعيلة الأخيرة.\nولما كان للتفعيلة الأخيرة من كل شطر أهمية خاصة فقد انفردت بتسمية خاصة.\n\n', 'العنوان: أوزان البحور\nالمحتوى: فالتفعيلة التي في آخر الشطر من البيت تسمى:\nالعروض -بفتح العين-\nوالتفعيلة التي في آخر الشطر الثاني تسمى:\nالضرب،\nوما عدا ذلك من تفاعيل البيت يسمى:\nالحشو،\nهكذا:\nفعولن مفاعيلن فعولن مفاعلن\nحشو عروض\nفعولن مفاعيلن فعولن مفاعلن\nحشو ضرب\nوكل بحر من بحور الشعر له نظام خاص في التغييرات التي تدخل على الحشو أو على العروض أو على الضرب. وسنوضح ذلك عند الكلام على وزن كل بحر.\n\n', 'العنوان: البحر الطويل\nالمحتوى: ...\nالبحر الأول:\nالطويل\n1 وزنه:\nفعولن مفاعيلن فعولن مفاعيلن\nفعولن مفاعيلن فعولن مفاعيلن.\n2 عروضه:\nعروض هذا البحر، أي تفعيلته التي تقع في آخر الشطر الأول من البيت، لا تستعمل تامة، بل يحذف منها الحرف الخامس، أي الياء الساكنة فتصبح مفاعيلن مفاعلن.\nوحذف الخامس الساكن له في العروض اسم اصطلاحي هو:\nالقبض،\nوتسمى التفعيلة التي وقع فيها القبض:\nمقبوضة.\n3 ضربه:\nوضرب هذا البحر، أي تفعيلته التي تقع في آخر الشطر الثاني من البيت، قد يكون مقبوضًا في قصيدة أو غير مقبوض في أخرى.\nوإذا جاء البيت الأول من القصيدة مقبوض العروض والضرب معًا لزم أن يستمر ذلك في بقية أبياتها.\n\n', 'العنوان: البحر الطويل\nالمحتوى: 4 حشو البيت:\nعرفنا أن الحشو هو جميع تفعيلات البيت ما عدا تفعيلة العروض وتفعيلة الضرب.\nوحشو البيت في بحر الطويل يحدث فيه تغيير اختياري بحذف النون الساكنة من فعولن الأولى أو الثالثة أو الخامسة أو السابعة في ترتيب التفاعيل،\nوبذلك تصبح فعولن فعولُ بلام متحركة أي بحذف الخامس الساكن:\nفتكون مقبوضة أيضًا.\nوهذا التغيير غير لازم، فإذا ورد التغيير في فعولن الأولى فلا يلزم في غيرها من بقية البيت، كما أن قبض فعولن في حشو بيت ما لا يستدعي قبضها في حشو بقية الأبيات.\nويجب التنبيه على أن هناك فرقًا من جهة التسمية بين التغيير الذي يحدث في الحشو، والتغيير الذي يحدث في العروض والضرب.\nفالتغيير الذي يحدث في الحشو يسمى:\nالزحاف،\nأما التغيير الذي يحدث في العروض والضرب فيسمى:\nالعلة، وهو تغيير يلتزم.\nوكما يكون الزحاف والعلة في بحر الطويل يكونان كذلك في غيره من البحور، ولكن ينبغي أن نتذكر أن لكل بحر زحافًا خاصًّا وعلة خاصة.\nعروض الطويل وضربه:\nعروض الطويل تأتي مقبوضة دائمًا.\nأما ضربه فيأتي على ثلاثة أنواع:\n\n', 'العنوان: البحر الطويل\nالمحتوى: 1 مقبوضًا كذلك، أي بحذف الخامس الساكن لتصير مفاعيلن مفاعلن.\n2 أو محذوفًا، أي بحذف السبب الأخير من مفاعيلن لتصير مفاعي وتحول إلى مفاعلْ بسكون اللام تسهيلاً للنطق، أو فعولن.\n3 أو صحيحًا، مفاعيلن.\nوعلى هذا يكون نظام البحر الطويل على الوجه التالي:\n1. --- مفاعلن أ. --- مفاعلن أ\n2. --- مفاعلن أ. --- مفاعل ب\n3. --- مفاعلن أ. --- مفاعيلن جـ\nمثال النوع الأول:\nمن معلقة زهير:\nومن هاب أسباب المنايا ينلنه ... وإن يرق أسباب السماء بسلم\nومن ها بأسبابل منايا ينلنهو\nااه اه ااه اه اه ااه اه ااه ااه\nفعولن مفاعيلن فعولن مفاعلن\nوإن ير قأسبابس سماء بسللمي\nااه اه ااه اه اه ااه اااه ااه\nفعولن مفاعيلن فعولُ مفاعلن\n\n', 'العنوان: البحر الطويل\nالمحتوى: ومن ذلك نلاحظ أن عروض هذا البيت هي:\nمفاعلن، وضربه كذلك.\nوهكذا يسير زهير في جميع أبيات معلقته من أولها إلى آخرها.\nأما حشو البيت فنجد أن إحدى تفعيلاته وهي السابعة فعولن دخلها القبض فحولت إلى فعولُ بتحريك اللام وهذا غير لازم.\nالنوع الثاني:\nوهو ما عروضه مقبوضة وضربه محذوف أي: مفاعلْ بسكون اللام.\nوقد افترض العروضيون أن أصل الضرب مفاعيلن فحذف من التفعيلة الأخيرة، أي تفعيلة الضرب السبب الخفيف من آخرها فصارت مفاعي، ولسهولة النطق بها تحولت إلى مفاعلْ بسكون اللام أي تفعيلة خماسية.\nوهذا الضرب يسمى:\nمحذوفًا؛ لحذف السبب الأخير من تفعيلته.\nومثال هذا النوع قول أبي نواس في مدح الخصيب أمير مصر:\nتقول التي من بيتها خف محملي ... عزيز علينا أن نراك تسير\nأما دون مصر للغني متطلب ... بلى.. إن أسباب الغنى لكثير\nفقلت لها واستعجلتها بوادر ... جرت فجرى في جريهن عبير\nذريني أكثر حاسديك برحلة ... إلى بلد فيه الخصيب أمير\nفتى يشتري حسن الثناء بماله ... ويعلم أن الدائرات تدور\nفما جازه جود ولا حل دونه ... ولكن يسير الجود حيث يسير\n\n', 'العنوان: البحر الطويل\nالمحتوى: فتقطيع البيت الأول هكذا:\nتقولل لتي من بيـ تهاخف فمحملي\nفعولن مفاعيلن فعولن مفاعلن\nعزيزن علينا أن نراك تسيرو\nفعولن مفاعيلن فعولُ مفاعلْ\nفالتفعيلة الأخيرة من الشطر الثاني أي الضرب محذوفة.\nومثال آخر قول مسكين الدارمي عندما أوعز إليه معاوية أن يقترح البيعة من بعده لابنه يزيد؛\nليعلم رأي قومه في ذلك:\nألا ليت شعري ما يقول ابن عامر ... ومروان أم ماذا يقول سعيد؟\nبني خلفاء الله مهلاً فإنما ... يبوّئها الرحمن حيث يريد\nإذا المنبر الغربي خلَّاه ربه ... فإن أمير المؤمنين يزيد\nفتقطيع البيت الأول هكذا:\nألالي تشعري ما يقولب نُعامرن\nفعولن مفاعيلن فعولن مفاعلن\nومروا نُأَ مْ مَاذا يقول سعيدو\nفعولن مفاعيلن فعولُ مفاعلْ\nالنوع الثالث:\nما كان عروضه مقبوضة وضربه صحيحًا أي: مفاعيلن،\nكقول الحطيئة في المدح:\nأولئك قوم إن بنوا أحسنوا البنا ... وإن عاهدوا أوفوا وإن عقدوا شدوا\nوإن كانت النعماء فيهم جزوا بها ... وإن أنعموا لا كدَّروها ولا كدُّوا\nمطاعين في الهيجا مكاشيف للدجى ... بنى لهم آؤباهم.. وبنى الجد\nويعذلني أبناء سعد عليهم ... وما قلت إلا بالذي علمت سعد\n\n', 'العنوان: البحر الطويل\nالمحتوى: فتقطيع البيت الأول هكذا:\nألاء كقومي إن بنو أح سنلبنا\nفعولُ مفاعلين فعولن مفاعلن\nوإن عا هدو أوْفَو وإن ع قدو شددو\nفعولن مفاعلين فعولُ مفاعلين\nفالعروض مقبوضة والضرب هنا صحيح وكذلك في بقية الأبيات الأخرى.\nوالخلاصة:\n1 إن عروض الطويل مفاعلن\n2 أما الضرب فهو:\nمفاعلن، أو مفاعلْ بسكون اللام، أو مفاعيلن.\nفإذا رمزنا إلى العروض بالرمز\n(أ)\nأيضًا كان نظام قصائد الطويل كما يلي:\n1 قصيدة فيها الوضع هكذا:\n---- أ ---أ\n---- أ ---أ\nأي مفاعلن في العرض ومفاعلن في الضرب حتى نهاية القصيدة.\n2 وقصيدة أخرى تكون العروض مفاعلن أي\n(أ)\nوالضرب مفاعل أي\n(ب)\nفيكون نظامها كالآتي:\n--- أ ---ب\n--- أ --- ب حتى نهاية القصيدة.\n\n', 'العنوان: البحر الطويل\nالمحتوى: 3 وقصدة ثالثة تكون العروض مفاعل أي\n(أ)\nوالضرب مفاعيلن أي\n(جـ)\nفيكون نظامها هكذا:\n--- أ ---- جـ.\n--- أ ----جـ حتى نهاية القصيدة.\nوالخطوط الأفقية تمثل حشو البيت.\nالتصريع.\nوالتصريع هو أن يجانس الشاعر بين شطري البيت الواحد في مطلع القصيدة أي يجعل العروض مشبهًا للضرب وزنًا وقافية.\nويحدث في النوع الثاني الذي ضربه\n(مفاعل)\nأي\n(ب)\nوفي النوع الثالث الذي ضربه\n(مفاعيلن)\nأي\n(جـ)\n.\nومثال النوع الثاني مطلع قصيدة في الرثاء لشاعر معاصر:\nأفيقوا وإن جل المصاب أفيقوا ... وصونوا عيونًا للدماء تريق.\nوقولوا هنيئًا للألى وهبوا العلى ... نفوسًا إلى نيل المرام تنوق\nوتقطيع الشطر الأول:\nأفيقو وإن جللل مصاب أفيقو\nفعولن مفاعيلن فعولُ مفاعلْ\n(بسكون اللام)\nوتقطيع الشطر الثاني:\nوصونو عيوننلد دماء تريقو\nفعولن مفاعيلن فعولُ مفاعلْ\n(بسكون اللام)\n\n']"," الفرق بين البحر الطويل والبحر الكامل يكمن في تركيبتهما الوزنية وعدد المقاطع الصوتية في كل تفعيلة.

البحر الطويل يتكون من تفعيلتين رئيسيتين:
1. فعولن (فعولُنْ)
2. مفاعيلن (مَفاعِيلُنْ)

ويأتي البحر الطويل على عدة أشكال في العروض والضرب، لكن العروض (التفعيلة الأخيرة في الشطر الأول) تكون دائماً مقبوضة (أي بحذف الحرف الخامس الساكن)، بينما يأتي الضرب (التفعيلة الأخيرة في الشطر الثاني) على ثلاثة أشكال:
1. مقبوض (مَفاعِيلُنْ)
2. محذوف (مَفاعِي)
3. صحيح (مَفاعِيلُنْ)

أما البحر الكامل فيتكون من التفعيلتين الرئيسيتين:
1. متفاعلن (مُتَفاعِلُنْ)
2. متفاعلن (مُتَفاعِلُنْ)

ويأتي البحر الكامل على شكل واحد فقط في العروض والضرب، حيث تكون التفعيلتين متشابهتين ومتساويتين في الوزن والقافية.

في المجمل، الفرق الرئيسي بين البحر الطويل والبحر الكامل يكمن في تركيبتهما الوزنية وعدد المقاطع الصوتية في كل تفعيلة. ",البحر الطويل يتكون من تكرار 'فعولن مفاعيلن'، بينما البحر الكامل يتكون من 'متفاعلن'، ويختلفان في الإيقاع.,,0.62,,0.9185738295189595
ما المقصود بالزحاف في علم العروض؟,"['العنوان: الزحافات والعلل\nالمحتوى: تكلمنا فيما سبق عن بعض أنواع الزحافات والعلل باعتبار دخولها في أوزان الشعر العربي، والآن نتكلم عنها باعتبارها مصطلحات عروضية تجريدية، ونبدأ بالكلام عن الزحاف\nالزحاف:\nوالزحاف، كما عرفه العرضيون، تغيير يحدث في حشو البيت غالبًا، وهو خاص بثواني الأسباب، ومن ثم لا يدخل الأوتاد، ودخوله في بيت من القصيدة لا يستلزم دخوله في بقية أبياتها.\nوالعروضيون يربطون الزحاف بالتفعيلة لا بالبيت، فبحر البسيط مثلًا يشتمل\n\n', 'العنوان: الزحافات والعلل\nالمحتوى: على التفعيلة مستفعلن وهذه يجوز حذف ثانيها، وهذا الزحاف يسمى الخبن كما يجوز حذف رابعها، وهذا الزحاف يسمى الطي وأحيانًا يجوز حذفهما معها، وهذا الزحاف يسمى الخبل.\nومثل هذه الزحافات تدخل على مستفعلن في بحر الرجز وبحر المنسرح.\nأما مستفع لن في بحر الخفيف فيجوز فيها الخبن فقط، دون الطي الذي هو حذف الرابع الساكن، ودون الخبل الذي هو اجتماع الخبن والطي معًا. وهكذا أمكننا أن نعتبر التفعيلة واحدة في هذه الأبحر بما فيها الخفيف.\nولكن العروضيين عندما ربطوا الزحاف بالتفعيلة لا بالبحر جعلوا البسيط والرجز والمنسرح والسريع تفعيلة هي مستفعلن وجعلوا للخفيف والمجتث تفعيلة خاصة هي مستفع لن.\nفالتفعيلة الأولى مستفعلن تتركب عندهم من سببين خفيفين فوتد مجموع، والثانية مستفع لن تترتب من سببين خفيفين بينهما وتد مفروق.\nوبما أن الزحاف لا يدخل الوتد المفروق، فالفاء التي هي رابع حرف في التفعيلة تعتبر ثاني سبب في ذات الوتد المجموع أي مستفعلن ومن ثم جاز طيها، بينما تعتبر ثاني سبب في ذات الوتد المجموع أي مستفعلن ومن ثم جاز طيها، بينما تعتبر الفاء وسط الوتد في ذات الوتد المفروق، أي مستفع لن ولذا لم يجز زحافها بالطي وهذا الفرق يوضح لنا كيف أن العروضيين يعتبرون تفعيلة الخفيف والمجتث مثلاً مستفع لن.\nوهكذا نرى أن الزحاف يرتبط بالتفعيلات لا بالبحور،\nوهذه التفعيلات عشر كالآتي:\nأاثنتان خماسيتان هما:\n\n', 'العنوان: الزحافات والعلل\nالمحتوى: 1 فعولن = وتد مجموع + سبب خفيف.\n2 فاعلن = سبب خفيف + وتد مجموع.\nب وثماني تفعيلات سباعية،\nهي:\n3 مفاعيلن = وتد مجموع + سبب خفيف + سبب خفيف.\n4 مستفعلن = سبب خفيف + سبب خفيف+ وتد مجموع.\n5 متفاعلن = سبب ثقيل + سبب خفيف + وتد مجموع.\n6 مفاعلتن = وتد مجموع + سبب ثقيل + سبب خفيف.\n7 مفعولات = سبب خفيف + سبب خفيف + وتد مفروق.\n8 فاع لاتن = وتد مفروق + سبب خفيف + سبب خفيف.\n9 مستفع لن = سبب خفيف + وتد مفروق + سبب خفيف.\n10 فاعلاتن = سبب خفيف + وتد مجموع + سبب خفيف.\nوبحث الزحاف في هذه التفاعيل يقتضي النظر إلى المقاطع وما ينشأ فيها من تغير، وهذا التغير محصور في تسكين المتحرك أو حذفه، وفي حذف الساكن.\nوعلى هذا تكون أنواع الزحاف كالآتي:\n1 الإضمار:\nوهو تسكين الثاني المتحرك، وذلك يكون في متفاعلن.\n2 الخبن:\nوهو حذف الثاني الساكن،\nوذلك يكون في التفعيلات الخمسة التالية:\nأمستفعلن تصير بالخبن متفعلن\nب مستفع لن تصير بالخبن متفع لن\n\n', 'العنوان: الزحافات والعلل\nالمحتوى: جـ فاعلن تصير بالخبن فعلن\nد فاعلاتن تصير بالخبن فعلاتن\nهـ مفعولات تصير بالخبن معولات\n3 الطي:\nوهو حذف الرابع الساكن بشرط أن يكون ثاني سبب وذلك يكون في التفعيلتين التاليتين:\nأمستفعلن تصير بالطي مستعلن\nب مفعولات تصير بالطي مفعلات\n4 الوقص:\nوهو حذف الثاني المتحرك. وذلك يكون في متفاعلن فقط، فتصير بالوقص مفاعلن.\n5 العصب:\nوهو إسكان الخامس المتحرك. وذلك يكون في مفاعلتن بتحريك اللام، فتصير بالعصب مفاعلتن بتسكين اللام.\n6 القبض:\nوهو حذف الخامس الساكن،\nوذلك يكون في التفعيلتين التاليتين:\nأفعولن تصير بالقبض فعول بتحريك اللام.\nب مفاعيلن تصير بالقبض مفاعلن.\n7 الكف:\nوهو حذف السابع الساكن بشرط أن يكون ثاني سبب وذلك يكون في التفعيلات الأربعة التالية:\nأمفاعيلن تصير بالكف مفاعيل بتحريك اللام\nب فاعلاتن تصير بالكف فاعلات بتحريك التاء\nجـ فاع لاتن تصير بالكف فاعلات\n\n', 'العنوان: الزحافات والعلل\nالمحتوى: د مستفع لن تصير بالكف مستفع ل بتحريك اللام\n8 العقل:\nوهو حذف الخامس المتحرك. وذلك يكون في مفاعلتن فقط فتصير مفاعلتن وتحول إلى مفاعلن.\nهذه الزحافات الثمانية التي تدخل التفاعيل على النحو السابق تعرف بالزحافات البسيطة أو المفردة. وليست كلها على درجة واحدة من الشيوع، فمنها ما يقل استعماله، ولا ينبغي للشاعر أن يلجأ إليه إلا في حالة الاضطرار.\nالزحاف المزدوج:\nوالزحاف المزدوج هو اجتماع زحافين في تفعيله واحدة، ولهذا الزحاف أسماء أو اصطلاحات عروضية تبعًا لنوعي الزحاف اللذين يجتمعان في التفعيلة الواحدة.\nوالزحاف المزدوج أربعة أنواع على الوجه التالي:\n1 الخبل:\nوهو اجتماع الخبن والطي.\nويكون في التفعيلتين التاليتين:\nأمستفعلن تصير بعد الخبن والطي متعلن بتحريك التاء.\nب مفعولات تصير بعد الخبن والطي معلات وتحول إلى فعلات.\n2 الخزل:\nوهو اجتماع الإضمار والطي. ويكون في متفاعلن تصير بعد الخزل متفعلن بتسكين التاء، وتحول إلى مفتعلن.\n3 الشكل:\nوهو اجتماع الخبن والكف. ويكون في فاعلاتن تصير بعد الشكل فعلات بتحريك التاء.\n\n', 'العنوان: الزحافات والعلل\nالمحتوى: 4 النقص:\nهو اجتماع العصب والكف. ويكون في مفاعلتن تصير مفاعلت بتسكين اللام وتحريك التاء، وتحول إلى مفاعيل بتحريك اللام.\nوهذه الأنواع من الزحاف المزدوج تتفاوت من حيث الاستعمال. وهي بوجه عام أقل استعمالاً من الزحاف المفرد، وذلك لأن حذف حرفين من التفعيلية يضعف من موسيقى البيت. وعلى سبيل المثال إن قصيدة من بحر البسيط التي يشتمل كل بيت منها على أربع تفعيلات بوزن مستفعلن يقل فيها ورود التفعيلات الأربعة كلها مخبولة، ولكن إذا وجد الخبل فإنه يكون في تفعيلة أو اثنتين من البيت، على أنه لا مانع من ورود الخبل في كل أبيات القصيدة، وإن كان الذوق الموسيقي للشعراء يأبى ذلك.\nوزحاف تنقص قد يكون في الوافر أو مجزوئه، ووروده في مجزوء الوافر أكثر نسبيًا منه في الوافر التام.\nأما الخزل والشكل فلا يقعان في الشعر الملتزم إلا نادرًا.\nالعلل العروضية:\nوالعلة العروضية هي كل تغيير يطرأ على تفعيلة العروض أو الضرب. وإذا ورد هذا التغيير في أول بيت من القصيدة التزم في جميع أبياتها.\nويشترك مع العلة في هذا الحكم بعض أنواع الزحاف. ولما كان\n\n', 'العنوان: الزحافات والعلل\nالمحتوى: العروضيون قد ربطوا الزحاف والعلة بالتفعيلة، فإنهم أوجدوا نوعًا أطلقوا عليه الزحاف الجاري مجرى العلة.\nوهذا الزحاف قد يكون وحده في التفعيلة، وقد يصاحبه نوع من أنواع العلة. ويلاحظ أننا في دراستنا للبحور قد ربطنا الزحاف الداخل على تفعيلة العروض أو الضرب بالبحور وسميناه علة تجوزًا لأنه يأخذ أحكامها.\nوأنواع الزحاف الجارية مجرى العلة والداخلة على تفعيلة العروض أو الضرب هي:\n1 القبض في عروض الطويل وكذلك في أحد أضربها،\nفيصبح الوزن هكذا:\nفعولن مفاعيلن فعولن مفاعلن ... فعولن مفاعيلن فعولن مفاعلن\nفي حين أن تفعيلة كل من العروض والضرب على حسب نظام الدوائر هي مفاعيلن.\n2 الخبن في بعض أنواع المديد بمصاحبة الحذف فتصبح فيه فاعلاتن في كل من العروض والضرب فعلا بتحريك وتنقل إلى فعلن وبناء على هذا يصير وزن المديد الذي من هذا النوع:\nفاعلاتن فاعلن فعلن ... فاعلاتن فاعلن فعلن\nوذلك بعد أن كانت فيه تفعيلة العروض والضرب فاعلاتن بحسب نظام الدوائر.\n3 الخبن في بعض أنواع البسيط،\nإذ أصله بحسب نظام الدوائر:\nمستفعلن فاعلن مستفعلن فاعلن ... مستفعلن فاعلن مستفعلن فاعلن\n\n', 'العنوان: الزحافات والعلل\nالمحتوى: فتصبح فيه العروض والضرب بعد خبنهما فعلن بتحريك العين،\nويصبح الوزن هكذا:\nمستفعلن فاعلن مستفعلن فعلن ... مستفعلن فاعلن مستفعلن فعلن\n4 الخبن في عروض مخلع البسيط وضربه بمصاحبة القطع الذي هو حذف ساكن الوتد المجموع وإسكان ما قبله.\nوأصل هذا الوزن:\nمستفعلن فاعلن مستفعلن ... مستفعلن فاعلن مستفعلن\nفتصبح فيه مستفعلن بعد الخبن والقطع فعولن،\nوبذلك يصير الوزن:\nمستفعلن فاعلن فعولن ... مستفعلن فاعلن فعولن\n5 العصب في نوع من ضربي مجزوء الوافر.\nووزن مجزوء الوافر في الأصل هو:\nمفاعلتن مفاعلتن ... مفاعلتن مفاعلتن\nفإذا دخل العصب، الذي هو إسكان الخامس المتحرك، على تفعيلة الضرب التي هي مفاعلتن بتحريك اللام فإنها تصير مفاعلتن بتسكين اللام، وتنقل إلى مفاعيلن.\nوبذلك يصبح وزن مجزوء الوافر بعد العصب في الضرب\nمفاعلتن مفاعلتن ... مفاعلتن مفاعيلن\n6 الإضمار في بعض أنواع الكامل، بمصاحبة الحذذ،\nووزن الكامل بحسب نظام الدوائر هو:\nمتفاعلن متفاعلن متفاعلن ... متفاعلن متفاعلن متفاعلن\n\n', 'العنوان: الزحافات والعلل\nالمحتوى: فإذا دخل الإضمار والحذذ على تفعيلة ضربه التي هي متفاعلن فإنها تصير بعد الإضمار متفاعلن بتسكين الثاني، ثم تصير متفا بعد الحذذ الذي هو حذف الوتد المجموع،\nوبذلك يصير وزن الكامل الذي دخل الإضمار والحذذ على تفعيلة ضربه هكذا:\nمتفاعلن متفاعلن متفاعلن ... متفاعلن متفاعلن متفا\nبتسكين التاء\n7 الطي في بعض أنواع السريع، بمصاحبة الكسف أو الوقف.\nووزن السريع في الأصل هو:\nمستفعلن مستفعلن مفعولات ... مستفعلن مستفعلن مفعولات\nفتفعيلة العروض والضرب هنا هي مفعولات، فإذا دخلها الطي الذي هو حذف الرابع الساكن فإنها تصير مفعلات وإذا دخلها الكسف الذي هو حذف السابع المتحرك فإنها تصير مفعلا وتنقل إلى فاعلن أو تصير بعد الوقف الذي هو إسكان السابع المتحرك مفعلات بسكون التاء.\nوعلى هذا يصير وزن السريع بعد دخول الطي والكسف على تفعيلة عروضه وضربه كالآتي:\nمستفعلن مستفعلن فاعلن\n... مستفعلن مستفعلن فاعلن\nكما يصير بعد دخول الطي والوقف على تفعيلة عروضه وضربه:\nمستفعلن مستفعلن مفعلات ... مستفعلن مستفعلن مفعلات\nبتسكين تاء مفعلات.\n8 الخبل الذي هو اجتماع الخبن والطي في بعض أنواع أخرى من السريع، وذلك بمصاحبة الكسف. فتفعيلة عروض السريع وضربه والتي هي في الأصل\n\n', 'العنوان: الزحافات والعلل\nالمحتوى: مفعولات تصير بعد الخبن معولات وبعد الطي معلات وبعد الكسف معلا وتنقل إلى فعلن بتحريك العين.\nوبذلك يصير وزن السريع بعد دخول الخبل والكسف على تفعيلة عروضه وضربه كالآتي:\nمستفعلن مستفعلن فعلن ... مستفعلن مستفعلن فعلن\nبتحريك العين في فعلن.\n9 الطي في بعض أنواع المنسرح الذي أصل وزنه:\nمستفعلن مفعولات مستفعلن ... مستفعلن مفعولات مستفعلن\nفإذا دخل الطي على تفعيلة عروضه وضربه التي هي مستفعلن فإنها تصير مستعلن وتنقل إلى مفتعلن وبذلك يصبح وزن هذا النوع من المنسرح كالآتي:\nمستفعلن مفعولات مفتعلن ... مستفعلن مفعولات مفتعلن\n10 الخبن في بعض الأنواع من مجزوء الخفيف، وذلك بمصاحبة القصر.\nووزن مجزوء الخفيف في الأصل هو:\nفاعلاتن مستفع لن ... فاعلاتن مستفع لن\nفإذا دخل الخبن على تفعيلة العروض والضرب التي هي مستفع لن صارت متفع لن وإذا دخلها بعد ذلك القصر الذي هو حذف ساكن السبب الخفيف وإسكان ما قبله صارت متفع ل بتسكين اللام.\nوبذلك يصير وزن مجزوء الخفيف في هذه الحالة، أي بعد دخول الخبن\n\n']"," في علم العروض، الزحاف هو تغيير يطرأ على الحرف الثاني من السبب الخفيف في التفعيلة، سواء كان هذا التغيير تسكينًا أو حذفًا. الزحاف لا يؤثر على الوزن الشعري للبيت ولا يُعتبر تغييرًا جوهريًا في التفعيلة، بل يُعتبر تغييرًا ثانويًا يُسمح به في بعض الأحيان لتحسين جودة الشعر أو لإضفاء جمالية معينة على النص الشعري.

أنواع الزحاف تشمل:
1. الإضمار: تسكين الحرف الثاني من السبب الخفيف.
2. الخبن: حذف الحرف الثاني من السبب الخفيف.
3. الطي: حذف الحرف الرابع من السبب الخفيف.
4. الوقص: حذف الحرف الثاني من الوتد المجموع.
5. العصب: تسكين الحرف الخامس من السبب الخفيف.
6. القبض: حذف الحرف الخامس من السبب الخفيف.
7. الكف: حذف الحرف السابع من السبب الخفيف.
8. العقل: حذف الحرف الخامس من الوتد المجموع.
9. الخبل: اجتماع الخبن والطي في السبب الخفيف.
10. النقص: اجتماع العصب والكف في السبب الخفيف.

يجب ملاحظة أن بعض الزحافات قد تكون مقبولة في بعض البحور الشعرية دون غيرها، وقد تؤثر على جودة الشعر وجماليته. ",الزحاف هو تغيير في التفعيلة بحذف أو تغيير حرف معين، ويعتبر جائزًا.,,0.1,,0.8735571458126641
ما هي تفعيلة البحر الوافر؟,"['العنوان: البحر الوافر\nالمحتوى: ... ووزنه\nمفاعلتن مفاعلتن فعولن\nمفاعلتن مفاعلتن فعولن\nوالتفعيلة الثالثة والسادسة هنا فعولن، والتي تمثل عروض الوافر وضربه هي في الأصل مفاعلتن، وقد طرأ عليها التغيير بالقطف،\nوهو تسكين الخامس المتحرك:\nاللام، وحذف السبب الخفيف من آخر التفعيلة، فأصبحت مفاعل، بوتد مجموع وسبب خفيف، ولسهولة النطق بها حولت إلى فعولن.\nزحاف هذا البحر:\nالزحاف الذي يدخل حشو هذا البحر هو العصْب بسكون الصاد.\nوالعصب:\nهو تسكين الحرف الخامس، وهو هنا اللام في مفاعلتن. والوافر من أكثر بحور الشعر استعمالا،\nومن أمثلته قول شاعر معاصر:\n\n', 'العنوان: البحر الوافر\nالمحتوى: وذي غرفٍ كساكنه رهيب ... تجهم للرياء وعنه صاما\nسعيت إليه لما ضل سعيي ... وأخلفت المنى عامًا فعاما\nسعيت إليه أعمره بروحي ... وأنزل فيه صبًّا مستهاما\nفألفي ملء ساحته قبولا ... وأبصر في مسالكه اهتمامًا\nوألمح في طويته عتابا ... وأقرأ في محياه كلاما\nفألبس فيه ظلا شاعريًّا ... وأرجع فيه كالماضي غلامًا\nوكم من قصة مثلت فيه ... شفت بدءًا ولم تحمد ختاما\nفإذا قطعنا الشطر الثاني من البيت الثالث وجدنا التفعيلة الأولى تأتي على الأصل محركة الخامس، والتفعيلة الثانية قد دخلها العصب،\nأي:\nتسكين الحرف الخامس هكذا:\nوأنزل في هصببن مس تهاما\nااه اااه ااه اه اه ااه اه\nمفاعلتن مفاعلتن فعولن\nبتحريك اللام في مفاعلتن الأولى وتسكينها في الثانية.\nمجزوء الوافر:\nيختصر الوافر أحيانًا بحذف تفعيلة من كل شطر فيصبح وزنه هكذا:\nمفاعلتن مفاعلتن ... مفاعلتن مفاعلتن\n\n', 'العنوان: البحر الوافر\nالمحتوى: وبذلك تصبح أولى التفعيلتين في كل شطر حشوًا، والثانية في الشطر الأول عروضًا، وفي الشطر الثاني ضربًا.\nويسمى الوافر بعد الحذف على هذا الوضع مجزوء الوافر.\nويدخله زحاف العصب:\nأي تسكين الخامس على حشو مجزوء الوافر تمامًا كما يدخل على حشو الوافر كاملاً.\nعروض مجزوء الوافر،\nوضربه:\nأ- عروضه صحيحة غالبًا، ويجوز فيها العصب، أي تسكين الخامس.\nب- أما ضربه فنظرًا لنظام القافية يتحتم فيه أن يلزم حالة واحدة، فهو إما صحيح أو معصوب.\nأمثلة.\n1 مثال صحيح الضرب قول الشاعر:\nأخ لي عنده أدبُ ... صداقة مثله نسبُ\nرعي لي فوق ما أرعى ... وأوجب فوق ما يجب\nفلو سبكت خلائقه ... لقل أمامها الذهب\nفالضرب في الأبيات الثلاثة صحيح، أي محرك اللام، أما عروضه فصحيحة في البيتين الأول والثالث، ومعصوبة في البيت الثاني، أي ساكنة الخامس.\n\n', 'العنوان: البحر الوافر\nالمحتوى: 2 ومثال الضرب المعصوب قول الشاعر:\nصحا والفجر يرمقنا\n... بطرف نائم صاح\nِوودعنا على ظمأ\n... لحسن فيه وضاحِ\nفليت الحب يسعدنا ... فنلقى عنده الأمنا\nولكن أين ما نرجو ... وكل سعادة تفنى؟\nوتجدر الإشارة هنا إلى أن مجزوء الوافر قد يشتبه أحيانًا ببحر الهزج. وهذا أمر سنتعرض له بشيء من التفصيل عند الكلام على الهزج.\n\n', 'العنوان: تدريبات على بحر الوافر\nالمحتوى: التدريب الأول:\nالأبيات التالية من بحر الوافر ومجزوئه، فاكتبها كتابة عروضية،\nثم ضع تحتها رموزها فتفاعيلها:\n1 أبعد الأربعين محرمات ... تماد في الصبابة واغترار؟\n2 أيا قلبي أما تخشع؟ ... ويا علمي أما تنفع؟\n3 تواعدنا ... بآذار ... لمسعى غير مختار ...\nالتدريب الثاني:\nعين البحر في الأبيات التالية،\nوبين نوع العروض في كل منها:\n\n', 'العنوان: تدريبات على بحر الوافر\nالمحتوى: 1 وما وجد اشتياق كاشتياقي ... ولا عرف انكماش كانكماشي\n2 لا تنكرن رحيلي عنك في عجل ... فإنني لرحيلي غير مختار\n3 ومن ينفق الساعات في جمع ماله ... مخافة فقْرٍ فالذي فعل الفقر\n4 يا لقومي ... إنني رجل ... حرت في أمري وفي زمني\n5 أبنت الدهر عندي كلُّ بنتٍ؟ ... فكيف وصلت أنت من الزحام؟\n6 إذا صرف النهار الضوء عنهم ... دجا ليلان ليل والغبار\nالتدريب الثالث:\nعرف بالمصطلحات العروضية التالية:\nالحشو - الخبن - العروض - الضرب - الطي - القبض - التذييل- العصب - القطع.\n\n']"," تفعيلة البحر الوافر تتكون من ستة أحرف وهي:

مَفاعِيلُنْ مَفَاعِيلُنْ فَعُولُنْ

حيث تمثل هذه التفعيلة الأساسية لبحر الوافر في الشعر العربي. ",تفعيلة البحر الوافر هي 'مفاعلتن'.,1.0,0.4,0.5,0.8955174061604803
كيف يوزن البيت الشعري؟,"['العنوان: أوزان البحور\nالمحتوى: ... 1 مقدمة.\n2 البحر الأول:\nبحر الطويل.\nمقدمة:\nأشرنا سابقًا إلى أن الخليل بن أحمد وضع خمسة عشر بحرًا وأن تلميذه الأخفش زاد عليها بحرًا سماه:\nالمتدارك، وبذلك أصبح مجموع البحور ستة عشر بحرًا.\nوبعد هذه البحور كما ذكرنا من قبل تشترك تفعيلاتها في عدد المقاطع بحيث إذا قدمنا مقطعًا متأخرًا أو أخرنا مقطعًا متقدمًا تولد عن ذلك البحر المماثل.\nفالتفعيلة فعولن مثلاً مكونة من وتد مجموع فسبب خفيف، فإذا تكررت ثماني مرات فإنه ينتج عنها بحر المتقارب، أما إذا قدمنا السبب الخفيف على الوتد المجموع في التفعيلة ذاتها فإن فعولن تصبح فاعلن، وهذه إذا تكررت كذلك ثماني مرات فإنه يتولد عنها بحر المتدارك.\n\n', 'العنوان: أوزان البحور\nالمحتوى: وكذلك متفاعلن إذا عكست تصير مفاعلتن وتكوِّن بتكرارها مع تفعيلة من نوع آخر بحرًا يسمى:\nالوافر،\nبينما تكرار متفاعلن ست مرات يولد بحرًا آخر هو:\nالكامل، وهكذا.\nوقد رتب العروضيون بحور الشعر الستة عشر على حسب اشتراك كل مجموعة منها في دائرة عروضية واحدة على الوجه التالي:\n1 الطويل، والمديد، والبسيط.\n2 الوافر، والكامل.\n3 الهزج، والرجز، والرمل.\n4 السريع والمنسرح، والخفيف، والمضارع، والمقتضب، والمجتث.\n5 المتقارب، والمتدارك.\nوهذا الترتيب كما ذكرت هو بحسب اشتراك كل مجموعة من البحور في دائرة عروضية لا بحسب كثرة استعمالها أو قلة استعمالها، وسوف نفصل الكلام عن الدوائر العروضية فيما بعد.\nأجزاء البيت:\nينقسم البيت الشعري إلى قسمين متساويين من حيث النغم والقياس الموسيقي، ويعرف كل قسم بالمصراع تشبيهًا بمصراعي الباب، أو بالشطر،\nفيقال:\nالشطر الأول أو الثاني،\nكما يقال:\nالمصراع الأول أو الثاني من البيت.\nالتفعيلة الأخيرة.\nولما كان للتفعيلة الأخيرة من كل شطر أهمية خاصة فقد انفردت بتسمية خاصة.\n\n', 'العنوان: أوزان البحور\nالمحتوى: فالتفعيلة التي في آخر الشطر من البيت تسمى:\nالعروض -بفتح العين-\nوالتفعيلة التي في آخر الشطر الثاني تسمى:\nالضرب،\nوما عدا ذلك من تفاعيل البيت يسمى:\nالحشو،\nهكذا:\nفعولن مفاعيلن فعولن مفاعلن\nحشو عروض\nفعولن مفاعيلن فعولن مفاعلن\nحشو ضرب\nوكل بحر من بحور الشعر له نظام خاص في التغييرات التي تدخل على الحشو أو على العروض أو على الضرب. وسنوضح ذلك عند الكلام على وزن كل بحر.\n\n', 'العنوان: البحر الطويل\nالمحتوى: ...\nالبحر الأول:\nالطويل\n1 وزنه:\nفعولن مفاعيلن فعولن مفاعيلن\nفعولن مفاعيلن فعولن مفاعيلن.\n2 عروضه:\nعروض هذا البحر، أي تفعيلته التي تقع في آخر الشطر الأول من البيت، لا تستعمل تامة، بل يحذف منها الحرف الخامس، أي الياء الساكنة فتصبح مفاعيلن مفاعلن.\nوحذف الخامس الساكن له في العروض اسم اصطلاحي هو:\nالقبض،\nوتسمى التفعيلة التي وقع فيها القبض:\nمقبوضة.\n3 ضربه:\nوضرب هذا البحر، أي تفعيلته التي تقع في آخر الشطر الثاني من البيت، قد يكون مقبوضًا في قصيدة أو غير مقبوض في أخرى.\nوإذا جاء البيت الأول من القصيدة مقبوض العروض والضرب معًا لزم أن يستمر ذلك في بقية أبياتها.\n\n', 'العنوان: البحر الطويل\nالمحتوى: 4 حشو البيت:\nعرفنا أن الحشو هو جميع تفعيلات البيت ما عدا تفعيلة العروض وتفعيلة الضرب.\nوحشو البيت في بحر الطويل يحدث فيه تغيير اختياري بحذف النون الساكنة من فعولن الأولى أو الثالثة أو الخامسة أو السابعة في ترتيب التفاعيل،\nوبذلك تصبح فعولن فعولُ بلام متحركة أي بحذف الخامس الساكن:\nفتكون مقبوضة أيضًا.\nوهذا التغيير غير لازم، فإذا ورد التغيير في فعولن الأولى فلا يلزم في غيرها من بقية البيت، كما أن قبض فعولن في حشو بيت ما لا يستدعي قبضها في حشو بقية الأبيات.\nويجب التنبيه على أن هناك فرقًا من جهة التسمية بين التغيير الذي يحدث في الحشو، والتغيير الذي يحدث في العروض والضرب.\nفالتغيير الذي يحدث في الحشو يسمى:\nالزحاف،\nأما التغيير الذي يحدث في العروض والضرب فيسمى:\nالعلة، وهو تغيير يلتزم.\nوكما يكون الزحاف والعلة في بحر الطويل يكونان كذلك في غيره من البحور، ولكن ينبغي أن نتذكر أن لكل بحر زحافًا خاصًّا وعلة خاصة.\nعروض الطويل وضربه:\nعروض الطويل تأتي مقبوضة دائمًا.\nأما ضربه فيأتي على ثلاثة أنواع:\n\n', 'العنوان: البحر الطويل\nالمحتوى: 1 مقبوضًا كذلك، أي بحذف الخامس الساكن لتصير مفاعيلن مفاعلن.\n2 أو محذوفًا، أي بحذف السبب الأخير من مفاعيلن لتصير مفاعي وتحول إلى مفاعلْ بسكون اللام تسهيلاً للنطق، أو فعولن.\n3 أو صحيحًا، مفاعيلن.\nوعلى هذا يكون نظام البحر الطويل على الوجه التالي:\n1. --- مفاعلن أ. --- مفاعلن أ\n2. --- مفاعلن أ. --- مفاعل ب\n3. --- مفاعلن أ. --- مفاعيلن جـ\nمثال النوع الأول:\nمن معلقة زهير:\nومن هاب أسباب المنايا ينلنه ... وإن يرق أسباب السماء بسلم\nومن ها بأسبابل منايا ينلنهو\nااه اه ااه اه اه ااه اه ااه ااه\nفعولن مفاعيلن فعولن مفاعلن\nوإن ير قأسبابس سماء بسللمي\nااه اه ااه اه اه ااه اااه ااه\nفعولن مفاعيلن فعولُ مفاعلن\n\n', 'العنوان: البحر الطويل\nالمحتوى: ومن ذلك نلاحظ أن عروض هذا البيت هي:\nمفاعلن، وضربه كذلك.\nوهكذا يسير زهير في جميع أبيات معلقته من أولها إلى آخرها.\nأما حشو البيت فنجد أن إحدى تفعيلاته وهي السابعة فعولن دخلها القبض فحولت إلى فعولُ بتحريك اللام وهذا غير لازم.\nالنوع الثاني:\nوهو ما عروضه مقبوضة وضربه محذوف أي: مفاعلْ بسكون اللام.\nوقد افترض العروضيون أن أصل الضرب مفاعيلن فحذف من التفعيلة الأخيرة، أي تفعيلة الضرب السبب الخفيف من آخرها فصارت مفاعي، ولسهولة النطق بها تحولت إلى مفاعلْ بسكون اللام أي تفعيلة خماسية.\nوهذا الضرب يسمى:\nمحذوفًا؛ لحذف السبب الأخير من تفعيلته.\nومثال هذا النوع قول أبي نواس في مدح الخصيب أمير مصر:\nتقول التي من بيتها خف محملي ... عزيز علينا أن نراك تسير\nأما دون مصر للغني متطلب ... بلى.. إن أسباب الغنى لكثير\nفقلت لها واستعجلتها بوادر ... جرت فجرى في جريهن عبير\nذريني أكثر حاسديك برحلة ... إلى بلد فيه الخصيب أمير\nفتى يشتري حسن الثناء بماله ... ويعلم أن الدائرات تدور\nفما جازه جود ولا حل دونه ... ولكن يسير الجود حيث يسير\n\n', 'العنوان: البحر الطويل\nالمحتوى: فتقطيع البيت الأول هكذا:\nتقولل لتي من بيـ تهاخف فمحملي\nفعولن مفاعيلن فعولن مفاعلن\nعزيزن علينا أن نراك تسيرو\nفعولن مفاعيلن فعولُ مفاعلْ\nفالتفعيلة الأخيرة من الشطر الثاني أي الضرب محذوفة.\nومثال آخر قول مسكين الدارمي عندما أوعز إليه معاوية أن يقترح البيعة من بعده لابنه يزيد؛\nليعلم رأي قومه في ذلك:\nألا ليت شعري ما يقول ابن عامر ... ومروان أم ماذا يقول سعيد؟\nبني خلفاء الله مهلاً فإنما ... يبوّئها الرحمن حيث يريد\nإذا المنبر الغربي خلَّاه ربه ... فإن أمير المؤمنين يزيد\nفتقطيع البيت الأول هكذا:\nألالي تشعري ما يقولب نُعامرن\nفعولن مفاعيلن فعولن مفاعلن\nومروا نُأَ مْ مَاذا يقول سعيدو\nفعولن مفاعيلن فعولُ مفاعلْ\nالنوع الثالث:\nما كان عروضه مقبوضة وضربه صحيحًا أي: مفاعيلن،\nكقول الحطيئة في المدح:\nأولئك قوم إن بنوا أحسنوا البنا ... وإن عاهدوا أوفوا وإن عقدوا شدوا\nوإن كانت النعماء فيهم جزوا بها ... وإن أنعموا لا كدَّروها ولا كدُّوا\nمطاعين في الهيجا مكاشيف للدجى ... بنى لهم آؤباهم.. وبنى الجد\nويعذلني أبناء سعد عليهم ... وما قلت إلا بالذي علمت سعد\n\n', 'العنوان: البحر الطويل\nالمحتوى: فتقطيع البيت الأول هكذا:\nألاء كقومي إن بنو أح سنلبنا\nفعولُ مفاعلين فعولن مفاعلن\nوإن عا هدو أوْفَو وإن ع قدو شددو\nفعولن مفاعلين فعولُ مفاعلين\nفالعروض مقبوضة والضرب هنا صحيح وكذلك في بقية الأبيات الأخرى.\nوالخلاصة:\n1 إن عروض الطويل مفاعلن\n2 أما الضرب فهو:\nمفاعلن، أو مفاعلْ بسكون اللام، أو مفاعيلن.\nفإذا رمزنا إلى العروض بالرمز\n(أ)\nأيضًا كان نظام قصائد الطويل كما يلي:\n1 قصيدة فيها الوضع هكذا:\n---- أ ---أ\n---- أ ---أ\nأي مفاعلن في العرض ومفاعلن في الضرب حتى نهاية القصيدة.\n2 وقصيدة أخرى تكون العروض مفاعلن أي\n(أ)\nوالضرب مفاعل أي\n(ب)\nفيكون نظامها كالآتي:\n--- أ ---ب\n--- أ --- ب حتى نهاية القصيدة.\n\n', 'العنوان: البحر الطويل\nالمحتوى: 3 وقصدة ثالثة تكون العروض مفاعل أي\n(أ)\nوالضرب مفاعيلن أي\n(جـ)\nفيكون نظامها هكذا:\n--- أ ---- جـ.\n--- أ ----جـ حتى نهاية القصيدة.\nوالخطوط الأفقية تمثل حشو البيت.\nالتصريع.\nوالتصريع هو أن يجانس الشاعر بين شطري البيت الواحد في مطلع القصيدة أي يجعل العروض مشبهًا للضرب وزنًا وقافية.\nويحدث في النوع الثاني الذي ضربه\n(مفاعل)\nأي\n(ب)\nوفي النوع الثالث الذي ضربه\n(مفاعيلن)\nأي\n(جـ)\n.\nومثال النوع الثاني مطلع قصيدة في الرثاء لشاعر معاصر:\nأفيقوا وإن جل المصاب أفيقوا ... وصونوا عيونًا للدماء تريق.\nوقولوا هنيئًا للألى وهبوا العلى ... نفوسًا إلى نيل المرام تنوق\nوتقطيع الشطر الأول:\nأفيقو وإن جللل مصاب أفيقو\nفعولن مفاعيلن فعولُ مفاعلْ\n(بسكون اللام)\nوتقطيع الشطر الثاني:\nوصونو عيوننلد دماء تريقو\nفعولن مفاعيلن فعولُ مفاعلْ\n(بسكون اللام)\n\n']"," لوزن البيت الشعري في الشعر العربي، يمكنك اتباع الخطوات التالية:

1. تحديد البحر الشعري: يجب أولاً معرفة البحر الشعري الذي ينتمي إليه البيت. هناك ستة عشر بحرًا شعريًا أساسيًا في الشعر العربي، ولكل بحر نظامه الخاص في التفعيلات والأوزان.

2. تقطيع البيت: قم بتقطيع البيت الشعري إلى أجزاء متساوية تسمى ""التفعيلات"". التفعيلة هي وحدة القياس الأساسية في الشعر العربي وتتكون من مجموعة من الحركات والسكون.

3. تحديد التفعيلات: بعد تقطيع البيت، قم بتحديد التفعيلات المستخدمة في كل جزء من البيت. كل بحر شعري يتميز بتفعيلات معينة تتكرر في جميع أجزاء البيت.

4. تحليل التفعيلات: قم بتحليل التفعيلات لتحديد ما إذا كانت هناك تغييرات أو زحافات (تغييرات اختيارية) قد حدثت في التفعيلات. الزحافات تحدث في بعض التفعيلات دون غيرها وقد تؤثر على الوزن الشعري.

5. التحقق من الوزن: بعد تحليل التفعيلات، قم بالتحقق من أن البيت يتبع الوزن الشعري المناسب للبحر الذي ينتمي إليه. يمكنك استخدام قواعد العروض العربية للتحقق من صحة الوزن.

6. مراجعة البيت: إذا كان البيت يفي بمعايير الوزن الشعري، فهو موزون بشكل صحيح. إذا لم يكن كذلك، قد تحتاج إلى تعديل التفعيلات أو إعادة النظر في تقطيع البيت.

تذكر أن وزن البيت الشعري يعتمد على البحر الشعري والتفعيلات المستخدمة فيه، وقد يتطلب فهمًا جيدًا لقواعد العروض العربية. ",يوزن البيت الشعري بتقسيمه إلى تفاعيل وفق البحر الذي ينتمي إليه.,,0.2,,0.8907584993396801
ما هو العروض في البيت الشعري؟,"['العنوان: مقدمة\nالمحتوى: بسم الله الرحمن الرحيم هذه محاضرات في علم العروض والقافية ألقيتها على طلبة الصف الأول بقسم اللغة العربية في جامعة بيروت العربية.\nوقد حاولت جهدي عرض قضايا هذا العلم على نحو ييسر على دارسيه تفهمه والإلمام بأهم مصطلحاته وجوانبه التي لها أثر في موسيقي الشعر.\nولما كان تمثل الدارس للجانب النظري من هذا العلم لا يتم إلا إذا كان معززًا بالجانب التطبيقي، فقد أكثرت من الأمثلة والشواهد المختارة من قديم الشعر وحديثه.\nوعسى أن يجد القارئ في هذا الجهد المتواضع عونًا له على إدراك موسيقى الشعر ممثلة في أوزانه وقوافيه وكل ما يتصل بهما.\nالمؤلف\n\n', 'العنوان: تمهيد\nالمحتوى: 1 العروض والخليل بن أحمد:\nالعروض:\n""علم يُبْحث فيه عن أحوال الأوزان المعتبرة""\n1 أو\n""هو ميزان الشعر، به يعرف مكسوره من موزونه، كما أن النحو معيار الكلام به يعرف معربه من ملحونه""\n2.\nويرجع رجال التراجم الفضل في نشأة علم العروض إلى الخليل بن أحمد، أحد أئمة اللغة والأدب في القرن الثاني الهجري، فابن خلكان يذكر أن الخليل كان إمامًا في علم النحو، وأنه هو الذي استنبط علم العروض وأخرجه إلى الوجود وحصر أقسامه في خمس دوائر يستخرج منها خمسة عشر بحرًا، ثم زاد الأخفش بحرًا واحدًا وسماه الخبب، كما يذكر أن الخليل كان له معرفة بالإيقاع والنغم، وتلك المعرفة أحدثت له علم العروض، فإنهما متقاربان في المأخذ 3\n\n', 'العنوان: تمهيد\nالمحتوى: ويحدثنا ياقوت عن الخليل بن أحمد بأنه أول من استخرج العروض وضبط اللغة وحصر أشعار العرب، وأن معرفته بالإيقاع -بناء ألحان الغناء على موقعها وميزانها- هي التي أحدثت له علم العروض1.\nكذلك يحدثنا القفطيّ عن الخليل بأنه سيد الأدباء في علمه وزهده، وأنه نحويّ لغويّ عروضيّ، استنبط من العروض وعلله ما لم يستخرجه أحد، ولم يسبقه إلى علمه سابق من العلماء كلهم2.\nوروى ابن خلكان عن حمزة بن الحسن الأصفهاني نقلاً عن كتابه التنبيه على حدوث التصحيف.\nقوله:\nإن دولة الإسلام لم تخرج أبدع للعلوم التي لم يكن لها عند العرب أصول من الخليل، وليس على ذلك برهان أوضح من علم العروض الذي لا عن حكيم أخذه، ولا على مثال تقدمه احتذاه، وإنما اخترعه من ممر له بالصفارين، من وقع مطرقة على طست.\nمن ذلك يرى أن الخليل هو أول مبتكر لعلم العروض وحصر كل أشعار العرب في بحوره. ولم تقف عقليته المبتكرة عند هذا الحد، وإنما تجاوزته إلى ابتكار علوم أخرى، فهو أول مبتكر لفكرة المعاجم العربية بوضعه معجم العين، الذي يحصر لغة أمة من الأمم قاطبة، وهو الذي وضع أساس علم النحو باستخراج مسائله وتعليله، وإمداده سيبويه من علم النحو بما صنف منه كتابه الذي هو زينة لدولة الإسلام كما يذكر القفطيّ، ثم هو الذي اخترع علم الموسيقى العربية وجمع فيه أصناف النغم.\nولكن لا ينبغي أن يفهم من وضع الخليل لعلم العروض أن العرب لم تكن\n\n', 'العنوان: تمهيد\nالمحتوى: تعرف أوزان الشعر من قبل، فالواقع أنهم كانوا قبل وضع علم العروض على علم بأوزان الشعر العربي وبحوره على تباينها، وإن لم تكن تعرفها بالأسماء التي وضعها الخليل لها فيما بعد. وما أشبه علمها بذلك بعلمها بالإعراب في الكلام حين كانوا عن سليقة يرفعون أو ينصبون أو يجرون ما حقه الرفع أو النصب أو الجر دون علم بما وضعه النحاة فيما بعد من مصطلحات الإعراب وقواعده.\nكذلك كانوا بذوقهم وسيلقتهم يدركون ما يعتور الأوزان المختلفة من زحافات وعلل وإن لم يعطوها أسماء ومصطلحات خاصة كما فعل العروضيون.\nوإذا كان الخليل بن أحمد غير مسبوق في وضع علم العروض، فإن أبا عمرو بن العلاء قد سبقه في الكلام عن القوافي وقواعدها ووضع لها أسماء ومصطلحات خاصة.\nوالرواة مختلفون بشأن الباعث الذي دعا الخليل إلى التفكير في علم العروض ووضع قواعده.\nفمن قائل:\nإنه دعا بمكة أن يرزقه الله علمًا لم يسبقه إليه أحد ولا يؤخذ إلا عنه، فرجع من حجه، ففتح عليه بعلم العروض1.\nومن قائل:\nإن الدافع هو إشفاقه من اتجاه بعض شعراء عصره إلى نظم الشعر على أوزان لم يعرفها العرب ولم تسمع عنهم؛ ولهذا راح يقضي الساعات والأيام يوقع بأصابعه ويحركها حتى حصر أوزان الشعر العربي وضبط أحوال قوافيه.\nومن قائل:\nإنه وجد نفسه وهو بمكة يعيش في بيئة يشيع فيها الغناء فدفعه ذلك إلى التفكير في الوزن الشعري وما يمكن أن يخضع له من قواعد\n\n', 'العنوان: تمهيد\nالمحتوى: وأصول. وقد عكف أيامًا وليالي يستعرض فيها ما روي من أشعار ذات أنغام موسيقية متعددة،\nثم خرج على الناس بقواعد مضبوطة وأصول محكمة سماها:\nعلم العروض.\nوأيًّا كان الدافع فالثابت أن الخليل هو واضع أصول علم العروض وقوانينه التي لم يطرأ تغيير جوهري عليها، وأن الناس ظلوا حتى اليوم يتدارسونها ويتفهمونها من غير أن يزيد عليها أحد شيئًا. فلا تزال الوحدات القياسية للأوزان هي التفعيلات التي اخترعها الخليل، ولا تزال المقاطع الصوتية التي تتألف منها التفعيلات هي الأسباب والأوتاد، كما أن عدد البحور لا يزال ثابتًا عند البحور الخمسة عشر التي وضعها الخليل وبحر الخبب أو المتدارك الذي وضعه تلميذه الأخفش الأوسط أبو الحسن سعيد بن مسعدة، ولا يرد علينا هنا بما استحدث من أوزان في العصر العباسي؛ لأن هذه يمكن إرجاع أصولها إلى أوزان الخليل.\nوتجدر الإشارة إلى أن هناك فارقًا ملحوظًا بين علم العروض وعلوم العربية الأخرى من حيث النشأة. فعلوم النحو والصرف والبلاغة واللغة مثلاً قد استحدثت ثم أخذت تنمو جيلاً بعد جيل وعصرًا بعد عصر حتى بلغت ذروة اكتمالها، أما العروض فقد أخرجه الخليل علمًا يكاد يكون متكاملاً، ولعل ذلك هو السر في أن من أتى بعد الخليل من العروضيين لم يستطيعوا أن يزيدوا على عروضه أي زيادة تذكر أو تمس الجوهر.\nوكما اختلفت الآراء بالنسبة إلى الباعث الذي دعا الخليل إلى التفكير في علم العروض، اختلفت كذلك بالنسبة إلى سبب تسمية هذا العلم بالعروض.\nفمن قائل:\nإن من معاني العروض مكة لاعتراضها وسط البلاد، ومن ثم أطلق الخليل على علم ميزان الشعر الذي اخترعه اسم المكان الذي ألهم فيه قواعده وأصوله.\n\n', 'العنوان: تمهيد\nالمحتوى: ومن قائل:\nإنه سمي عروضًا باسم عمان التي كان يقيم فيها واضعه ومخترعه الخليل بن أحمد. ويذكر صاحب لسان العرب أنه سمي عروضًا؛ لأن الشعر يعرض عليه،\nأي:\nيوزن بواسطته.\n2 الحاجة إلى علم العروض:\nعرفنا مما سبق أن العروض هو علم ميزان الشعر أو موسيقى الشعر، وهو علم له قواعده وأصوله ونظرياته التي تحصل وتكتسب بالتعلم، وإذا كان الشعر من الناحية العملية هو الجانب التطبيقي لقواعد العروض وأصوله ونظرياته، فإنه قبل ذلك فن كسائر الفنون مصدره الموهبة والاستعداد.\nوقد يستطيع الشاعر الموهوب بما له من أذن موسيقية وحس وذوق مرهفين أن يقول الشعر دون علم بالعروض وحاجة إلى قوانينه، ولكنه مع ذلك يظل بحاجة إلى دراسة علم العروض والإلمام بأصوله.\nفأذن الشاعر الموسيقية -مهما كانت درجة رهافتها وحساسيتها- قد تخذل صاحبها أحيانًا في التمييز بين الأوزان المتقاربة أو بين قافية سليمة وأخرى معيبة، أو بين زحاف جائز وآخر غير جائز.\nوجهل الشاعر الموهوب بأوزان الشعر وبحوره المختلفة من تامة ومجزوءة ومشطورة ومنهوكة قد يحصر شعره في بعض أوزان خاصة، وبذلك يحرم نفسه من العزف على أوتار شتى تجعل شعره منوع الأنغام والألحان من ذلك تتجلى أهمية دراسة الشاعر للعروض والإلمام بقوانينه وأصوله.\nوإذا كان العروض إلى هذا القدر لازمًا للشاعر الملهم الموهوب، فإنه يكون أشد لزومًا لغيره. فهو أشد لزومًا لطلاب اللغة والتخصص فيها؛ لأنه يعينهم على فهم الشعر العربي وقراءته قراءة صحيحة والتمييز بين سليمه ومختله وزنًا.\n\n', 'العنوان: تمهيد\nالمحتوى: وهو كذلك أشد لزومًا للدارسين والمتخصصين في فروع الثقافة العربية من تاريخ واجتماع وأدب وبلاغة ومذاهب دينية أو عقلية. فالباحثون في أمثال هذه العلوم العربية لا غنى لهم عن تفهم ما يرد من شعر في المراجع والكتب المختصة بهذه العلوم. وفهم أولئك للشعر متوقف على صحة قراءته، وهذه لا تتأتى إلا لمن لديه القدرة على معرفة صحيح الأوزان والتمييز بين أنواعها المختلفة.\nمن أجل ذلك كله ندرك ضرورة الإلمام بعلم العروض أو علم موسيقى الشعر وأصوله، لا بالنسبة للشعراء فحسب، ولكن بالنسبة أيضًا لذوي التخصص في علوم العربية. وإذا جاز أن يغتفر لغير متخصص ألا يقيم وزن الشعر وألا يقرأه قراءة صحيحة، فإن ذلك لا يمكن أن يغتفر مطلقًا للمتخصص.\n3 الصلة بين العروض والموسيقى:\nعرفنا أن العروض هو علم موسيقى الشعر، وعلى ذلك يكون هناك صلة تجمع بينه وبين الموسيقى بصفة عامة، وهذه الصلة تتمثل في الجانب الصوتي.\nفالموسيقى تقوم على تقسيم الجمل إلى مقاطع صوتية تختلف طولاً وقصرًا، أو إلى وحدات صوتية معينة على نسق معين، بغض النظر عن بداية الكلمات ونهايتها.\nوكذلك شأن العروض، فالبيت من الشعر يقسم إلى وحدات صوتية معينة، أو إلى مقاطع صوتية تعرف بالتفاعيل بقطع النظر عن بداية الكلمات ونهايتها. فقد ينتهي المقطع الصوتي أو التفعيلة في آخر كلمة، وقد ينتهي في وسطها، وقد يبدأ من نهاية كلمة وينتهي ببدء الكلمة التي تليها.\nوهاكم مثالاً على ذلك:\nلا تسألي القوم ما مالي وما حسبي ... وسائلي للقوم ما حزمي وما خلقي\n\n', 'العنوان: تمهيد\nالمحتوى: فتقطيع هذا البيت أو تقسيمه إلى وحدات صوتية أو تفاعيل يكون كالآتي:\nلا تَسْأَلِلْ قَومَ مَا مَالِي َمَاحَسَبِي ... مستفعلن فاعلن مستفعلن فعلن\nوَسَائِلِلْ قَومَ ما حَزْمِي وَمَا خُلُقِي ... متفعلن فاعلن مستفعلن فعلن\nولكن تقطيع البيت أو تقسيمه إلى وحدات صوتية أو تفاعيل لا يتحقق إلا إذا كتب الشعر كتابة عروضية فما الكتابة العروضية؟\n4 الكتابة العروضية.\nأوضحنا فيما سبق الصلة الوثيقة التي بين العروض والموسيقى، وهي صلة الفرع المتولد من الأصل، فالعروض في الحقيقة أمره ليس إلا ضربًا من الموسيقى اختص بالشعر على أنه مقوم من مقوماته.\nوإذا كان للموسيقى عند كتابتها رموز خاصة يدل بها على الأنغام المختلفة، فإن للعروض كذلك رموزًا خاصة به في الكتابة تخالف الكتابة الإملائية التي تكون على حسب قواعد الإملاء المتعارف عليها. وهذه الرموز العروضية يدل بها على التفاعيل التي هي بمثابة أنغام الموسيقي المختلفة.\nوالكتابة العروضية تقوم على أمرين أساسيين هما:\n1 ما ينطق يكتب.\n2 ما لا ينطق لا يكتب.\nوتحقيق هذين الأمرين عند الكتابة العروضية يستلزم زيادة بعض أحرف\n\n', 'العنوان: تمهيد\nالمحتوى: لا تكتب إملائيًا وحذف بعض أحرف تكتب إملائيًا.\nوفيما يلي تفصيل للأحرف التي تزاد أوتحذف في الكتابة العروضية:\nأ-\nالحروف التي تزاد:\nتزاد في الكتابة العروضية ستة أحرف هي:\n1 إذا كان الحرف مشددًا فك التشديد ورسم الحرف أو كتب مرتين:\nمرة ساكنًا ومرة متحركًا،\nنحو:\nرق، وعد، وهز،\nفتكتب عروضيًّا:\nرقق، وعدد، وهزز.\n2 إذا كان الحرف منونًا كتب التنوين نونًا،\nنحو:\nجبل، وشجر، وأسد،\nفتكتب عروضيًّا:\nجبلن، وشجرن، وأسدن، رفعًا ونصبًا وجرًّا.\n3 تزاد ألف في بعض أسماء الإشارة،\nنحو:\nهذا، وهذه، وهذان، وهذين، وهؤلاء، وذلك،\nفتكتب عروضيًّا:\nهاذا، وهاذه، وهاذان، وهاذين، وهاؤلاء، وذالك. كذلك تزاد ألف في لفظ الجلالة، وفي لكن المخففة والمشددة،\nفهذه الكلمات:\nالله، ولكن، ولكن،\nتكتب عروضيًّا هكذا:\nاللاه، ولاكن، ولاكنن.\n4 تزاد واو في بعض الأسماء كما في:\nداود، وطاوس، وناوس،\nفتكتب عروضيًّا:\nداوود، وطاووس، وناووس.\n5 تكتب حركة حرف القافية حرفًا مجانسًا للحركة، فإذا كانت حركة حرف القافية ضمة كتبت هذه الضمة عروضيًّا واوًا، وإذا كانت كسرة كتبت ياء، وإذا كانت فتحة كتبت ألفًا.\n6 إذا أشبعت حركة هاء الضمير للمفرد المذكر الغائب، كتبت\n\n', 'العنوان: تمهيد\nالمحتوى: حرفًا مجانسًا للحركة.\nفالضمة التي على الهاء في:\nله، ومنه، وعنه،\nإذا أشبعت كتبت عروضيًّا واوًا هكذا:\nلهو، ومنهو، وعنهو.\nوكسرة الهاء في:\nبه وإليه، وفيه،\nإذا أشبعت كتبت عروضيًّا هكذا:\nبهي، وإليهي، وفيهي.\nأما كاف المخاطب أو المخاطبة فلا تشبع، وبالتالي لا يزاد بعدها أي حرف،\nنحو:\nبك، وبكِ، ومنك ومنكِ، وإليك وإليكِ.\nب-\nالأحرف التي تحذف:\n1 تحذف همزة الوصل، وهي الألف التي يتوصل بها إلى النطق بالساكن، إن كان قبلها متحرك.\nويكون ذلك في:\nأ- ماضي الأفعال الخماسية والسداسية المبدوءة بالهمزة، وفي أمرها ومصدرها،\nنحو:\nانْطَلَق، استغْفَر، انطلِق، استغفِر، انطلاق، استغفار.\nفألف الوصل في هذه الكلمات وأمثالها تحذف إن كان قبلها متحرك عند الكتابة العروضية هكذا:\nفنطلَق، فستغفَر، فنطلِق فستغفِر، فنطلاق، فستغفار.\nب-\nالأسماء العشرة المسموعة وهي:\nاسم، ابن، ابنة، امرؤ، امرأة، اثنان، اثنتان، أيمن المختصة بالقسم، است.\nفمثلاً:\nباسمك، وهذا أب وابن، والعام اثنا عشر شهرًا،\nتكتب عروضيًّا هكذا:\nبسمك، وهاذا أبن وبنن، والعام ثنا عشر شهرن.\nج- أمر الفعل الثلاثي الساكن ثاني مضارعه،\nنحو:\nفاسمع واكتب واقرأ،\nفإنها تكتب عروضيًّا هكذا:\nفسمعْ، وكتبْ، وقرأْ.\nد- ألف الوصل من أل المعرفة. فإذا كانت أل قمرية، كما\n\n']"," العروض في البيت الشعري هو علم يدرس موسيقى الشعر وأوزانه وقوافيه. يهتم بتحليل الأبيات الشعرية وفهم تركيبها الموسيقي والوزن الشعري الذي تتبعه. يساعد العروض الشعراء على تنظيم قصائدهم بشكل متناسق وجميل، ويعين الدارسين على فهم الشعر العربي والتمييز بين الأوزان المختلفة.

في البيت الشعري، يمكن تحديد العروض من خلال تحليل التفاعيل (الوحدات الصوتية) التي يتكون منها البيت. التفاعيل تتبع قواعد معينة في تركيبها وترتيبها، وهذا ما يميز العروض عن غيره من العلوم المتعلقة بالشعر.

على سبيل المثال، في البيت الشعري التالي:

لا تسألي القوم ما مالي وما حسبي ... وسائلي للقوم ما حزمي وما خلقي

يمكن تحليل العروض على النحو التالي:

لا تَسْأَلِلْ قَومَ مَا مَالِي َمَاحَسَبِي ... مستفعلن فاعلن مستفعلن فعلن
وَسَائِلِلْ قَومَ ما حَزْمِي وَمَا خُلُقِي ... متفعلن فاعلن مستفعلن فعلن

هنا، تم تقسيم البيت إلى تفاعيل (مستفعلن، فاعلن، مستفعلن، فعلن) بناءً على قواعد العروض.

إذا كنت ترغب في معرفة المزيد عن العروض وكيفية تطبيقه على الأبيات الشعرية، يمكنك الرجوع إلى المصادر المتخصصة في علم العروض والقافية. ",العروض هي التفعيلة الأخيرة من الشطر الأول في البيت الشعري.,,0.0,,0.8553553879950101
لماذا يحتاج الشاعر إلى علم العروض؟,"['العنوان: مقدمة\nالمحتوى: بسم الله الرحمن الرحيم هذه محاضرات في علم العروض والقافية ألقيتها على طلبة الصف الأول بقسم اللغة العربية في جامعة بيروت العربية.\nوقد حاولت جهدي عرض قضايا هذا العلم على نحو ييسر على دارسيه تفهمه والإلمام بأهم مصطلحاته وجوانبه التي لها أثر في موسيقي الشعر.\nولما كان تمثل الدارس للجانب النظري من هذا العلم لا يتم إلا إذا كان معززًا بالجانب التطبيقي، فقد أكثرت من الأمثلة والشواهد المختارة من قديم الشعر وحديثه.\nوعسى أن يجد القارئ في هذا الجهد المتواضع عونًا له على إدراك موسيقى الشعر ممثلة في أوزانه وقوافيه وكل ما يتصل بهما.\nالمؤلف\n\n', 'العنوان: تمهيد\nالمحتوى: 1 العروض والخليل بن أحمد:\nالعروض:\n""علم يُبْحث فيه عن أحوال الأوزان المعتبرة""\n1 أو\n""هو ميزان الشعر، به يعرف مكسوره من موزونه، كما أن النحو معيار الكلام به يعرف معربه من ملحونه""\n2.\nويرجع رجال التراجم الفضل في نشأة علم العروض إلى الخليل بن أحمد، أحد أئمة اللغة والأدب في القرن الثاني الهجري، فابن خلكان يذكر أن الخليل كان إمامًا في علم النحو، وأنه هو الذي استنبط علم العروض وأخرجه إلى الوجود وحصر أقسامه في خمس دوائر يستخرج منها خمسة عشر بحرًا، ثم زاد الأخفش بحرًا واحدًا وسماه الخبب، كما يذكر أن الخليل كان له معرفة بالإيقاع والنغم، وتلك المعرفة أحدثت له علم العروض، فإنهما متقاربان في المأخذ 3\n\n', 'العنوان: تمهيد\nالمحتوى: ويحدثنا ياقوت عن الخليل بن أحمد بأنه أول من استخرج العروض وضبط اللغة وحصر أشعار العرب، وأن معرفته بالإيقاع -بناء ألحان الغناء على موقعها وميزانها- هي التي أحدثت له علم العروض1.\nكذلك يحدثنا القفطيّ عن الخليل بأنه سيد الأدباء في علمه وزهده، وأنه نحويّ لغويّ عروضيّ، استنبط من العروض وعلله ما لم يستخرجه أحد، ولم يسبقه إلى علمه سابق من العلماء كلهم2.\nوروى ابن خلكان عن حمزة بن الحسن الأصفهاني نقلاً عن كتابه التنبيه على حدوث التصحيف.\nقوله:\nإن دولة الإسلام لم تخرج أبدع للعلوم التي لم يكن لها عند العرب أصول من الخليل، وليس على ذلك برهان أوضح من علم العروض الذي لا عن حكيم أخذه، ولا على مثال تقدمه احتذاه، وإنما اخترعه من ممر له بالصفارين، من وقع مطرقة على طست.\nمن ذلك يرى أن الخليل هو أول مبتكر لعلم العروض وحصر كل أشعار العرب في بحوره. ولم تقف عقليته المبتكرة عند هذا الحد، وإنما تجاوزته إلى ابتكار علوم أخرى، فهو أول مبتكر لفكرة المعاجم العربية بوضعه معجم العين، الذي يحصر لغة أمة من الأمم قاطبة، وهو الذي وضع أساس علم النحو باستخراج مسائله وتعليله، وإمداده سيبويه من علم النحو بما صنف منه كتابه الذي هو زينة لدولة الإسلام كما يذكر القفطيّ، ثم هو الذي اخترع علم الموسيقى العربية وجمع فيه أصناف النغم.\nولكن لا ينبغي أن يفهم من وضع الخليل لعلم العروض أن العرب لم تكن\n\n', 'العنوان: تمهيد\nالمحتوى: تعرف أوزان الشعر من قبل، فالواقع أنهم كانوا قبل وضع علم العروض على علم بأوزان الشعر العربي وبحوره على تباينها، وإن لم تكن تعرفها بالأسماء التي وضعها الخليل لها فيما بعد. وما أشبه علمها بذلك بعلمها بالإعراب في الكلام حين كانوا عن سليقة يرفعون أو ينصبون أو يجرون ما حقه الرفع أو النصب أو الجر دون علم بما وضعه النحاة فيما بعد من مصطلحات الإعراب وقواعده.\nكذلك كانوا بذوقهم وسيلقتهم يدركون ما يعتور الأوزان المختلفة من زحافات وعلل وإن لم يعطوها أسماء ومصطلحات خاصة كما فعل العروضيون.\nوإذا كان الخليل بن أحمد غير مسبوق في وضع علم العروض، فإن أبا عمرو بن العلاء قد سبقه في الكلام عن القوافي وقواعدها ووضع لها أسماء ومصطلحات خاصة.\nوالرواة مختلفون بشأن الباعث الذي دعا الخليل إلى التفكير في علم العروض ووضع قواعده.\nفمن قائل:\nإنه دعا بمكة أن يرزقه الله علمًا لم يسبقه إليه أحد ولا يؤخذ إلا عنه، فرجع من حجه، ففتح عليه بعلم العروض1.\nومن قائل:\nإن الدافع هو إشفاقه من اتجاه بعض شعراء عصره إلى نظم الشعر على أوزان لم يعرفها العرب ولم تسمع عنهم؛ ولهذا راح يقضي الساعات والأيام يوقع بأصابعه ويحركها حتى حصر أوزان الشعر العربي وضبط أحوال قوافيه.\nومن قائل:\nإنه وجد نفسه وهو بمكة يعيش في بيئة يشيع فيها الغناء فدفعه ذلك إلى التفكير في الوزن الشعري وما يمكن أن يخضع له من قواعد\n\n', 'العنوان: تمهيد\nالمحتوى: وأصول. وقد عكف أيامًا وليالي يستعرض فيها ما روي من أشعار ذات أنغام موسيقية متعددة،\nثم خرج على الناس بقواعد مضبوطة وأصول محكمة سماها:\nعلم العروض.\nوأيًّا كان الدافع فالثابت أن الخليل هو واضع أصول علم العروض وقوانينه التي لم يطرأ تغيير جوهري عليها، وأن الناس ظلوا حتى اليوم يتدارسونها ويتفهمونها من غير أن يزيد عليها أحد شيئًا. فلا تزال الوحدات القياسية للأوزان هي التفعيلات التي اخترعها الخليل، ولا تزال المقاطع الصوتية التي تتألف منها التفعيلات هي الأسباب والأوتاد، كما أن عدد البحور لا يزال ثابتًا عند البحور الخمسة عشر التي وضعها الخليل وبحر الخبب أو المتدارك الذي وضعه تلميذه الأخفش الأوسط أبو الحسن سعيد بن مسعدة، ولا يرد علينا هنا بما استحدث من أوزان في العصر العباسي؛ لأن هذه يمكن إرجاع أصولها إلى أوزان الخليل.\nوتجدر الإشارة إلى أن هناك فارقًا ملحوظًا بين علم العروض وعلوم العربية الأخرى من حيث النشأة. فعلوم النحو والصرف والبلاغة واللغة مثلاً قد استحدثت ثم أخذت تنمو جيلاً بعد جيل وعصرًا بعد عصر حتى بلغت ذروة اكتمالها، أما العروض فقد أخرجه الخليل علمًا يكاد يكون متكاملاً، ولعل ذلك هو السر في أن من أتى بعد الخليل من العروضيين لم يستطيعوا أن يزيدوا على عروضه أي زيادة تذكر أو تمس الجوهر.\nوكما اختلفت الآراء بالنسبة إلى الباعث الذي دعا الخليل إلى التفكير في علم العروض، اختلفت كذلك بالنسبة إلى سبب تسمية هذا العلم بالعروض.\nفمن قائل:\nإن من معاني العروض مكة لاعتراضها وسط البلاد، ومن ثم أطلق الخليل على علم ميزان الشعر الذي اخترعه اسم المكان الذي ألهم فيه قواعده وأصوله.\n\n', 'العنوان: تمهيد\nالمحتوى: ومن قائل:\nإنه سمي عروضًا باسم عمان التي كان يقيم فيها واضعه ومخترعه الخليل بن أحمد. ويذكر صاحب لسان العرب أنه سمي عروضًا؛ لأن الشعر يعرض عليه،\nأي:\nيوزن بواسطته.\n2 الحاجة إلى علم العروض:\nعرفنا مما سبق أن العروض هو علم ميزان الشعر أو موسيقى الشعر، وهو علم له قواعده وأصوله ونظرياته التي تحصل وتكتسب بالتعلم، وإذا كان الشعر من الناحية العملية هو الجانب التطبيقي لقواعد العروض وأصوله ونظرياته، فإنه قبل ذلك فن كسائر الفنون مصدره الموهبة والاستعداد.\nوقد يستطيع الشاعر الموهوب بما له من أذن موسيقية وحس وذوق مرهفين أن يقول الشعر دون علم بالعروض وحاجة إلى قوانينه، ولكنه مع ذلك يظل بحاجة إلى دراسة علم العروض والإلمام بأصوله.\nفأذن الشاعر الموسيقية -مهما كانت درجة رهافتها وحساسيتها- قد تخذل صاحبها أحيانًا في التمييز بين الأوزان المتقاربة أو بين قافية سليمة وأخرى معيبة، أو بين زحاف جائز وآخر غير جائز.\nوجهل الشاعر الموهوب بأوزان الشعر وبحوره المختلفة من تامة ومجزوءة ومشطورة ومنهوكة قد يحصر شعره في بعض أوزان خاصة، وبذلك يحرم نفسه من العزف على أوتار شتى تجعل شعره منوع الأنغام والألحان من ذلك تتجلى أهمية دراسة الشاعر للعروض والإلمام بقوانينه وأصوله.\nوإذا كان العروض إلى هذا القدر لازمًا للشاعر الملهم الموهوب، فإنه يكون أشد لزومًا لغيره. فهو أشد لزومًا لطلاب اللغة والتخصص فيها؛ لأنه يعينهم على فهم الشعر العربي وقراءته قراءة صحيحة والتمييز بين سليمه ومختله وزنًا.\n\n', 'العنوان: تمهيد\nالمحتوى: وهو كذلك أشد لزومًا للدارسين والمتخصصين في فروع الثقافة العربية من تاريخ واجتماع وأدب وبلاغة ومذاهب دينية أو عقلية. فالباحثون في أمثال هذه العلوم العربية لا غنى لهم عن تفهم ما يرد من شعر في المراجع والكتب المختصة بهذه العلوم. وفهم أولئك للشعر متوقف على صحة قراءته، وهذه لا تتأتى إلا لمن لديه القدرة على معرفة صحيح الأوزان والتمييز بين أنواعها المختلفة.\nمن أجل ذلك كله ندرك ضرورة الإلمام بعلم العروض أو علم موسيقى الشعر وأصوله، لا بالنسبة للشعراء فحسب، ولكن بالنسبة أيضًا لذوي التخصص في علوم العربية. وإذا جاز أن يغتفر لغير متخصص ألا يقيم وزن الشعر وألا يقرأه قراءة صحيحة، فإن ذلك لا يمكن أن يغتفر مطلقًا للمتخصص.\n3 الصلة بين العروض والموسيقى:\nعرفنا أن العروض هو علم موسيقى الشعر، وعلى ذلك يكون هناك صلة تجمع بينه وبين الموسيقى بصفة عامة، وهذه الصلة تتمثل في الجانب الصوتي.\nفالموسيقى تقوم على تقسيم الجمل إلى مقاطع صوتية تختلف طولاً وقصرًا، أو إلى وحدات صوتية معينة على نسق معين، بغض النظر عن بداية الكلمات ونهايتها.\nوكذلك شأن العروض، فالبيت من الشعر يقسم إلى وحدات صوتية معينة، أو إلى مقاطع صوتية تعرف بالتفاعيل بقطع النظر عن بداية الكلمات ونهايتها. فقد ينتهي المقطع الصوتي أو التفعيلة في آخر كلمة، وقد ينتهي في وسطها، وقد يبدأ من نهاية كلمة وينتهي ببدء الكلمة التي تليها.\nوهاكم مثالاً على ذلك:\nلا تسألي القوم ما مالي وما حسبي ... وسائلي للقوم ما حزمي وما خلقي\n\n', 'العنوان: تمهيد\nالمحتوى: فتقطيع هذا البيت أو تقسيمه إلى وحدات صوتية أو تفاعيل يكون كالآتي:\nلا تَسْأَلِلْ قَومَ مَا مَالِي َمَاحَسَبِي ... مستفعلن فاعلن مستفعلن فعلن\nوَسَائِلِلْ قَومَ ما حَزْمِي وَمَا خُلُقِي ... متفعلن فاعلن مستفعلن فعلن\nولكن تقطيع البيت أو تقسيمه إلى وحدات صوتية أو تفاعيل لا يتحقق إلا إذا كتب الشعر كتابة عروضية فما الكتابة العروضية؟\n4 الكتابة العروضية.\nأوضحنا فيما سبق الصلة الوثيقة التي بين العروض والموسيقى، وهي صلة الفرع المتولد من الأصل، فالعروض في الحقيقة أمره ليس إلا ضربًا من الموسيقى اختص بالشعر على أنه مقوم من مقوماته.\nوإذا كان للموسيقى عند كتابتها رموز خاصة يدل بها على الأنغام المختلفة، فإن للعروض كذلك رموزًا خاصة به في الكتابة تخالف الكتابة الإملائية التي تكون على حسب قواعد الإملاء المتعارف عليها. وهذه الرموز العروضية يدل بها على التفاعيل التي هي بمثابة أنغام الموسيقي المختلفة.\nوالكتابة العروضية تقوم على أمرين أساسيين هما:\n1 ما ينطق يكتب.\n2 ما لا ينطق لا يكتب.\nوتحقيق هذين الأمرين عند الكتابة العروضية يستلزم زيادة بعض أحرف\n\n', 'العنوان: تمهيد\nالمحتوى: لا تكتب إملائيًا وحذف بعض أحرف تكتب إملائيًا.\nوفيما يلي تفصيل للأحرف التي تزاد أوتحذف في الكتابة العروضية:\nأ-\nالحروف التي تزاد:\nتزاد في الكتابة العروضية ستة أحرف هي:\n1 إذا كان الحرف مشددًا فك التشديد ورسم الحرف أو كتب مرتين:\nمرة ساكنًا ومرة متحركًا،\nنحو:\nرق، وعد، وهز،\nفتكتب عروضيًّا:\nرقق، وعدد، وهزز.\n2 إذا كان الحرف منونًا كتب التنوين نونًا،\nنحو:\nجبل، وشجر، وأسد،\nفتكتب عروضيًّا:\nجبلن، وشجرن، وأسدن، رفعًا ونصبًا وجرًّا.\n3 تزاد ألف في بعض أسماء الإشارة،\nنحو:\nهذا، وهذه، وهذان، وهذين، وهؤلاء، وذلك،\nفتكتب عروضيًّا:\nهاذا، وهاذه، وهاذان، وهاذين، وهاؤلاء، وذالك. كذلك تزاد ألف في لفظ الجلالة، وفي لكن المخففة والمشددة،\nفهذه الكلمات:\nالله، ولكن، ولكن،\nتكتب عروضيًّا هكذا:\nاللاه، ولاكن، ولاكنن.\n4 تزاد واو في بعض الأسماء كما في:\nداود، وطاوس، وناوس،\nفتكتب عروضيًّا:\nداوود، وطاووس، وناووس.\n5 تكتب حركة حرف القافية حرفًا مجانسًا للحركة، فإذا كانت حركة حرف القافية ضمة كتبت هذه الضمة عروضيًّا واوًا، وإذا كانت كسرة كتبت ياء، وإذا كانت فتحة كتبت ألفًا.\n6 إذا أشبعت حركة هاء الضمير للمفرد المذكر الغائب، كتبت\n\n', 'العنوان: تمهيد\nالمحتوى: حرفًا مجانسًا للحركة.\nفالضمة التي على الهاء في:\nله، ومنه، وعنه،\nإذا أشبعت كتبت عروضيًّا واوًا هكذا:\nلهو، ومنهو، وعنهو.\nوكسرة الهاء في:\nبه وإليه، وفيه،\nإذا أشبعت كتبت عروضيًّا هكذا:\nبهي، وإليهي، وفيهي.\nأما كاف المخاطب أو المخاطبة فلا تشبع، وبالتالي لا يزاد بعدها أي حرف،\nنحو:\nبك، وبكِ، ومنك ومنكِ، وإليك وإليكِ.\nب-\nالأحرف التي تحذف:\n1 تحذف همزة الوصل، وهي الألف التي يتوصل بها إلى النطق بالساكن، إن كان قبلها متحرك.\nويكون ذلك في:\nأ- ماضي الأفعال الخماسية والسداسية المبدوءة بالهمزة، وفي أمرها ومصدرها،\nنحو:\nانْطَلَق، استغْفَر، انطلِق، استغفِر، انطلاق، استغفار.\nفألف الوصل في هذه الكلمات وأمثالها تحذف إن كان قبلها متحرك عند الكتابة العروضية هكذا:\nفنطلَق، فستغفَر، فنطلِق فستغفِر، فنطلاق، فستغفار.\nب-\nالأسماء العشرة المسموعة وهي:\nاسم، ابن، ابنة، امرؤ، امرأة، اثنان، اثنتان، أيمن المختصة بالقسم، است.\nفمثلاً:\nباسمك، وهذا أب وابن، والعام اثنا عشر شهرًا،\nتكتب عروضيًّا هكذا:\nبسمك، وهاذا أبن وبنن، والعام ثنا عشر شهرن.\nج- أمر الفعل الثلاثي الساكن ثاني مضارعه،\nنحو:\nفاسمع واكتب واقرأ،\nفإنها تكتب عروضيًّا هكذا:\nفسمعْ، وكتبْ، وقرأْ.\nد- ألف الوصل من أل المعرفة. فإذا كانت أل قمرية، كما\n\n']"," يحتاج الشاعر إلى علم العروض لعدة أسباب:

1. فهم الأوزان الشعرية: يساعد علم العروض الشاعر على فهم الأوزان الشعرية المختلفة والتمييز بينها. هذا الفهم يمكنه من كتابة قصائد موزونة بشكل صحيح.

2. تجنب الأخطاء الوزنية: يمكن للشاعر من خلال دراسة العروض تجنب الأخطاء الوزنية في شعره، مما يجعل قصيدته أكثر تناسقًا وجمالًا.

3. تطوير مهاراته الشعرية: يساعد علم العروض الشاعر على تطوير مهاراته الشعرية من خلال تعلم كيفية بناء الأبيات الشعرية والتحكم في الإيقاع والنغم.

4. فهم الشعر العربي القديم: يعتبر علم العروض مفتاحًا لفهم الشعر العربي القديم وتراثه الغني. يساعد الشاعر على قراءة وتحليل القصائد القديمة بشكل أعمق وأكثر دقة.

5. التواصل مع الشعراء الآخرين: يمكن للشاعر الذي يمتلك معرفة جيدة بالعروض أن يتواصل بشكل أفضل مع الشعراء الآخرين ويتبادل الأفكار والآراء حول الشعر وأوزانه.

6. الإبداع والتجديد: يمكن للشاعر الملم بالعروض أن يستخدم معرفته لابتكار أوزان شعرية جديدة ومبتكرة تميز أعماله عن غيرها.

في المجمل، يعتبر علم العروض أداة أساسية للشاعر لتطوير مهاراته وفهم الشعر العربي بشكل أعمق وأكثر إبداعًا. ",علم العروض ضروري للشاعر لضبط الأوزان وتجنب الأخطاء وزيادة جمال القصيدة.,1.0,0.53,0.5454545454545454,0.912161744284431
ما هي تفعيلة البحر البسيط؟,"['العنوان: البحر البسيط\nالمحتوى: ... وتفعيلاته هي:\nمستفعلن فاعلن مستفعلن فاعلن ... مستفعلن فاعلن مستفعلن فاعلن\nويدخل هذا البحر من الزحاف ثلاثة أنواع هي:\nأولاً:\nالخبن، وهو حذف الثاني الساكن.\nويدخل هذا الزحاف في فاعلن فتصير فعَلن أي بعد أن كانت التفعيلة مكونة من:\nسبب خفيف ووتد مجموع تصبح فاصلة صغرى، أي ثلاث محركات فساكن.\nويدخل الخبن أيضًا مستفعلن فتحذف السين فتصبح متفعلن، أي بعد أن كانت التفعيلة مكونة من سببين خفيفين ووتد مجموع تصبح مكونة من وتدين مجموعين.\nوبعبارة أخرى تحول رموزها من:\nاهـ اهـ اا هـ إلى اا هـ اا هـ.\n\n', 'العنوان: البحر البسيط\nالمحتوى: ثانيًا:\nالطي، وهو حذف الرابع الساكن. ويدخل هذا الزحاف في مستفعلن كذلك، ولكن في موضع آخر حيث تحذف الفاء فتصبح التفعيلة مستعلن،\nأي تكون سببًا خفيفًا وفاصلة صغرى هكذا:\nاهـ اا اهـ.\nثالثًا:\nالخبل، وهو حذف الثاني الساكن والرابع الساكن من مستفعلن\nفتصبح متعلن، أي تصير فاصلة كبرى، أي أربع متحركات فساكن،\nويصير رمزها هكذا:\nاا اا هـ فالخبل إذن هو الجمع بين الخبن والطي معًا.\nوكل هذه الزحافات تكون في الحشو،\nأما العروض والضرب فلهما في الزحاف الذي يدخل عليهما ويسمى:\nعلة نظام آخر.\nالبسيط التام والمجزوء:\nوبحر البسيط كما يستعمل تامًّا، أي بثماني تفعيلات جريًا على أصله يستعمل كذلك مجزوءًا، أي بحذف تفعيلة من كل شطر، أو بست تفعيلات.\nوسمي مجزوءًا لحذف جزء من كل شطر. ويشارك البسيط في هذه الظاهرة بعض أبحر أخرى نعرفها فيما بعد.\n\n', 'العنوان: البحر البسيط\nالمحتوى: عروض البسيط وضربه:\nوحتى يستعمل البسيط تامًّا أي غير مجزوء لا تبقى عروضه صحيحة، بل تغير من فاعلن إلى فعَلن. وضربه كذلك يكون كثيرًا فعَلن، وأحيانًا أخرى يكون فاعل، أي بحذف آخر الوتد المجموع وتسكين ما قبله.\nوعلى ذلك يصبح وزن البسيط المشهور كالآتي:\nمستفعلن فاعلن مستفعلن فعِلن ... مستفعلن فاعلن مستفعلن فعِلن\nفالعروض مخبونة، أي حذف ثانيها الساكن،\nوالضرب:\nإما مخبون مثلها، وإما مقطوع، وذلك في حالة فاعل.\nوالقطع:\nوهو حذف آخر الوتد المجموع وتسكين ما قبله؛\nأي بعد أن كانت التفعيلة سببًا خفيفًا ووتدًا مجموعًا تصبح سببين خفيفين:\nفيصير الوزن في هذه الحالة كالآتي:\nمستفعلن فاعلن مستفعلن فعِلن\n... مستفعلن فاعلن مستفعلن فاعلْ\n(بسكون اللام)\nمجزوء البسيط:\nمستفعلن فاعلن مستفعلن ... مستفعلن فاعلن مستفعلن\nوعندما يكون البسيط مجزوءًا تكون العروض على نوعين:\nأ-\nمقطوعة:\nأي بحذف آخر الوتد المجموع وتسكين ما قبله،\nفتصبح مستفعلن:\nمستفعل، بثلاثة أسباب خفيفة، وضربها صحيح،\nفيصير الوزن:\n\n', 'العنوان: البحر البسيط\nالمحتوى: مستفعلن فاعلن مستفعلْ ... مستفعلن فاعلن مستفعلن\nب-\nصحيحة:\nأي: مستفعلن،\nوالضرب في هذه الحالة ثلاثة أنواع:\n1 صحيح:\nمستفعلن،\nفيكون الوزن:\nمستفعلن فاعلن مستفعلن ... مستفعلن فاعلن مستفعلن\n2 صحيح مذيل:\nوالتذييل: زيادة حرف ساكن على آخر الوتد المجموع الذي في آخر التفعيلة. وحينئذ تصبح نون مستفعلن ألفًا لسهولة النطق فتصبح بالتذييل مستفعلان.\nفيكون الوزن:\nمستفعلن فاعلن مستفعلن ... مستفعلن فاعلن مستفعلان\n3 مقطوع:\nأي بحذف آخر الوتد المجموع وتسكين ما قبله فتصير مستفعلن: مستفعل،\nفيكون الوزن:\nمستفعلن فاعلن مستفعلن ... مستفعلن فاعلن مستفعلْ\n(بسكون اللام)\nمخلَّع البسيط\nقد يدخل عروض مجزوء البسيط وضربه مستفعلن تغييران:\nأحدهما الخبن، بحذف الثاني الساكن وهو السين، والثاني القطع، بحذف آخر الوتد المجموع مع تسكين ما قبله، فتصبح بذلك مستفعلن متفعلْ\n\n', 'العنوان: البحر البسيط\nالمحتوى: وتنقل إلى فعولن لسهولة النطق.\nوفي هذه الحالة يسمى هذا الوزن باسم معين هو:\nمخلع البسيط،\nويكون وزنه كالآتي:\nمستفعلن فاعلن فعولن ... مستفعلن فاعلن فعولن\nوزحافه في الحشو كزحاف البسيط أو مجزوء البسيط، أي يدخله زحاف الخبن أو الطي أو الخبل الذي هو مجموع الخبن والطي معًا.\nوفيما يلي أمثلة للمشهور استعماله من البسيط:\n1 فوزن النوع الأول من البسيط التام الذي يدخل الخبن على عروضه وضربه فيصير فعِلن هو:\nمستفعلن فاعلن مستفعلن فعِلن ... مستفعلن فاعلن مستفعلن فعِلن\nمثاله:\nفي ليلة الهول والأحداث تلتطم ... والشر يعصف بالوادي ويحتدم\nكنا نخوض إلى الأعداء معتركًا ... نرمي ونرمى به والبأس محتدم\nكنا نباغتهم في حيثما كمنوا ... كنا نشد عليهم كلما هجموا\n2 ووزن النوع الثاني من البسيط التام حيث تكون عروضه مخبونة فعِلن، ويكون ضربه مقطوعًا فاعل، هو\nمستفعلن فاعلن مستفعلن فعِلن ... مستفعلن فاعلن مستفعلن فاعلْ\n\n', 'العنوان: البحر البسيط\nالمحتوى: ومثاله:\nيا أم عمرو جزاك الله مغفرة ... ردي علي فؤادي كالذي كانا\nألست أحسن من يمشي على قدم ... يا أملح الناس كل الناس إنسانًا؟\nومن علامات النوع الأول أن يكون قبل رويه حرف متحرك، ومن علامات النوع الثاني أن يكون قبل رويه حرف مد.\nوقد يدخل التصريع النوع الثاني كقول المتنبي:\nعيد بأية حالٍ عدت يا عيد\n... بما مضى أم بأمر فيك تجديد؟\nأما الأحبة فالبيداء دونهم ... فليت دونك بيدًا دونها بيد\nأصخرة أنا؟ مالي لا تحركني ... هذي المدام ولا هذي الأغاريد؟\nماذا لقيت من الدنيا، وأعجبه ... أنى بما أنا باكٍ منه محسود؟\nفالضرب في جميع الأبيات مقطوع، أما العروض فيما عدا البيت الأول فهي مخبونة. وذلك جار على حسب القواعد السابقة، إلا البيت الأول فقد وردت العروض مقطوعة كالضرب من أجل التصريع.\nمخلع البسيط:\nهو كما تقدم نوع من مجزوء البسيط،\nدخل على عروضه وضربه الذي هو مستفعلن الخبن والقطع فصارت مستفعلن متفعلْ بسكون اللام ثم تحولت إلى فعولن وبذلك صار وزنه:\nمستفعلن فاعل فعولن ... مستفعلن فاعلن فعولن\n\n', 'العنوان: البحر البسيط\nالمحتوى: ومثاله قول الشاعر:\nيا وحة النازح البعيد ... وموئل الحائر الطريد\nالريح تطغى.. فأنقذيني ... من عصفها الجارف العنيد\nوسلسلي الأمن في فؤادي ... وأيقظي الشوق من جديد\nوداعبي الروح بالأماني ... يزدك من رائع النشيد\nوعطري خاطري بذكرى ... لقائنا الأول السعيد\nأهواك أهواك يا حياتي ... للفن والحب والخلود\n\n', 'العنوان: تدريبات على بحر البسيط\nالمحتوى: التدريب الأول:\nالأبيات التالية من بحر البسيط. بين نوع العروض والضرب في كل منها،\nواذكر نوع الزحاف في كل بيت إن وجد:\n1 سبحان خالق نفسي كيف لذتها ... فيما النفوس تراه غاية الألم\n2 حسن الحضارة مجلوب بتطرية ... وفي البداوة حسن غير مجلوب\n3 إني لمن معشر ما ضيم جارهم ... ولا رأى عندهم بؤسًا ولا خافا\n4 وما أخوك الذي يدنو به نسب ... لكن أخوك الذي تصفو ضمائره\nالتدريب الثاني:\nالأبيات التالية من مجزوء البسيط ومخلَّع البسيط. اذكر العروض والضرب في كل منها،\nوكذلك نوع الزحاف إن وجد:\n1 قد طال يا قلب ما تلاقى ... إن مات ذو صبوة فكنه\n\n', 'العنوان: تدريبات على بحر البسيط\nالمحتوى: 2 ماذا وقوفي على ربع عفا ... مخلولق دارس مستعجم؟\n3 يا صاح قد أخلفت أسماء ما ... كانت تمنيك من حسن الوصال\n4 سيروا معًا إنما ميعادكم ... يوم الثلاثاء ببطن الوادي\nالتدريب الثالث:\nعين بحر كل بيت من الأبيات التالية،\nوبين ما فيها من زحاف:\n1 لا أتاح الله لي فرجًا ... يوم أدعو منك بالفرج\n2 أضحي التنائي بديلاً من تدانينا ... وناب عن طول لقيانا تجافينا\n3 وقيدت نفسي في ذراك محبة ... ومن وجد الإحسان قيدًا تقيدا\nالتدريب الرابع:\nاكتب الأبيات التالية كتابة عروضية، ثم قطعها على حسب التفاعيل،\nوضع رموزها تحتها:\n1 كل من حانت منيته ... لم يدافع دونه حرسه\n2 تقدمتني أناس كان شوطهم ... وراء خطوي لو أمشي على مهل\n3 وإني في بيت صغير مهدم ... كأني في قصر كبير مشيد\n\n']"," تفعيلة البحر البسيط تتكون من تفعيلتين رئيسيتين:

1. مستفعلن: تتكون من سبب خفيف (مس) ووتد مجموع (تفعلن)، وتكتب هكذا: مستفعلن.
2. فاعلن: تتكون من سبب خفيف (فا) ووتد مجموع (علن)، وتكتب هكذا: فاعلن.

في حالة البحر البسيط التام، تتكرر هذه التفعيلتين أربع مرات في كل شطر (مستفعلن فاعلن مستفعلن فاعلن)، بينما في حالة البحر البسيط المجزوء، تتكرر هذه التفعيلتين ثلاث مرات في كل شطر (مستفعلن فاعلن مستفعلن).

يجب أن نلاحظ أن البحر البسيط قد يتعرض للزحافات والعلل التي تؤثر على تفعيلاته، مثل الخبن والطي والخبل والقطع والتذييل وغيرها. هذه الزحافات والعلل تغير من شكل التفعيلات وتؤثر على الوزن الشعري. ",تفعيلة البحر البسيط هي 'مستفعلن فاعلن'.,1.0,0.43,,0.9009670769710318
ما هي تفعيلة البحر المديد؟,"['العنوان: البحر المديد\nالمحتوى: ... وتفعيلاته هي:\nفاعلاتن فاعلن فاعلاتن ... فاعلاتن فاعلن فاعلاتن\nوهذا البحر من البحور القليلة الاستعمال، ولكن أنواعه تتفاوت في ذلك، وأكثرها نسبيًّا ما كانت عروضه وكان ضربه على فعِلن بتحريك العين، أي محذوفة مخبونة.\nأعاريض المديد وأضربه:\nأولاً:\nالعروض صحيحة: فاعلاتن،\nوضربها صحيح كذلك:\nفاعلاتن.\nمثل:\nيا طويل الهجر لا تنس وصلي ... واشتغالي بك عن كل شغلي\nيا طويلل هجر لا تنسو صلي ... وشتغالي بك عن كللشغلي\nفاعلاتن فاعلن فاعلاتن ... فاعلاتن فعلن فاعلاتن\nثانيًا:\nالعروض محذوفة والضرب مقصور.\n\n', 'العنوان: البحر المديد\nالمحتوى: العروض محذوفة فاعلن، وأصلها فاعلاتن حذف من آخرها السبب الخفيف، فأصبحت فاعلا، ثم حولت إلى فاعلن تسهيلًا للنطق. وفي اصطلاح العروضيين تسمى هذه العلة بالحذف. فالعروض محذوفة.\nأما الضرب مع هذه العروض فهو فاعلاتْ بتسكين التاء،\nأي:\nبحذف سابع التفعيلة وتسكين ما قبله،\nوتسمى هذه العلة:\nالقصر،\nوالتفعيلة تسمى:\nمقصورة. إذن فعروض هذا النوع من المديد محذوفة،\nوالضرب مقصور مثال ذلك قول الشاعر:\nلا يغرن امرأ عيشُه ... كل عيشٍ صائر للزوال\nلا يغررن نمرَ أن عيشهو ... كللعيشن صائرن لززوالْ.\nفاعلاتن فاعلن فاعلن ... فاعلاتن فاعلن فاعلاتْ\n(بسكون التاء)\nفي هذا النوع قد يرد البيت الأول بعروض على وزن فاعلات مثل الضرب، ثم تأتي بقية الأبيات بعروض محذوفة، وهذا هو التصريع كما تقدم في الطويل،\nومثاله:\nيا وميض البرق بين الغمام ... لا عليها بل عليك السلام\nإن في الأحداج1 مقصورة 2 ... وجهها يهتك ستر الظلام\n\n', 'العنوان: البحر المديد\nالمحتوى: ثالثًا:\nالعروض محذوفة مخبونة، والضرب كذلك محذوف مخبون.\nالعروض فعِلن أي:\nفاصلة صغرى، وأصلها فاعلاتن دخل عليها زحاف الحذف فأصبحت فاعلا، ثم حذفت الألف الثانية، أي حذف الثاني الساكن وهذا هو زحاف الخبن فصارت فعلا، ثم حولت إلى فعلن تسهيلاً للنطق، فالعروض بعد ذلك كله صارت محذوفة مخبونة.\nوالضرب كذلك فعلن ومثاله قول الشاعر:\nغير مأسوف على زمنٍ ... ينقضي بالهم والحزنِ\nغير مأسو فن على زمنن ... ينقضي بل هممول حزني\nفاعلاتن فاعلن فعِلن ... فاعلاتن فاعلن فعِلن\nوهذا النوع هو أكثر أنواع المديد شيوعًا بالنسبة لباقي الأنواع.\nزحافات هذا البحر\nالزحاف الذي يدخل هذا البحر نوعان:\nأحدهما كثير شائع والثاني قليل نادر.\nالأول:\nالخبن،\nأي:\nحذف الثاني الساكن من التفعيلة في الحشو،\nوالحشو في المديد عبارة عن تفعيلتين فقط هما:\nفاعلاتن فاعلن.\nفتصبح كل واحدة بعد الخبن:\nفعلاتن فعِلن.\n\n', 'العنوان: البحر المديد\nالمحتوى: فبعض الأبيات تخبن فيه التفعيلة الأولى وبعضها تخبن فيه التفعيلة الثانية.\nويجوز أن يكون ذلك في الشطر الأول أو الثاني من البيت أو في كليهما، ويندر أن تخبن التفعيلتان في شطر واحد، وأندر منه في التفعيلات الأربع أي أن يدخل زحاف الخبن في جميع الحشو.\nالثاني:\nالمعاقبة،\nوذلك أنه يجوز أن تحذف بقلة:\n(ن)\nفاعلاتن أي: السابع الساكن،\nويسمى هذا:\nالكف ولكن بشرط ألا تخبن فاعلاتن بل تسلم، كما يجوز خبن فاعلن مع عدم كف فاعلاتن.\nوهاك أمثلة من بعض القصائد التي وردت من النوع الثاني:\nفعِلن،\nوالذي هو أكثر أنواع المديد شيوعًا واستعمالاً:\nقال حافظ إبراهيم:\nحال بين الجفن والوسن ... حائل لو شئت لم يكن\nأنا والأيام تقذف بي ... بين مشتاق ومفتتن\nلي فؤاد فيك تنكره ... أضلعي من شدة الوهن\nوزفير لو علمتَ به ... خلتَ نار الفرس في بدني\nيالقومي ... إنني رجل ... حرت في أمري وفي زمني\nوقال شاعر مصري معاصر:\nيا فؤادًا جف أخضُرُه ... واحتواه الشيبُ والهرمُ\nلهفي.. كم أنت في حزَن ... من هوى يطغي ويزدحم\nغائم كالليل معتكرًا ... هائج كالبحر يلتطم\nفتزود للهودى أسفًا ... وانس يا مسكين حبهم\nهو حب.. لو إلى صنم ... كان لبَّي حبَّنَا الصنمُ\n\n', 'العنوان: البحر المديد\nالمحتوى: وقال شاعر آخر:\nمن محبٍ شَفَّهُ سَقَمُهْ ... وتلاشى لحمُه ودمُهْ\nكاتب حنت صحيفته ... وبكى من رحمةٍ قلمُهْ\nيرفع الشكوى إلى قمر ... ينجلي عن وجهه ظَلَمُهْ\nمن لِقَرْنِ الشمس جبهته ... وللمع البرق مبتسمُهْ\nخلِّ عَقْلِي يا مُسَفِّهَهُ ... إن عقلي لستُ أتهمُهْ\nللفتى عقل يعيش به ... حيث تهدي ساقَهُ قدمُهْ 1\nويمكن أن نرمز إلى أنواع العروض والضرب المشهورة في المديد بما يلي:\nأ= فاعلاتن، ب = فاعلن، جـ = فاعلاتْ، د= فعِلن\nفتكون أنواع المديد المشهورة هي:\n1:\n-- أ -- أ\n2:\n-- ب -- جـ\n3:\n-- د -- د\nولكن يستثنى من ذلك التصريع حيث تكون عروض أول بيت مثل الضرب.\n\n', 'العنوان: تدريبات على بحر المديد\nالمحتوى: التدريب الأول:\nالأبيات التالية من بحر المديد. بين نوع العروض والضرب في كل بيت منها،\nوإن كان فيها زحاف فاذكر نوعه:\n1 إنما ذكرك ما قد مضى ... ضلةٌ مثل حديث المنامْ\n2 إن جرى قتلٌ على يده ... فهو في حلٍ وفي سَعَةِ\n3 اعلموا أني لكم حافظ ... شاهدًا ما عشت أو غائبا\n4 يا لبكر أنشروا لي كليبًا ... يا لبكر أين أين الفرار\nالتدريب الثاني:\nاكتب الأبيات التالية كتابة عروضية، ثم قطعها على حسب تفاعيل المديد،\nوضع رموز المتحرك والساكن تحت التفاعيل:\n1 صار جدًّا ما فرحتُ به ... ربًّ جَدٍّ جرَّه اللعبُ\n2 تحسب الهجر حلالاً لها ... وترى الوصل عليه حرام\n3 إنما الذلفاء ياقوتةٌ ... أُخرجت من كيس دِهْقَانِ1\n\n', 'العنوان: تدريبات على بحر المديد\nالمحتوى: التدريب الثالث:\nعين بحر كل بيت من الأبيات التالية:\n1 وما الخيل إلا كالصديق قليلة ... وإن كثرت في عين من لا يجرِّب\n2 من يحب العز يدأب إليه ... وكذا من طلب الدُّرّ غاصا\n3 أعز مكان في الدُّنَى سرج سابح ... وخير جليس في الزمان كتاب\n4 أدلال ذاك أم كَسَل ... أم تناسٍ منك أم ملل؟\n5 إنما الدنيا بلاء ... وكدٌّ ... واكتئاب قد يسوق اكتئابا\n6 يقولون لي:\nما أنت في كل بلدة؟ ... وما تبتغي ما أبتغي جل أن يسمى\n\n']"," تفعيلة البحر المديد تتكون من تفعيلتين رئيسيتين في كل شطر من البيت الشعري:

1. التفعيلة الأولى: فاعلاتن (فا علاتن)
2. التفعيلة الثانية: فاعلن (فا علن)

في بعض الأحيان، قد تتغير هذه التفعيلات بسبب الزحافات والعلل الشعرية. الزحافات هي تغييرات تحدث في التفعيلات دون أن تؤثر على الوزن الشعري، بينما العلل هي تغييرات تؤثر على الوزن الشعري.

من الزحافات الشائعة في البحر المديد:
- الخبن: حذف الثاني الساكن من التفعيلة (فا علاتن تصبح فعلاتن، فا علن تصبح فعلن)
- الكف: حذف السابع الساكن من التفعيلة (فا علاتن تصبح فاعلات، فا علن تصبح فاعلن)

من العلل الشائعة في البحر المديد:
- الحذف: حذف السبب الخفيف من التفعيلة (فاعلاتن تصبح فاعلن)
- القصر: حذف ساكن السبب الخفيف وتسكين متحركه (فاعلاتن تصبح فاعلاتْ)

يرجى ملاحظة أن هذه المعلومات عامة وقد تختلف تفاصيل الزحافات والعلل بناءً على الأبيات الشعرية المحددة والقصائد. ",تفعيلة البحر المديد هي 'فاعلاتن فاعلن'.,1.0,0.43,0.2857142857142857,0.8783601254256668
ما هي تفعيلة البحر الخفيف؟,"['العنوان: أوزان البحور\nالمحتوى: ... 1 مقدمة.\n2 البحر الأول:\nبحر الطويل.\nمقدمة:\nأشرنا سابقًا إلى أن الخليل بن أحمد وضع خمسة عشر بحرًا وأن تلميذه الأخفش زاد عليها بحرًا سماه:\nالمتدارك، وبذلك أصبح مجموع البحور ستة عشر بحرًا.\nوبعد هذه البحور كما ذكرنا من قبل تشترك تفعيلاتها في عدد المقاطع بحيث إذا قدمنا مقطعًا متأخرًا أو أخرنا مقطعًا متقدمًا تولد عن ذلك البحر المماثل.\nفالتفعيلة فعولن مثلاً مكونة من وتد مجموع فسبب خفيف، فإذا تكررت ثماني مرات فإنه ينتج عنها بحر المتقارب، أما إذا قدمنا السبب الخفيف على الوتد المجموع في التفعيلة ذاتها فإن فعولن تصبح فاعلن، وهذه إذا تكررت كذلك ثماني مرات فإنه يتولد عنها بحر المتدارك.\n\n', 'العنوان: أوزان البحور\nالمحتوى: وكذلك متفاعلن إذا عكست تصير مفاعلتن وتكوِّن بتكرارها مع تفعيلة من نوع آخر بحرًا يسمى:\nالوافر،\nبينما تكرار متفاعلن ست مرات يولد بحرًا آخر هو:\nالكامل، وهكذا.\nوقد رتب العروضيون بحور الشعر الستة عشر على حسب اشتراك كل مجموعة منها في دائرة عروضية واحدة على الوجه التالي:\n1 الطويل، والمديد، والبسيط.\n2 الوافر، والكامل.\n3 الهزج، والرجز، والرمل.\n4 السريع والمنسرح، والخفيف، والمضارع، والمقتضب، والمجتث.\n5 المتقارب، والمتدارك.\nوهذا الترتيب كما ذكرت هو بحسب اشتراك كل مجموعة من البحور في دائرة عروضية لا بحسب كثرة استعمالها أو قلة استعمالها، وسوف نفصل الكلام عن الدوائر العروضية فيما بعد.\nأجزاء البيت:\nينقسم البيت الشعري إلى قسمين متساويين من حيث النغم والقياس الموسيقي، ويعرف كل قسم بالمصراع تشبيهًا بمصراعي الباب، أو بالشطر،\nفيقال:\nالشطر الأول أو الثاني،\nكما يقال:\nالمصراع الأول أو الثاني من البيت.\nالتفعيلة الأخيرة.\nولما كان للتفعيلة الأخيرة من كل شطر أهمية خاصة فقد انفردت بتسمية خاصة.\n\n', 'العنوان: أوزان البحور\nالمحتوى: فالتفعيلة التي في آخر الشطر من البيت تسمى:\nالعروض -بفتح العين-\nوالتفعيلة التي في آخر الشطر الثاني تسمى:\nالضرب،\nوما عدا ذلك من تفاعيل البيت يسمى:\nالحشو،\nهكذا:\nفعولن مفاعيلن فعولن مفاعلن\nحشو عروض\nفعولن مفاعيلن فعولن مفاعلن\nحشو ضرب\nوكل بحر من بحور الشعر له نظام خاص في التغييرات التي تدخل على الحشو أو على العروض أو على الضرب. وسنوضح ذلك عند الكلام على وزن كل بحر.\n\n', 'العنوان: البحر الخفيف\nالمحتوى: ... ووزن الخفيف هو:\nفاعلاتن مستفع لن فاعلاتن ... فاعلاتن مستفع لن فاعلاتن\nزحاف الخفيف:\nيدخل الخفيف من الزحاف الخبن والتشعيث، وقد يدخله الكف.\n1 الخبن:\nوالخبن، الذي هو حذف الثاني الساكن،\nيدخل في تفعيلتين:\nهما: فاعلاتن، ومستفع لن. فبسبب الخبن تصبح فاعلاتن فعلاتن بفاصلة صغرى وسبب خفيف، وذلك الزحاف جائز في التفعيلة سواء أكانت حشوا أم عروضًا أم ضربًا.\nوكذلك يدخل زحاف الخبن على مستفع لن فتصبح بعد حذف السين متفع لن بوتدين مجموعين.\n2 التشعيث:\nوهو حذف العين من فاعلاتن أي: حذف أول الوتد المجموع فيها فتصبح فالاتن أي: بثلاثة أسباب خفيفة، وذلك الزحاف يحدث في\n\n', 'العنوان: البحر الخفيف\nالمحتوى: تفعيلة الضرب، ويقل في غيرها من فاعلاتن التي تأتي في ثنايا البيت، أي في حشوه وعروضه.\n3 الكف:\nوقد يدخل الكف، وهو حذف السابع الساكن من فاعلاتن، فتصير فاعلاتُ بتاء متحركة. ولكن العروضيين يعتبرون دخول هذا الزحاف في الخفيف أمرًا قبيحًا شاذًّا، ولذلك يحسن بالشعراء أن ينأوا عنه كلما كان ذلك ممكنًا.\nوتجدر الإشارة إلى أن الطي وهو حذف الرابع الساكن لا يدخل على مستفع لن في هذا البحر. ومعنى ذلك أنه يمتنع حذف الفاء من مستفع لن.\nالخفيف التام والمجزوء:\nيستعمل الخفيف تامًا ومجزوءًا، ولكل منهما أعاريض وأضرب خاصة به.\nأعاريض الخفيف التام وأضربه:\nصحيحة فاعلاتن\n(1)\nصحيح: فاعلاتن، ويجوز فيه التشعيث\nمع جواز خبنها\n(2)\nمحذوف: فاعلن، ويجوز فيه الخبن.\nالنوع الأول:\nالعروض صحيحه والضرب صحيح كذلك، مثاله\nقول الشاعر:\nأنت يا قاصيا أظل أناجيه ... وأسعى إليه بين الصخور\nائت يا مشرقًا تحجب بالغيـ ... ـب بيدًا ... هناك خلف الدهور\nأنت يا عالمًا تحن له الأر ... واح من مطلع الحياة المنير\nأنت يا من إليه أزجي أناشـ ... ـيد حنيني في وقفتي وعبوري\n\n', 'العنوان: البحر الخفيف\nالمحتوى: أنت يا من إذا رآني أعدو ... خلفه غاب في ضباب العصور\nأنت من أنت؟ إنني لست أدري ... كنه هذا المقنع المنظور!\nتقطيع البيت الخامس:\nأنت يا من إذا رأا نيأعدو ... خلفهوغا بفي ضبا بلعصوري\nاه ااه اه ااه ااه اااه اه ... اه ااه اه ااه ااه اه ااه اه\nفاعلاتن متفع لن فعلاتن ... فاعلاتن متفع لن فاعلاتن\nفالتفعيلة الثانية والخامسة متفع لن قد دخلها الخبن فحذفت منها السين، والتفعيلة الثالثة فاعلاتن دخلها الخبن كذلك فحذفت ألفها، ومن ذلك نرى أن العروض في هذا البيت قد شاركت الحشو في جواز دخول زحاف الخبن على كل منهما.\nوإذا قطعنا البيت الأخير هنا فإننا نرى أن التشعيث وهو حذف العين من فاعلاتن قد دخل في ضربه هكذا.\nأنت من أن ت إننني لست أدري ... كنهها ذل مقننعل منظوري\nاه ااه اه ااه ااه اه ااه اه ... اه ااه اه ااه ااه اه اه اه\nفاعلاتن متفع لن فاعلاتن ... فاعلاتن متفع لن فالاتن\nفالضرب هنا بعد دخول التشعيث عليه قد صار فالاتن.\nالنوع الثاني:\nالعروض صحيحة فاعلاتن والضرب محذوف فاعلن وأكثر ما يكون هذا الضرب مخبون،\nأي:\nفعلن ومثاله:\nرزق المجد والنجاح دوامًا ... من يقضي الحياة في عمل\nليس من عاش ساعيا في اجتهاد ... كالذي عاش دائم الكسل\n\n', 'العنوان: البحر الخفيف\nالمحتوى: أما الضرب المحذوف من غير خبن،\nأي:\nفاعلن فنادر الاستعمال في الشعر،\nومثاله:\nخل عنك الأسى وعش مطئنا ... في ظلال المنى ودفء الهوى\nوانس ما كان يوم كنت غريرًا ... تجهل الحب ناره والجوى\nمجزوء الخفيف:\nيأتي مجزوء الخفيف على أربع تفعيلات،\nكل اثنتين في شطر هكذا:\nفاعلاتن مستفع لن ... فاعلاتن مستفع لن\nزحاف مجزوء الخفيف:\nويدخل في مجزوء هذا البحر:\n1 الخبن:\nفي فاعلاتن فتصير فعلاتن، وفي مستفع لن فتصير متفع لن.\n2 القصر:\nوهو حذف ساكن السبب الخفيف وتسكين ما قبله. ويدخل في الضرب فقط فتصير مستفع لن مستفع لْ بسكون اللام.\nعروض مجزوء الخفيف وضربه:\n1 العروض صحيحة والضرب صحيح مستفع لن وذلك قليل الورود.\n2 العروض صحيحة والضرب مخبون مقصور متفع لْ بسكون اللام، وذلك نادر.\n3 العروض مخبونة والضرب مخبون كذلك متفع لن وذلك هو الغالب في هذا المجزوء.\nويمكن تلخيص أعاريض هذا المجزوء وأضربه على الوجه التالي:\n\n', 'العنوان: البحر الخفيف\nالمحتوى: العروض الضرب\n1 صحيحة:\n1 صحيح مستفع لن قليل الورود.\nمستفع لن 2 مخبون مقصور متفع لْ بسكون اللام، نادر.\n2 مخبونة:\nمتفع لن 3 مخبون متفع لن، وذلك هو الغالب في هذا المجزوء.\nالنوع الأول:\nالعروض صحيحة والضرب صحيح،\nوهو قليل الورود ومثاله:\nليت شعري أين التي ... من هواهالم أسلم؟\nكيف غابت عن خاطري ... ليتها ظلت.. ملهمي\nالنوع الثاني:\nالعروض صحيحة والضرب مخبون مقصور متفع لْ وهذا النوع نادر في الشعر.\nومثاله:\nكل خطب إن لم تكو ... نوا غضبتم يسير\nالنوع الثالث:\nالعروض مخبونة والضرب مخبون كذلك متفع لن وهو الغالب،\nومثاله قول الشاعر جميل صدقي الزهاوي:\nلا تسل عن دموعنا ... يوم جاءت تودع\nيوم أشكو الجوى فتصـ ... ـغى وتشكو فأسمع\nحدثتني عن الفرا ... ق وما فيه من أذى\nحبذا ذلك الحديـ ... ـث لو امتد حبذا\n\n']"," تفعيلة البحر الخفيف تتكون من تفعيلتين أساسيتين:

1. التفعيلة الأولى: فاعلاتن (فَاعِلاَتُنْ)
2. التفعيلة الثانية: مستفع لن (مُسْتَفْعِلُنْ)

تتكرر هذه التفعيلتين في كل شطر من البيت الشعري، حيث يتكون البيت من شطرين متساويين.

تفعيلة فاعلاتن تتكون من سبب خفيف (عَلاَتُنْ) ووتد مجموع (فَا)، بينما تتكون تفعيلة مستفع لن من سبب خفيف (مُسْتَفْ) ووتد مجموع (عِلُنْ).

يمكن توضيح ذلك بالمثال التالي:

مثال على البحر الخفيف:

أنت يا من إذا رآني أعدو ... خلفهوغا بفي ضبا بلعصوري
اه ااه اه ااه ااه اه ااه اه ... اه ااه اه ااه ااه اه ااه اه
فاعلاتن متفع لن فعلاتن ... فاعلاتن متفع لن فاعلاتن

في هذا المثال، تتكون التفعيلة الأولى (فاعلاتن) من سبب خفيف (عَلاَتُنْ) ووتد مجموع (فَا)، بينما تتكون التفعيلة الثانية (مستفع لن) من سبب خفيف (مُسْتَفْ) ووتد مجموع (عِلُنْ). ",تفعيلة البحر الخفيف هي 'فاعلاتن مستفعلن'.,,0.46,,0.8946363716717322
ما هي تفعيلة البحر السريع؟,"['العنوان: البحر السريع\nالمحتوى: ... ووزنه في الأصل:\nمستفعلن مستفعلن مفعولات ... مستفعلن مستفعلن مفعولات\nوعروض هذا البحر مفعولات لا تبقى صحيحة، وإنما يدخلها نوعان من الزحاف هما الطي والكسف.\n1 الطي:\nوهو حذف الرابع الساكن وهو هنا الواو، فتصير مفعولات بعد الطي مفعلات.\n2 والكسف:\nوهو حذف السابع المتحرك وهو هنا التاء، فتصير مفعلات بعد الكسف مفعلا،\nوتنقل إلى فاعلن وبذلك يصير وزن هذا البحر:\nمستفعلن مستفعلن فاعلن ... مستفعلن مستفعلن فاعلن.\nوهذا البحر يستعمل تامًّا ومشطورًا:\nولا يستعمل مجزوءًا؛ لأن الرجز\n\n', 'العنوان: البحر السريع\nالمحتوى: يشاركه في الحشو، فعندما يكون البيت على أربع تفعيلات كلها مستفعلن يكون من مجزوء الرجز. أما المشطور، وهو ما بقي البيت منه على ثلاث تفعيلات فقط، فقد جاز في هذا البحر لأنه لا يمكن أن يختلط بمشطور الرجز أو مجزوئه.\nزحاف السريع:\nيدخل هذا البحر من الزحاف ما يدخل حشو الرجز أي يدخله الخبن والطي والخبل.\n1 فالخبن:\nحذف الثاني الساكن، وعلى هذا تصير مستفعلن متفعلن.\n2 والطي:\nحذف الرابع الساكن، وعلى هذا تصير مستفعلن مستعلن.\n3 والخبل:\nحذف الثاني الساكن والرابع الساكن معًا، وعلى هذا تصير مستفعلن متعلن.\nعروض السريع التام وضربه:\nللسريع التام عروضان:\nالأولى:\nمطوية مكسوفة: فاعلن،\nولها ثلاثة أضرب:\n(1)\nمطوي مكسوف: فاعلن.\n(2)\nأصلم 1 مفعو أو فعْلن بسكون العين.\n(3)\nمطوي موقوف2 مفعلاتْ بسكون التاء.\nالثانية:\nفعَلن، بفتح العين فهي مخبولة مكسوفة. وأصلها مفعولات فدخلها الخبل وهو حذف الثاني الساكن والرابع الساكن معًا فصارت معلات، ثم دخلها الكسف،\nوهو حذف السابع المتحرك وهو التاء هنا فصارت معلا أي:\nفاصلة صغرى ثم نقلت إلى فعَلن بفتح العين؛ ولذلك فالعروض في هذه الحالة مخبولة مكسوفة.\nوضرب هذه العروض نوعان:\n1 مخبول مكسوف كذلك،\nأي:\nفعلن\n2 أصلم أي:\nفعْلن بسكون العين.\nويمكن تلخيص أعاريض السريع وأضربه على الوجه التالي:\n\n', 'العنوان: البحر السريع\nالمحتوى: العروض الضرب\n1 مطوية مكسوفة:\nفاعلن\n(1)\nمطوي مكسوف: فاعلن\n(2)\nأصلم مفعو أو فعْلن بسكون العين\n(3)\nمطوي موقوف: مفعلات بسكون التاء، وتنقل إلى فاعلات\n2 مخبولة مكسوفة:\nفعَلن بفتح العين\n(1)\nمخبول مكسوف: فعَلن بفتح العين كذلك.\n(2)\nأصلم: مفعو أو فعْلن\nالنوع الأول:\nالعروض فاعلن والضرب فاعلن كذلك،\nمثاله قول الشاعر:\nمقالة السوء إلى أهلها ... أسرع من منحدر السائل\nومن دعا الناس إلى ذمه ... ذموه بالحق وبالباطل\nوكقول الشاعر:\nيا ليت لي دهر من غاية ... أسعى إليها فيك مستبسلاً\nتخطو بي الأيام في قفرة ... جرداء لا ألقى بها منزلا\nالنوع الثاني:\nالعروض فاعلن والضرب فعْلن بسكون العين.\nومثاله قول الشاعر:\nفي الناس من لا يرتجى نفعه ... إلا إذا مس بأضرار\nكالعود لا يطمع في ريحه ... إلا إذا أحرق بالنار\nالنوع الثالث:\nالعروض فاعلن والضرب، مفعلات أو فاعلات\nبسكون التاء.\nومثاله قول الشاعر:\nيا زورق النور.. إلى جنتي ... طر بي على الأمواج طير العقاب\nوأطلق البشرى.. عسى أن أرى ... أسوارها من خلف هذا الضباب\n\n', 'العنوان: البحر السريع\nالمحتوى: قد شفني الشوق لوكر المنى ... وما به من كل مرأى عجاب\nيا فرحتي بالنور ... يا فرحتي ... ويا نعيم القلب بعد العذاب\nالنوع الرابع:\nالعروض فعَلن بفتح العين والضرب كذلك فعَلن بفتح العين.\nومثاله قول الشاعر:\nحتام تقضي العمر منتقلاً ... في الأرض لا تأوي إلى وطن\nالأهل.. كل الأهل ما برحوا ... من طول يوم البين في حزن\nعد يا غريب الدار إن بها ... شوقًا لمرأى وجهك الحسن\nالنوع الخامس:\nالعروض فعَلن بفتح العين والضرب فعْلن بسكون العين مثاله:\nيا أيها الزاري على عمرٍ ... قد قلت فيه غير ما تعلمْ\nوتجدر الإشارة إلى أن السريع أكثر ما يستعمل يكون تامًّا، وقلما يستعمل مشطورًا.\nوي حالة استعماله مشطورًا يأتي على ضربين:\nتام موقوف: مفعولات،\nومكسوف:\nمفعولا.\nمثال الضرب الأول التام الموقوف مفعولات:\nخليت قلبي في يدي ذات الخال ... مصفدًا مقيدًا في الأغلال\nومثال الضرب الثاني المكسوف مفعولا:\nويحيى قتيلاً ما له من عقل ... بشادن يهتز مثل النصل\n\n']"," تفعيلة البحر السريع تتكون من جزئين: الحشو والعروض والضرب. الحشو يتكون من تكرار تفعيلة ""مستفعلن"" مرتين في كل شطر، بينما تتكون العروض والضرب من تكرار تفعيلة ""فاعلن"" مرة واحدة في كل شطر.

في حالة البحر السريع التام، يكون الحشو مكونًا من ""مستفعلن مستفعلن"" والعروض والضرب مكونين من ""فاعلن"". أما في حالة البحر السريع المشطور، فيكون الحشو مكونًا من ""مستفعلن مستفعلن"" والعروض والضرب مكونين من ""فاعلن"" أو ""فعْلن"" بسكون العين.

يمكن توضيح تفعيلة البحر السريع على النحو التالي:

مستفعلن مستفعلن فاعلن
مستفعلن مستفعلن فاعلن

أو

مستفعلن مستفعلن فاعلن
مستفعلن مستفعلن فعْلن

في حالة البحر السريع المشطور:

مستفعلن مستفعلن فاعلن
مستفعلن مستفعلن فعْلن

أو

مستفعلن مستفعلن فاعلن
مستفعلن مستفعلن فعْلن

يرجى ملاحظة أن الزحافات والعلل قد تدخل على تفعيلات البحر السريع، مما يؤدي إلى تغييرات في التفعيلات الأصلية. ",تفعيلة البحر السريع هي 'مستفعلن مستفعلن'.,1.0,0.46,,0.9117602707535983
ما هي تفعيلة البحر المنسرح؟,"['العنوان: البحر المنسرح\nالمحتوى: وزنه في الأصل:\nمستفعلن مفعولات مستفعلن ... مستفعلن مفعولات مستفعلن.\nوالتفعيلة الوسطى في كل شطر مفعولاتُ محركة الآخر.\nويلاحظ على كل التفاعيل العروضية أنها ساكنة الأواخر إلا إذا دخلها زحاف.. ويستثنى من ذلك تفعيلة المنسرح هذه فإنها محركة الآخر بدون زحاف.\nزحاف المنسرح:\nيدخل حشو المنسرح زحاف الخبن في مستفعلن فتصير متفعلن، أو زحاف الطي فتصير مستعلن، أو الخبن والطي معًا فتصير متعلن.\nويدخل زحاف الطي في مفعولات فتصير مفعلات والأحسن في هذه التفعيلة أن تستعمل مطوية مفعلات أي بوتدين مفروقين. وقد يدخلها الخبن بالإضافة إلى الطي فتصير معلات، وتنقل إلى فعلات.\nوقد تأتي تامة بدون زحاف مفعولات.\n\n', 'العنوان: البحر المنسرح\nالمحتوى: عروض المنسرح وضربه:\nعروض المنسرح وضربه مستفعلن لا يستعملان صحيحين بل يدخلهما الطي، أي حذف الرابع الساكن،\nوبذلك تصبح تفعيلة العروض والضرب بوزن مستعلن وبذلك يصير وزن المنسرح هكذا:\nمستفعلن مفعولات مستعلن ... مستفعلن مفعولات مستعلن\nويتضح من ذلك أن للمنسرح عروضًا واحدة مطوية أي:\nمستعلن ولهذه العروض ضربان: أحدهما مطوي كذلك كما أوضحنا آنفًا،\nوالثاني ضرب مقطوع مستفعل أي:\nبحذف السابع وتسكين ما قبله، وهذا الضرب قليل الاستعمال.\nويمكن تلخيص عروض المنسرح وأضربه على الوجه التالي:\nالعروض الضرب\nعروض مطوية\n(1)\nمطوي كذلك مستعلن\nمستعلن\n(2)\nمقطوع مستفعلْ بتسكين اللام.\nالنوع الأول:\nالعروض مطوية والضرب مطوي كذلك مستعلن من ذلك قول الشاعر:\nيا رئم هات الدواة والقلما ... أكتب شوقي إلى الذي ظلما\nمن صار لا يعرف الوصال وقد ... زاد فؤادي في حبه ألما\nغضبان قد ضرني هواه ولو ... يسأل مما غضبت؟ ما علما\nأظل يقظان في تذكره ... ... حتى إذا نمت كان لي حلما\n\n', 'العنوان: البحر المنسرح\nالمحتوى: تقطع البيت الأول:\nيا رئم ها تد دواة ولقلما ... أكتبشو قي إللل ذي ظلما\nاه اااه اه ااه ااه اااه ... اه اه ااه اه ااه ااه اااه\nمستفعلن مفعلات مستعلن ... مستعلن مفعلات مستعلن\nومن ذلك نرى أن مفعولات في الحشو مطوية في الشطرين، وهذا هو الكثير في هذه التفعيلة. ومن غير الكثير ورودها صحيحة مفعولات بدون طي،\nكما في الشطر الثاني من البيت الثاني وهو:\nزاد فؤادي في حبه ألما\nوتقطيعه\nزاد فؤا دي في حببـ هي ألما\nاه اااه اه اه اه ااه اا اهـ\nمستعلن مفعولات مستعلن\nالنوع الثاني:\nالعروض مطوية مستعلن، والضرب مقطوع مستفعل بسكون اللام.\nومثاله قول الشاعر:\nيا قوم هل للبلاد من رجل ... يعيد كالأمس مجدَ أهليها؟\nتقطيع هذا البيت:\nيا قومهل للبلاد من رجلن\nاه اه ااه اه ااه ااه اااه\nمستفعلن مفعلات مستعلن\nيعيد كل أمس مجد أهليها\nااه ااه اه ااه ااه اه اه\nمتفعلن مفعلات مستفعل\nويستعمل المنسرح تامًا ومنهوكًا. أما التام فقد مر الكلام عن وزنه وزحافاته وعروضه وضربيه مع التمثيل لكل نوع.\n\n', 'العنوان: البحر المنسرح\nالمحتوى: أما منهوك المنسرح فهو ما جاء على تفعيلتين فقط في كل بيت،\nأي:\nمستفعلن مفعولات.\nوتستعمل مفعولات بطريقين:\n1 الوقف:\nوهو تسكين السابع المتحرك فتكون التفعيلة موقوفة،\nمثل:\nيا موطنًا للأحرار ... يا معقلاً للثوار\nيا قبلة للأنظار ... عش للعلى باستمرار\n2 الكسف:\nوذلك بحذف السابع المتحرك،\nأي:\nالتاء من مفعولات فتصير مفعولا وتنقل إلى مفعولن ومثاله:\nمهلاً عذولي مهلا ... إن كنت تبغي نيلا\nمني وتبغي عذلا ... فلن تراني سهلا\n\n', 'العنوان: تدريبات على بحر المنسرح\nالمحتوى: التدريب الأول:\nالأبيات التالية من بحر المنسرح. بين نوع العروض والضرب في كل منها، واذكر فيه من زحاف،\nإن وجد:\n1 ما لنجوم السماء حائرة ... أحالها في بروجها حالي؟\n2 إذا صديق نكرت جانبه ... لم تعيني في فراقه الحيل\n3 فما ترجى النفوس من زمن ... أحمد حاليه فيك محمود؟\n4 تلك المودات كيف تهملها؟ ... تلك المواعيد كيف تغفلها؟\n5 يا بدر يا بحر يا غمامة يا ... ليث الشرى يا حمام يارجل\n6 إن هربوا أدركوا وإن وقفوا ... خشوا ذهاب الطريف والتالد\nعين بحر كل بيت من الأبيات التالية، مع ذكر عروضه وضربه وبين نوع الزحاف فيه،\nإن وجد:\n1 ياواسع الداركيف توسعها ... ونحن في صخرة نزلزلها؟\n2 عاذلي لو شئت لم تلم ... فبسمعي عنك كالصمم\n3 لو أنكرت من حيائها يده ... في الحرب آثارها عرفناها\n4 ما أجدر الأيام والليالي ... بأن تقول ما له وما لي؟\n5 إن برقوا فالحتوف حاضرة ... أو نطقوا فالصواب والحكم\n\n', 'العنوان: تدريبات على بحر المنسرح\nالمحتوى: 6 أنكرني حتى كأن لم يكن ... يعرفني من دهره يومًا\n7 لو كان مثلك كل أمٍ برةٍ ... غني البنون بها عن الآباء\n8 الناس مالم يروك أشباه ... والدهر لفظ وأنت معناه\n9 ورددت ما كنت استعر ... ت من الشباب إلى المعير\n10 يا أعدل الناس إلا في معاملتي ... فيك الخصام وأنت الخصم والحكم\n11 إنك من معشرٍ إذا وهبوا ... ما دون أعمارهم فقد بخلوا\n12 أيها الشاعر كم من زهرة ... عوقبت لم تدر يومًا ذنبها\nالتدريب الثالث:\nالأبيات التالية من بحر المنسرح.\nقطعتها على حسب تفاعيلها بعد كتابتها كتابة عروضية:\n1 أنا الذي لا تكاد تلحظه ... مقلة دهر إلا على على وجل\n2 إن نيوب الزمان تعرفني ... أنا الذي طال عجمها عودي1\n3 ففي فؤاد المحب نار جوي ... أحر نار الجحيم أبردها\n\n']"," تفعيلة البحر المنسرح تتكون من عدة أجزاء:

1. مستفعلن: تتكون من سبب خفيف (مس) ووتد مجموع (تف)
2. مفعولات: تتكون من سبب خفيف (مع) ووتد مفروق (لو)
3. مستعلن: تتكون من سبب خفيف (مس) ووتد مجموع (تف)

وزن البحر المنسرح الأصلي هو:
مستفعلن مفعولات مستفعلن ... مستفعلن مفعولات مستفعلن

يمكن أن تتعرض هذه التفعيلات للزحاف، وهو تغيير يطرأ على التفعيلة دون أن يؤثر على الوزن الشعري. الزحاف الشائع في البحر المنسرح يشمل:

1. الخبن: حذف الثاني الساكن من التفعيلة (مستفعلن تصبح متفعلن)
2. الطي: حذف الرابع الساكن من التفعيلة (مستفعلن تصبح مستعلن)
3. الخبن والطي معًا: حذف الثاني والرابع الساكنين من التفعيلة (مستفعلن تصبح متعلن)

يمكن أن تأتي تفعيلة مفعولات مطوية (مفعلات) أو مطوية ومخبونة معًا (معلات).

تذكر أن البحر المنسرح يمكن أن يأتي تامًا أو منهوكًا. في البحر المنسرح التام، تأتي التفعيلات المذكورة أعلاه بشكلها الأصلي أو مع الزحاف. أما في البحر المنسرح المنهوك، فتأتي التفعيلات على شكل مستفعلن مفعولات فقط.

إذا كان لديك سؤال آخر حول البحر المنسرح أو الشعر العربي بشكل عام، فلا تتردد في طرحه. ",تفعيلة البحر المنسرح هي 'مستفعلن مفعولات'.,1.0,0.11,,0.8871949735424178
ما هي تفعيلة البحر الرجز؟,"['العنوان: البحر الرجز\nالمحتوى: ... والرجز هو أكثر بحور الشعر زحافًا واختصارًا.\nووزنه في الأصل:\nمستفعلن مستفعلن مستفعلن ... مستفعلن مستفعلن مستفعلن\nزحاف الرجز:\nويدخل الرجز من الزحاف ثلاثة أنواع هي:\n1 الخبن:\nوهو حذف الثاني الساكن، وهو السين هنا.\n2 الطي:\nوهو حذف الرابع الساكن، وهو الفاء هنا.\n3 الخبل:\nوهو حذف الثاني الساكن والرابع الساكن معًا\nفالتفعيلة الصحيحة:\nاه اه ااه مستفعلن\nوالتفعيلة المخبونة:\nااه ااه متفعلن\nوالتفعيلة المطوية:\nاهـ اااه مستعلن\nوالتفعيلة المخبولة:\nااااه متعلن\n\n', 'العنوان: البحر الرجز\nالمحتوى: وقلما يدخل الخبل في جميع تفعيلات الرجز؛ لأن ذلك يعني حذف اثني عشر حرفًا منه، وهذا أمر يخل بموسيقى البيت. ولكن يحدث إذا دخل الخبل تفعيلة أن تصح أخرى أو يدخلها زحاف واحد لتعويض النقص.\nوبحر الرحز يستعمل تامًّا ومختصرًا.\nأ-\nفالتام:\nهو ما كانت تفاعيله ستًّا.\nب-\nوالمختصر:\nثلاثة أنواع هي:\n1 مجزوء الرجز:\nوهو ما بقي البيت منه على أربع تفاعيل.\n2 مشطور الرجز:\nوهو ما بقي البيت منه على ثلاث تفاعيل.\n3 منهوك الرجز:\nوهو ما بقي البيت منه على تفعيلتين.\nأعاريض الرجز وأضربه:\nأولاً:\nالرجز التام:\nوله عروض واحدة صحيحة،\nوضربها:\nإما صحيح مثلها، بوزن مستفعلن مع ملاحظة جواز زحاف العروض والضرب كزحاف الحشو. وإما أن يكون الضرب مقطوعًا، أي بحذف السابع وتسكين ما قبله وبذلك تتحول مستفعلن إلى مستفعلْ بسكون اللام.\nوعلى ذلك يكون عروض الرجز وضربه كالآتي:\nالعروض الضرب\nصحيحة دائمًا\n(1)\nصحيح مثل العروض،\nأي:\nمستفعلن.\n\n', 'العنوان: البحر الرجز\nالمحتوى: مستفعلن.\n(2)\nمقطوع،\nأي:\nمستفعلْ بسكون اللام بعد حذف السابع.\nالنوع الأول:\nالعروض صحيحة والضرب صحيح كذلك، مع جواز زحاف العروض والضرب كزحاف الحشو.\nمثال ذلك قول أبي فراس الحمداني:\nثم قصدنا صيد عين قاصر ... مظنة الصيد لكل خابر\nجئناه والشمس قبيل المغرب ... تختال في ثوب الأصيل المذهب\nوقوله كذلك:\nنحن نصلي والبزاة تخرج ... مجردات والخيول تسرج\nفقلت للفهاد فامض وانفرد ... وصح بنا إن عن ظبي واجتهد\nالنوع الثاني:\nالعروض صحيحة والضرب،\nمقطوع مستفعلْ بسكون اللام كقول الشاعر:\nمن ذا يداوي القلب من داء الهوى ... إذ لا دواء للهوى موجود؟\nبضم دال موجود:\nوكقول الشاعر:\nيا من إليه أشتكي من هجره ... هل أنت تدري لوعة المهجور؟\nإن كنت لا تدري فيكفي ما مضى ... وامدد له من ظلك المنشور\nأو كنت تدري ثم لا ترثي له ... فالويل كل الويل للمغرور\nوذلك بكسر حرف القافية في الأبيات الثلاثة وهو:\nالراء هنا\n\n', 'العنوان: البحر الرجز\nالمحتوى: ثانيًا:\nمختصر الرجز،\nوهو ثلاثة أنواع:\n1 مجزوء الرجز:\nوهو ما كان على تفعيلتين وتفعيلتين.\nوعروضه وضربه صحيحان، مع جواز زحافهما،\nمثل:\nخَوْدٌ1 يفوح المسك من ... أردانها والعنبر\nيضيق عن أردافها ... إذا يلاث المئزر\nتالله أنسى حبها ... حياتنا أو أقبر\nومثاله كذلك قول الشاعر:\nحول الحمى يا غانية ... طفل حشاه دامية\nتبكي عليه الساقية ... وأنت فوق الرابية\nمشغولة بالقدح ... هذا أوان الفرح\nومن أمثلته كذلك قول شوقي:\nلي جدة ترأف بي ... أحنى على من أبي\nوكل شيء سرني ... تذهب فيه مذهبي\nإن غضب الأهل علي ... كلهم لم تغضب\nمشى أبي يومًا إلى ... مشية المؤدب\nغضبان قد هدد بالضـ ... ـرب وإن لم يضرب\nفلم أجد لي منه غير ... جدتي من مهرب\nفجعلتني خلفها ... أنجو بها وأختبي\nوهي تقول لأبي ... بلهجة المؤنب\nويح له.. ويح لهـ ... ـذا الولد المعذب\nألم تكن تفعل ما ... يفعل إذا أنت صبي؟\n\n', 'العنوان: البحر الرجز\nالمحتوى: 2 مشطور الرجز:\nوهو ما كان كل بيت منه على ثلاث تفاعيل.\nويعتبر البيت في الوقت ذاته شطرة من الرجز التام فلا يجزَّأ بعد ذلك:\nومثاله قول حافظ إبراهيم:\nتحية كالورد في الأكمام ... أزهى من الصحة في الأجسام\nيسوقها شوق إليكم نامي ... تقصر عنه همة الأقلام\n3 منهوك الرجز:\nوهو ما بقي على تفعيلتين،\nمثل قول أبي نواس:\nإلهنا ما أعدلك ... مليك كل من ملك\nلبيك قد لبيت لك ... ما خاب عبد سألك\nأنت له حيث سلك ... لولاك يا رب هلك\nالتشابه بين الرجز والكامل:\nمر بنا في بحر الكامل أن زحاف الإضمار، وهو تسكين الثاني المتحرك، يدخله كثيرًا، أي أن متفاعلن تصير متْفاعلن بسكون التاء.\nوعلى هذا إذا أضمر الكامل سواء أكان تامًّا أم مجزوءًا فإنه قد يشتبه\n\n', 'العنوان: البحر الرجز\nالمحتوى: بالرجز، ولكن متى وجدنا تفعيلة محركة الثاني فإن القصيدة تكون من الكامل وإلا فهي من الرجز.\nومن العلامات الأخرى التذييل1 والترفيل2 فهما مختصان بمجزوء الكامل، وكذلك الزحاف بحذف الثاني أو الرابع إذ هو خاص بالرجز.\nملاحظة.\nلكثرة الزحاف في الرجز استعمل في نظم العلوم، كألفية ابن مالك في النحو، والرحبية في الميراث، والشاطبية في القراءات.\nوبعضها سار على قافية واحدة في آخر الأبيات، وبعضها جاء مزدوجًا بمعنى أن كل بيت يشبه فيه العروض الضرب في القافية كالألفية؛ وهاك نموذجًا منها.\nقال محمد هو ابن مالك ... أحمد ربي الله خير مالك\nمصليًّا على النبي المصطفى ... وآله المستكملين الشرفا\nواستعين الله في ألفية ... مقاصد النحو بها محوية\nتقرب الأقصى بلفظ موجز ... وتبسط البذل بوعد منجز\nوتقتضي رضا بغير سخط ... فائقة ألفية ابن معط\n\n', 'العنوان: تمرينات على بحر الرجز\nالمحتوى: التدريب الأول:\n1 بين عروض الرجز وضربه في الأبيات التالية،\nواذكر نوع الزحاف في كل بيت:\nأ- كأنما الماء عليه الجسر ... درج بياضٍ فيه سطر\nب- يا خائف الموت وأنت سائقه ... تفر من شيء وأنت ذائقه؟\nج- وبقعة من أحسن البقاع ... يبشر الرائد فيها الراعي\nد- أروح القلب ببعض الهزل ... تجاهلا مني بغير جهل\nالتدريب الثاني:\nما نوع الرجز في الأمثلة التالية:\n1 يا رب ظبي بمكانٍ خال ... صبحته والليل ذو أهوال\n2 ومرتدٍ ... بطرةٍ.. ... مسبلة الطرائف..\nكأنها ... مرسلة ... من زردٍ مضاعف..\n3 أستعمل الشدة في أوانها ... وأغفر الزلة في إبانها\nيا لك أحباء، على عدوانها ... نسوانها أمنع من فرسانها!\nالتدريب الثالث:\nعين بحر كل بيت فيما يلي:\n1 ما العمر ما طالت به الدهور ... العمر ما تم به السرور\n\n', 'العنوان: تمرينات على بحر الرجز\nالمحتوى: 2 إن الغني هو الغني بنفسه.. ... ولو أنه عاري المناكب حاف\nما كل ما فوق البسيطة كافيًا ... فإذا قنعت فكل شيء كاف\n3 إن زرت خرشنة أسيرا ... فلكم أحطت بها مغيرا\nمن كان مثلي لم يمت ... إلا أسيرًا أو أميرًا\n4 قامت إلى جاراتها ... ... تشكو بذل وشجا\nأما ترين ذا الفتى؟ ... مر بنا ما عرجا\nإن كان ما ذاق الهوى ... فلا نجوت إن نجا\n5 كل حيٍ عند ميتته ... حظه من ماله الكفن\n\n']"," تفعيلة البحر الرجز هي ""مستفعلن"" وتتكرر في كل شطر من البيت الشعري. البحر الرجز يتميز بأنه أكثر البحور الشعرية زحافًا واختصارًا. يمكن أن يدخل الزحاف على تفعيلة الرجز بطرق مختلفة مثل الخبن والطي والخبل.

الخبن: حذف الثاني الساكن (السين في ""مستفعلن"").
الطي: حذف الرابع الساكن (الفاء في ""مستفعلن"").
الخبل: حذف الثاني الساكن والرابع الساكن معًا (السين والفاء في ""مستفعلن"").

يمكن أن يكون الرجز تامًا ومختصرًا، حيث يشمل المختصر ثلاثة أنواع: مجزوء الرجز، مشطور الرجز، ومنهوك الرجز. يتميز الرجز أيضًا بأنه يستخدم في نظم العلوم مثل النحو والميراث والقراءات. ",تفعيلة البحر الرجز هي 'مستفعلن'.,1.0,0.13,,0.8908515742370806
ما هي تفعيلة البحر الرمل؟,"['العنوان: البحر الرمل\nالمحتوى: وزنه في الأصل:\nفاعلاتن فاعلاتن فاعلاتن ... فاعلاتن فاعلاتن فاعلاتن\nزحاف الرمل:\nيدخل الرمل من الزحاف:\n1 الخبن:\nوهو هنا حذف الثاني الساكن من التفعيلة، وعلى ذلك تصبح فاعلاتن فعِلاتن فبعد أن تكون وتدًا مجموعًا بين سببين خفيفين تصير فاصلة صغرى وسببًا خفيفًا. وهذا هو الزحاف المستحسن في الرمل.\nوقد يدخله نوعان آخران من الزحاف هما:\nأ-\nالكف أي:\nحذف السابع الساكن، وبذلك تصبح فاعلاتن فاعلاتُ بتاء متحركة.\nب-\nالشكل:\nوهو اجتماع الخبن مع الكف، فتصبح فاعلاتن فعِلاتُ بتاء متحركة.\n\n', 'العنوان: البحر الرمل\nالمحتوى: ويستعمل الرمل تامًّا ومجزوءا.\n1 الرمل التام.\nعروضه دائمًا محذوفة1، بمعنى أن يحذف السبب الخفيف من آخر فاعلاتن فتصير فاعلا، وتنقل إلى فاعلن.\nوبذلك يصبح الوزن المستعمل للرمل التام هو:\nفاعلاتن فاعلاتن فاعلن ... فاعلاتن فاعلاتن فاعلن\nعروض الرمل التام وأضرابه:\nعروض الرمل التام محذوفة دائمًا،\nأي:\nفاعلن،\nولهذه العروض ثلاثة أضرب كالآتي:\n1 محذوف أي:\nفاعلن.\n2 مقصور أي:\nدخله القصر، وهو حذف السابع الساكن وإسكان ما قبله وبذلك تصبح فاعلاتن فاعلاتْ بسكون التاء.\n3 صحيح أي:\nفاعلاتن. وعلى ذلك يكون العروض والأضرب هكذا.\nالعروض الضرب\nمحذوفة فاعلن\n(1)\nمحذوف فاعلن\nمع جواز خبنها\n(2)\nمقصور فاعلاتْ بسكون التاء\n(3)\nصحيح فاعلاتن\n\n', 'العنوان: البحر الرمل\nالمحتوى: النوع الأول:\nالعروض محذوفة والضرب محذوف كذلك. مثاله\nقول الشاعر:\nعلميني حكمة في طيها ... بلسم الروح وترياق الجسد\nيا حبيبي قالت العين التي ... عرفت أنا انتهينا ... للأبد\nكل ما في الأرض من فلسفة ... لا يعزي فاقدًا عمن فقد\nالنوع الثاني:\nالعروض محذوفة والضرب مقصور،\nأي:\nفاعلاتْ بسكون التاء،\nومثاله قول الشاعر:\nيا رجاء العمر لو كان الرجاء ... غير صبح الوهم أو ليل الشقاء\nسر كما تهوى على أشلائنا ... وعلى الماضي الذي جاز السماء\nوانزع الرحمة.. لا تحفل بها ... إنما الرحمة شرع الضعفاء\nحبذا الكفران بالحب ولا ... حبذا الإيمان فيه والوفاء\nوالنوع الثالث:\nالعروض محذوفة والضرب صحيح فاعلاتن ومثاله\nقول الشاعر:\nحدثوني بالمنى يا أصدقائي ... وصفوا لي بعض أوقات الهناء\nمظلم النفس كأني ملك ... غضب الله عليه في السماء\nوالبيت الأول هنا هو مطلع القصيدة، ولذا دخله التصريع فصارت العروض فيه صحيحة مثل الضرب، ولكن العروض تعود بعد البيت الأول محذوفة كأصلها كما يلاحظ في البيت الثاني.\n\n', 'العنوان: البحر الرمل\nالمحتوى: 2 الرمل المجزوء:\nالرمل المجزوء هو ما حذف منه ثلثه، وبذلك يصبح كل شطر تفعيلتين اثنتين فقط.\nعروض الرمل المجزوء وأضربه:\nللرمل المجزوء عروض واحدة صحيحة دائمًا،\nأي:\nفاعلاتن،\nولهذه العروض ثلاثة أضرب هي:\n1 صحيح أي:\nفاعلاتن.\n2 صحيح مسبغ أي:\nصحيح دخله التسبيغ، وهو زيادة حرف ساكن على السبب الخفيف آخر التفعيلة، وبذلك تصبح فاعلاتن فاعلاتان.\n3 محذوف:\nأي: فاعلا وتنقل إلى فاعلن، وعلى ذلك يكون عروض مجزوء الرمل وأضربه هكذا.\nالعروض الضرب\nصحيحة فاعلاتن\n(1)\nصحيح فاعلاتن مع جواز خبنها\nمع جواز خبنها\n(2)\nصحيح مسبغ فاعلاتان\n(3)\nمحذوف فاعلن\nالنوع الأول. العروض صحيحة والضرب صحيح كذلك.\nمثاله قول الشاعر:\nفي ظلال النخلات ... والورود الحالمات\nجلس الشاعر حيرا ... ن كثير الحرقات\n\n', 'العنوان: البحر الرمل\nالمحتوى: صامتًا في نفسه قد ... عاف طعم الكلمات\nتزبد الدنيا ... وترغي ... وهو في نوم سبات\nلا يبالي بعد ما عا ... نى شديد الضربات\nنامت الدنيا أم اهتز ... ت بشتى الحادثات\nدعه في صمت كصمت الـ ... ـموت جهم الطلعات\nما غناء القول والشعـ ... ـر لدى قومٍ قساة؟\nالنوع الثاني:\nالعروض صحيحة فاعلاتن والضرب صحيح مسبغ فاعلاتان ومثاله قول الشاعر:\nلان حتى لو مشى الذر ... عليه كاد يدميه\nوكقول الشاعر:\nأترى أدعوك من أهـ ... ـواه؟ كلا لست أدعوك\nأو تراني أرتجي وصـ ... ـلك يومًا؟ كيف أرجوك؟\nالنوع الثالث:\nالعروض صحيحة والضرب محذوف فاعلن.\nيا حبيبي إن تنم عنـ ... ـي فإني لم أنم\nأسهر الليل أغنيـ ... ـك بآلاف النغم\nليت إذ أدعوك يومًا ...\nلا تقل:\nلا بل نعم\n\n', 'العنوان: تدريبات على بحر الرمل\nالمحتوى: التدريب الأول:\nالأبيات التالية من بحر الرمل التام أومجزوئه. بين نوع العروض والضرب في كل منها،\nواذكر نوع الزحاف في كل منها إن وجد:\n1 إن هذا الشعر في الشعر ملك ... سار فهو الشمس والدنيا فلك\n2 لا تقل لي في غدٍ موعدنا ... الغد المرجو ناءٍ كالنجوم\n3 أيها الساكن عيني ودمي ... أين في الدنيا مكان لست فيه؟\n4 هل ترى النعمة دامت ... لصغير أو كبير ... ؟\n5 ما أبالي بعد يومي.. ... طال ليلي أم قصر\nالتدريب الثاني:\nعين بحر كل بيت من الأبيات التالية،\nوبين ما فيها من زحاف:\n1 لا أذود الطير عن شجرٍ ... قد بلوت المر من ثمره\n2 ألم تر ما بنى كسرى ... وسابور لمن غبرا؟\n3 إنما الدينا عباب ضمنا ... وشطوط من حظوظ فرقتنا\n4 كأنما لسانه.... ... شد بحبلٍ ... من مسد\n5 أنت للمال إذا أمسكته ... وإذا أنفقته فالمال لك\n6 إن الخليفة قد أبى ... وإذا أبي شيئًا أبيته\n\n', 'العنوان: تدريبات على بحر الرمل\nالمحتوى: 7 أحمد الله على ما ... سر من أمري وساء\n8 قتل الإنسان ما أكفره ... إنه أظلم من في العالمين!\nالتدريب الثالث:\nقطع الأبيات التالية على حسب تفاعيلها،\nبعد كتابتها كتابة عروضية:\n1 عجبًا يا بحر تحيا بالمعاني ... في أوانٍ ثم تفنى في أوان\n2 هو في الروم مقيم ... وله في الشام قلب\n3 خرج المدفع يطوي مدفعًا ... الأساطيل اتقته والحصون\n\n']"," تفعيلة البحر الرمل تتكون من ست تفعيلات وهي كالتالي:

1. فاعلاتن (وتفعيلة الرمل الأصلية)
2. فاعلاتن
3. فاعلاتن
4. فاعلاتن
5. فاعلاتن
6. فاعلاتن

تفعيلة الرمل الأصلية هي ""فاعلاتن"" وتتكرر في كل شطر من البيت الشعري. يمكن أن تتعرض هذه التفعيلة للزحاف، وهو تغيير طفيف في التفعيلة دون التأثير على الوزن الشعري. الزحاف الشائع في الرمل هو الخبن (حذف الثاني الساكن) والكف (حذف السابع الساكن) والشكل (اجتماع الخبن والكف). ",تفعيلة البحر الرمل هي 'فاعلاتن'.,1.0,0.17,0.7,0.8771035160078062
ما هي تفعيلة البحر الهزج؟,"['العنوان: البحر الهزج\nالمحتوى: ... أصل وزنه:\nمفاعيلن مفاعيلن مفاعيلن ... مفاعيلن مفاعيلن مفاعيلن\nولكنه لا يستعمل إلا مجزوءًا، أي بأربع تفاعيل،\nكل اثنتين في شطر وعلى ذلك يكون وزنه بعد اقتطاع تفعيلة من كل شطر كالآتي:\nمفاعيلن مفاعيلن ... مفاعيلن مفاعيلن\nزحاف الهزج:\nيدخل هذا البحر من الزحاف الكف وهو:\nحذف السابع الساكن، بشرط أن يكون ثاني سبب، فمفاعيلن بعد كفها تصبح مفاعيلُ بتحريك اللام.\nعروض الهزج وأضربه:\nللهزج عروض واحدة صحيحة،\nوله ضربان:\n(1)\nصحيح مثل العروض\n(2)\nومحذوف،\nكالآتي:\n\n', 'العنوان: البحر الهزج\nالمحتوى: العروض الضرب\nصحيحة:\n1 صحيح: مفاعيلن.\nمفاعيلن 2 محذوف أي:\nبحذف السبب الأخير من مفاعيلن فتصبح مفاعي، وتنقل إلى مفاعلْ بسكون اللام، أو فعولن.\n1 النوع الأول:\nالعروض صحيحة والضرب صحيح كذلك،\nكقول الشاعر:\nعفونا عن بني ذهل ... وقلنا القوم إخوان\nعسى الأيام أن يرجعـ ... ـن قومًا كالذي كانوا\nفلما صرح الشر ... فأمسى وهو عريان\nولم يبق سوى العدوا ... ن دناهم كما دانوا\nمشينا مشية الليث ... عدا والليث غضبان\nويلاحظ أن زحاف الكف قد دخل حشو البيت الرابع في التفعيلة الأولى منه وهي:\nولم يبق فوزنها مفاعيلُ بتحريك اللام.\nكذلك دخل زحاف الكف عروض البيتين الثالث والأخير، أما الضرب فلا يدخله الزحاف نظرًا لوجوب الإبقاء على وحدة القافية.\n2 النوع الثاني:\nالعروض صحيحة والضرب محذوف مفاعي التي تنقل إلى مفاعلْ بسكون اللام، أو فعولن،\nومثاله قول الشاعر:\nمتى أشفي غليلي ... بنيل من بخيل؟\nغزال ليس لي منه ... سوى الحزن الطويل\n\n', 'العنوان: البحر الهزج\nالمحتوى: والبيت الأول مصرع.\nالتشابه بين الهزج ومجزوء الوافر:\nعرفنا مما تقدم أن مفاعلتن في بحر الوافر ومجزوئه يدخلها من الزحاف العصب، وهو تسكين اللام،\nوبذلك تصبح مفاعلْتن بعد دخول العصب عليها مكونة من:\nوتد مجموع، سببين خفيفين. وفي هذه الحالة تشبه مفاعيلن في مقاطعها.\nفإذا وردت قصيدة أو مقطوعة من الشعر على وزن:\nمفاعيلن مفاعيلن،\nوكان في أحد الأبيات:\nمفاعلَتن بفتح اللام فإن هذه القصيدة أو المقطوعة تكوم من مجزوء الوافر ولا تكون من الهزج.\nومثال ذلك قول الشاعر:\nوألقى رأسه شوقًا\n... على صدري كمن أغفى\nأبالإغفاء تقتلني ... وتخطف مهجتي خطفًا؟\nفالتفعيلة الثانية من الشطر الأول للبيت الثاني،\nوكذلك التفعيلة الأولى من الشطر الثاني في نفس البيت هي:\nمفاعلَتن بفتح اللام. وهذا دليل على أن القصيدة أو المقطوعة التي منها هذان البيتان هي من مجزوء الوافر وليست من بحر الهزج.\nأما إذا كانت جميع تفعيلات القصيدة أو المقطوعة على وزن مفاعيلن، فإن القصيدة أو المقطوعة تكون من بحر الهزج لا من مجزوء الوافر.\nوالخلاصة أن ورود مفاعلَتن بفتح اللام ولو مرة واحدة يقطع بأن القصيدة من مجزوء الوافر، وعدم ورود مفاعلَتن بفتح اللام في القصيدة يقطع بأنها من بحر الهزج.\n\n', 'العنوان: تدريبات على بحر الهزج\nالمحتوى: التدريب الأول:\nالأبيات التالية من بحر الهزج. بين نوع العروض والضرب في كل منها،\nواذكر نوع الزحاف في كل بيت إن وجد:\n1 أيا من دونه المدح ... وفي أفعاله قبح\nإذا جازيت بالصد ... فأين العفو والصفح؟\n2 أحب البدر من أجل ... غزال فيهم باد\n3 غِنى النفس لمن يعقـ ... ـل خير من غِنى المال\nوفضل الناس في الأنفـ ... س ليس الفضل في الحال\n4 عرفت الشر لا للشر ... لكن لتوقيه\nومن لا يعرف الشر ... من الناس يقع فيه\n5 لماذا أنت تشكوني ... وبي مثل الذي بك؟\nالتدريب الثاني:\nعين البحر في الأبيات التالية:\n1 يا عمرو ما للناس قد ... كلفوا بلا ونسوا نعم؟\n2 ما ارتد طرف محمد ... إلا أتى ضرًا ونفعًا\n3 ترى من لست أنساه ... على الحالات ينساني؟\n4 إن الخلافة لم تزل ... تزهو وتفخر بالأمين\n5 اشغل قريضك بالنسيـ ... ـب وبالفكاهة والمزاح\n6 فقد نافسني الدهر ... بتأخير عن الحضرة\nفما ألقى من العلـ ... ـة ما ألقى من الحسرة\n7 سروري عنده لمع ... ودهري كله أسف\nالتدريب الثالث:\nكيف تفرق بين مجزوء الوافر وبحر الهزج؟\n\n']"," تفعيلة البحر الهزج هي ""مفاعيلن"" وتتكرر أربع مرات في كل بيت شعر. البحر الهزج يتميز بأنه لا يستخدم إلا مجزوءًا، أي بأربع تفاعيل، كل اثنتين في شطر.

مثال على تفعيلة البحر الهزج:
مَفاعِيلُن مَفاعِيلُن
مَفاعِيلُن مَفاعِيلُن

في هذا المثال، تتكون التفعيلة الأولى من ""مَفاعِيلُن"" وتتكون التفعيلة الثانية أيضًا من ""مَفاعِيلُن"". يتكرر هذا النمط في جميع أبيات القصيدة. ",تفعيلة البحر الهزج هي 'مفاعيلن'.,1.0,0.6,0.625,0.8951684918552907
ما هي تفعيلة البحر الكامل؟,"['العنوان: البحر الكامل\nالمحتوى: ... ووزنه:\nمتفاعلن متفاعلن متفاعلن\nمتفاعلن متفاعلن متفاعلن\nزحاف الكامل:\nيدخله كثيرًا زحاف الإضمار، وهو تسكين الثاني المتحرك، وبذلك تصبح التفعيلة مكونة من سببين خفيفين ووتد مجموع مثل مستفعلن،\nوقد يدخله الطي:\nوهو حذف الرابع الساكن ولكن ذلك نادر جدًّا.\nالكامل التام:\nوهو ما كانت تفاعيله ستًّا،\nوله عروضان وخمسة أضرب هكذا:\n\n', 'العنوان: البحر الكامل\nالمحتوى: العروض الضرب\nأ-\nصحيحة:\nمتفاعلن 1 صحيح. متفاعلن\n2 مقطوع متفاعل1، أي بحذف آخر الوتد المجموع وإسكان ما قبله.\n3 أحذ مضمر متْفا، بحذف الوتد المجموع وتسكين الثاني.\nب-\nحذّاء:\nمتَفا 1 أحذ متَفا بتحريك التاء.\n2 أحذ مضمر متْفا\n2 مجزوء الكامل:\nوهو ما حذف ثلثه وبقي على أربع تفعيلات،\nوله عروض واحدة وأربعة أضرب كالآتي:\n\n', 'العنوان: البحر الكامل\nالمحتوى: العروض الضرب\n1 صحيح. متفاعلن.\nصحيحة:\n2 مقطوع متفاعل، بحذف السابع الساكن، وتسكين ما قبله.\nمتفاعلن\n3 مذيل:\nوهو ما يزد عليه حرف فتصير متفاعلن متفاعلان.\n4 مرفل:\nوهو ما زيد عليه سبب خفيف فتصير متفاعلن متفاعلاتن\nملاحظة:\nعروض هذا المجزوء وضربه الصحيح يشاركان حشوه من حيث الإضمار، أي تسكين الثاني أو عدم تسكينه،\nبمعنى أنهما قد يكونان على وزن متَفاعلن بتحريك التاء:\nأو متْفاعلن بتسكينها.\nأمثلة للكامل:\nأولاً الكامل التام:\n1 العروض صحيحة والضرب صحيح:\nمثالهما قول شاعر معاصر:\nكفى دعابات الجنون فما بقي ... لهواك معنى يرتجيه ويتقي\nوهبيه كالأمس البعيد فمن له ... في اليوم بالقلب القديم الشيق؟\n\n', 'العنوان: البحر الكامل\nالمحتوى: 2 العروض صحيحة والضرب مقطوع:\nمثالهما قول شاعر:\nوالعود أما العود فهو محدث ... لبق يصوغ لي الغناء عزاء\nألقه كاليوم ينقلني إلى ... دنيا نقيض طلاقة وبهاء\n3 العروض صحيحة والضرب أحذ مضمر مثالهما:\nقول أحد الشعراء:\nعقم النساء فما يلدن شبيهه ... إن النساء بمثله عقم\nنزر الكلام من الحياء تخاله ... ضمنًا وليس بجسمه سقم\n4 العروض حذاء والضرب أحذ متَفا بتحريك الثاني مثالهما قول أبي نواس:\nيا نفس خافي الله واتئدي ... واسعي لنفسك سعي مجتهد\nمن كان جمع المال همته ... لم يخل من هم ومن كمد\nيا طالب الدنيا ليجمعها ... جمحت بك الآمال فاقتصد\n5 العروض حذاء والضرب أحذ مضمر:\nمثالهما قول أحد الشعراء:\nيا روض أيامي التي سلفت ... ومعين أشعار الصبى النضر\nمن لي بيوم فيك أهدؤه ... وأبيع فيه بقية العمر\n\n', 'العنوان: البحر الكامل\nالمحتوى: 4 العروض صحيحة والضرب مذيل متفاعلان مثالهما:\nصور نريك تحركًا\nوالأصل في الصور السكون\nويمر رائع صمتها ... بالحسن كالنطق المبين\nغض على طول البلى ... حي على طول المنون\nملاحظة:\nقد يشتبه بعض أنواع الكامل ببحر الرجز، وسنوضع هذا التشابه عند الكلام على الرجز.\n\n']"," تفعيلة البحر الكامل هي ""متفاعلن"" وتتكرر ثلاث مرات في الشطر الأول وثلاث مرات في الشطر الثاني. وزن البحر الكامل يكون على النحو التالي:

متفاعلن متفاعلن متفاعلن
متفاعلن متفاعلن متفاعلن

يمكن أن يتعرض البحر الكامل لبعض الزحافات والعلل، مثل الإضمار (تسكن الثاني المتحرك) والطي (حذف الرابع الساكن) والإذالة (إضافة حرف بعد التفعيلة الأصلية) والمرفل (إضافة سبب خفيف بعد التفعيلة الأصلية). هذه التغييرات قد تؤثر على شكل التفعيلة والوزن العام للبيت الشعري. ",تفعيلة البحر الكامل هي 'متفاعلن'.,1.0,0.12,0.9,0.8952542988779286
ما هي تفعيلة البحر المتقارب؟,"['العنوان: البحر المتقارب\nالمحتوى: وزن هذا البحر:\nفعولن فعولن فعولن فعولن ... فعولن فعولن فعولن فعولن\nزحاف المتقارب:\nيدخله من الزحاف القبض، وهو حذف الخامس الساكن، أي النون من فعولن فتصبح فعولُ.\nوهذا الزحاف كما يدخل حشو المتقارب يدخل على عروضه أيضًا، وبذلك تصير تفعيلة العروض فعولن فتصبح فعول بحذف النون.\nكذلك يدخل على عروضه الحذف،\nأي:\nحذف السبب الخفيف من آخر فعولن فتصبح فعو، وتنقل إلى فعَلْ بفتح العين وسكون اللام.\nوعلى ذلك فللمتقارب عروض واحدة صحيحة فعولن مع جوار قبضها فتصير فعول أو جواز حذفها فتصير فعَلْ بفتح العين وسكون اللام.\n\n', 'العنوان: البحر المتقارب\nالمحتوى: أما الضرب فلا يدخله القبض،\nوهو أربعة أنواع:\nفعولن ومحذوف فعَلْ بفتح العين وسكون اللام اللام، ومقصور فعول بحذف الحرف الأخير وتسكين ما قبله، وأبتر فعْ بسكون العين1\nالعروض الضرب\n1 صحيح فعولن\nصحيحة:\nفعولن 2 محذوف فعَلْ بفتح العين وسكون اللام.\nمع جواز قبضها أو حذفها 3 مقصور فعولْ بسكون اللام\n4 أبتر فعْ بسكون العين.\nالنوع الأول:\nالعروض صحيحة فعولن، والضرب صحيح كذلك فعولن،\nومثاله قول الشاعر:\nتظل حبيس الهوى والمعاصي ... فأين النجاة؟ وأين الفرار؟\nومثاله أيضًا مع قبض العروض فعول،\nومع بقاء الضرب صحيحًا فعولن قول الشاعر:\nوداعًا ربوع النعيم القديم ... وداعًا هياكله الموحيات\nأأخرج؟ كيف أطيق الخروج؟ ... وكيف أطيق فراق الحياة؟\nأأرحل؟ كيف وليل الشقاء ... يطالعني بالرؤي المفزعات؟\n\n', 'العنوان: البحر المتقارب\nالمحتوى: وداعًا ... فماذا وقوف الفؤاد ... بأطلال أشواقه الهالكات\nويا عالمًا شدته ثم زال ... سلام عليك ... على الذكريات\nوالنوع الثاني:\nالعروض صحيحة مع جواز قبضها أو حذفها، والضرب محذوف.\nومثاله قول شوقي:\nأبا الهول طال عليك العصر ... وبلغت في الأرض أقصى العمر\nفيا لدة الدهر لا الدهر شب ... ولا أنت جاوزت حد الصغر\nإلام ركوبك متن الرمال ... لطي الأصيل وجوب السحر؟\nتسافر منتقلاً في القرون ... فأيان تلقي غبار السفر؟\nأبينك عهد وبين الجبال ... تزولان في الموعد المنتظر؟\nتحرك أبا الهول هذا الزمان ... تحرك ما فيه حتى الحجر؟\nوالنوع الثالث:\nالعروض صحيحة مع جواز قبضها أو حذفها والضرب مقصور فعولْ بسكون اللام.\nومثاله قول الشاعر:\nويعبثُ بالناس عزف النُّحاس ... فتسمع منهم زئير الأسودْ\nويطغى السرور لمرأى السرور ... فينتثر الدمع فوق الخدود\nفيا موكبًالم يُتَح للملوك ... ولم يحظ قُطر به في الوجود\nإلى الخلد سر في ضمان السماء ... فأنت حرِيُّ بهذا الخلود\nدفعت عن الوطن العادياتِ ... وذُدت عن الأهل رقَّ العبيد\nفأحييت شعبك بعد الموات ... وأرضيت بين القبور الجدود\nوالنوع الرابع:\nالعروض صحيحة مع جواز قبضها أو حذفها والضرب أبتر فع ْبسكون، وهذا الضرب قليل الاستعمال،\nومثاله قول الشاعر:\nفلا القلبُ ناسٍ لما قد مضى ... ولا تاركٌ أبدًا غيهْ\n\n', 'العنوان: البحر المتقارب\nالمحتوى: ودع قول باك على أرسم ... فليس الرسوم بمبكية\nخليلي عوجا على رسم دار ... خلت من سليمى ومن مية\nوالمتقارب يستعمل تامًّا ومجزوءًا. وقد مر الكلام عن المتقارب التام من حيث زحافه وعروضه وأضربه مع التمثيل لكل منها.\nالمتقارب المجزوء:\nأما المتقارب المجزوء فهو ما بقي على ست تفعيلات كل ثلاثٍ في شطر هكذا:\nفعولن فعولن فعولن ... فعولن فعولن فعولن\nعروض المتقارب المجزوء وضربه:\nوللمتقارب المجزوء عروض واحدة محذوفة،\nأي:\nفعو وتنقل إلى فعَلْ بفتح العين وسكون اللام.\nولهذه العروض ضربان:\n(1)\nمحذوف مثلها فعَلْ، وضرب أبتر على وزن فعْ بسكو العين وهو قليل الاستعمال.\nوفيما يلي أمثلة لذلك:\nالنوع الأول:\nالعروض محذوفة فعَلْ،\nوالضرب محذوف كذلك ومثاله قوله الشاعر:\nلنا صاحب لم يزل ... يعللنا بالأمل\nْويمطلنا في الهوى ... فنصبر رغم المللْ\nونمنحه ودنا ... فيلهو به في جذل\nْعفا الله عن ظالم ... أساء إلى من عدلْ\n\n', 'العنوان: البحر المتقارب\nالمحتوى: النوع الثاني:\nالعروض محذوفة فعَلْ والضرب أبتر فعْ بسكون العين، وهذا الضرب قليل الاستعمال.\nومثاله قول الشاعر:\nإذا زرتنا منعمًا ... فأهلاً وسهلاً بك\nوكل الذي عندنا ... وكل هوانا.. لك\n\n', 'العنوان: تدريبات على بحر المتقارب\nالمحتوى: التدريب الأول.\nالأبيات التالية من بحر المتقارب. اذكر عروض كل بيت وضربه، واذكر نوع الزحاف الذي دخل عليها، إن وجد.\n1 كسونا إخوتنا بالصفاء ... كما كسيت بالكلام المعاني\n2 وفيك تعلمت نظم الكلام ... فلقبني الناس بالشاعر\n3 ومن جهلت نفسه قدره ... رأى غيره منه ما لا يرى\n4 سل الربع عن ساكنيه فإني ... خرست فما أستطيع السؤالا\n5 وتغضب حتى إذا ما ملكـ ... ـت أطعت الرضا وعصيت الغضب\n6 إذا ضاحك الزهر زهر الوجوه ... فأين الخلاص؟ وأين الطريق؟\nلتدريب الثاني:\nعين بحر كل بيت من الأبيات التالية،\nواذكر ما في حشوه وعروضه وضربه من زحاف:\n1 وأبذل عدلي للأضعفين ... وللشامخ الأنف لا أبذله\n\n', 'العنوان: تدريبات على بحر المتقارب\nالمحتوى: 2 ليس من مات فاستراح بميت ... إنما الميت ميت الأحياء\n3 وذقنا مرارة كأس الصدود ... فأين حلاوة كأس الوصال؟\n4 أعرضت فَلَاحَ لها.. ... عارضان كالبرد..\n5 وأقلامه وفق أسيافه ... يظل الصرير يباري الصليلا\n6 طار الفؤاد المروع ... وقال لا أستطيع\nالتدريب الثالث:\nالأبيات التالية من بحر المتقارب التام أو مجزوئه. اكتبها كتابة عروضية،\nثم قطعها على حسب تفاعيلها:\n1 حذار حذار فإن الكريم ... إذا سيم خسفًا أبى وامتعض\n2 كأنك بالفقر تبغي الغنى ... وبالموت في الحرب تبغي الخلودا\n3 لأيكم ... أذكر؟ ... وفي أيكم ... أفكر؟\n4 أأحرم منك الرضا ... وتذكر ما قد مضى؟\n\n', 'العنوان: تدريبات على بحر المتقارب\nالمحتوى: والمتدارك يكثر استعماله تامًّا ويقل استعماله مجزوءًا.\nالمتدارك التام:\nوهو ما كان مؤلفًا من ثماني تفاعيل،\nومن أمثلته قول شوقي:\nمضناك جفاهُ مرقدهُ ... وبكاه ورحّم عودهُ\nحيرانُ القلب معذبه ... مقروح ُالجفن مسهده\nويناجي النجم ويتعبه ... ويقيم الليل ويقعده\nفعساك بغمض مسعفه ... ولعل خيالك مسعده\nتقطيع البيت الأول هكذا:\nمضنا كجفا هومر قدهو ... وبكا هورح حمعو ودهو\nاهـ اهـ اا اه اه اه اا اه ... اااه اااه اااه اااه\nفعْلن فعَلن فعْلن فعَلن ... فعَلن فعَلن فعَلن فعَلن\nويلاحظ هنا أن كلا من التفعيلة الأولى والثالثة مشعثة بسكون العين، أما بقية التفاعيل الأخرى فمخبونة، حذفت ألفها مع بقاء العين محركة.\nومن الأمثلة أيضًا قول أبو الحسن على الحصري القيرواني:\nيا ليل الصب متى غده؟ ... أقيام الساعة موعده؟\nرقد السمار وأرقه ... أسف للبين يردده\nيا من جحدت عيناه دمي ... وعلى خديه تورده\nخداك قد اعترفا بدمي ... فعلام جفونك تجحده؟\nإني لأعيذك من قتلي ... وأظنك لا تتعمده\nبالله هب المشتاق كرىً ... فلعل خيالك يسعده\n\n', 'العنوان: تدريبات على بحر المتقارب\nالمحتوى: المتدارك المجزوء:\nوهو ما بقي على ست تفعيلات،\nكل ثلاث في شطر هكذا:\nفاعلن فاعلن فاعلن ... فاعلن فاعلن فاعلن\nولمجزوء المتدارك ثلاثة أضرب كالآتي:\nالنوع الأول:\nضرب صحيح فاعلن وهو أشهرها ومثاله:\nقف على دراهم وابكين ... بين أطلالها والدمن\nالنوع الثاني:\nضرب على فاعلان أي: دخله التذييل بزيادة نون ساكنة على فاعلن فأصبحت فاعلان،\nومثاله:\nهذه دراهم أقفرت ... أم زبور1 محتها الدهور\nالنوع الثالث:\nضرب على فعلاتن أي بالخبن، وهو حذف الثاني الساكن، والترفيل، وهو زيادة سبب خفيف على آخر التفعيلة،\nومثاله:\nدار سعدي بشحر عمان ... قد كساها البلى الملوان\nويلاحظ أن العروض هنا دخلها التصريع.\n\n']"," تفعيلة البحر المتقارب هي ""فعولن فعولن فعولن فعولن""، وهي تتكون من أربع تفعيلات. هذا البحر يتميز بوزنه المتناسق والموسيقي، ويستخدم في الشعر العربي بشكل واسع.

في حالة البحر المتقارب المجزوء، تبقى التفعيلات على ست تفعيلات، كل ثلاث في شطر واحد: ""فعولن فعولن فعولن فعولن"".

إذا كنت بحاجة إلى مزيد من المعلومات حول البحر المتقارب أو أي موضوع آخر يتعلق بالشعر العربي، فلا تتردد في طرح سؤالك وسأكون سعيدًا بمساعدتك. ",تفعيلة البحر المتقارب هي 'فعولن'.,1.0,0.0,,0.8900403750445585
ما هي تفعيلة البحر المتدارك؟,"['العنوان: أوزان البحور\nالمحتوى: ... 1 مقدمة.\n2 البحر الأول:\nبحر الطويل.\nمقدمة:\nأشرنا سابقًا إلى أن الخليل بن أحمد وضع خمسة عشر بحرًا وأن تلميذه الأخفش زاد عليها بحرًا سماه:\nالمتدارك، وبذلك أصبح مجموع البحور ستة عشر بحرًا.\nوبعد هذه البحور كما ذكرنا من قبل تشترك تفعيلاتها في عدد المقاطع بحيث إذا قدمنا مقطعًا متأخرًا أو أخرنا مقطعًا متقدمًا تولد عن ذلك البحر المماثل.\nفالتفعيلة فعولن مثلاً مكونة من وتد مجموع فسبب خفيف، فإذا تكررت ثماني مرات فإنه ينتج عنها بحر المتقارب، أما إذا قدمنا السبب الخفيف على الوتد المجموع في التفعيلة ذاتها فإن فعولن تصبح فاعلن، وهذه إذا تكررت كذلك ثماني مرات فإنه يتولد عنها بحر المتدارك.\n\n', 'العنوان: أوزان البحور\nالمحتوى: وكذلك متفاعلن إذا عكست تصير مفاعلتن وتكوِّن بتكرارها مع تفعيلة من نوع آخر بحرًا يسمى:\nالوافر،\nبينما تكرار متفاعلن ست مرات يولد بحرًا آخر هو:\nالكامل، وهكذا.\nوقد رتب العروضيون بحور الشعر الستة عشر على حسب اشتراك كل مجموعة منها في دائرة عروضية واحدة على الوجه التالي:\n1 الطويل، والمديد، والبسيط.\n2 الوافر، والكامل.\n3 الهزج، والرجز، والرمل.\n4 السريع والمنسرح، والخفيف، والمضارع، والمقتضب، والمجتث.\n5 المتقارب، والمتدارك.\nوهذا الترتيب كما ذكرت هو بحسب اشتراك كل مجموعة من البحور في دائرة عروضية لا بحسب كثرة استعمالها أو قلة استعمالها، وسوف نفصل الكلام عن الدوائر العروضية فيما بعد.\nأجزاء البيت:\nينقسم البيت الشعري إلى قسمين متساويين من حيث النغم والقياس الموسيقي، ويعرف كل قسم بالمصراع تشبيهًا بمصراعي الباب، أو بالشطر،\nفيقال:\nالشطر الأول أو الثاني،\nكما يقال:\nالمصراع الأول أو الثاني من البيت.\nالتفعيلة الأخيرة.\nولما كان للتفعيلة الأخيرة من كل شطر أهمية خاصة فقد انفردت بتسمية خاصة.\n\n', 'العنوان: أوزان البحور\nالمحتوى: فالتفعيلة التي في آخر الشطر من البيت تسمى:\nالعروض -بفتح العين-\nوالتفعيلة التي في آخر الشطر الثاني تسمى:\nالضرب،\nوما عدا ذلك من تفاعيل البيت يسمى:\nالحشو،\nهكذا:\nفعولن مفاعيلن فعولن مفاعلن\nحشو عروض\nفعولن مفاعيلن فعولن مفاعلن\nحشو ضرب\nوكل بحر من بحور الشعر له نظام خاص في التغييرات التي تدخل على الحشو أو على العروض أو على الضرب. وسنوضح ذلك عند الكلام على وزن كل بحر.\n\n', 'العنوان: البحر المتدارك\nالمحتوى: ... واضع هذا البحر هو الأخفش وقد سماه المتدارك بفتح الراء؛ لأنه تداركه على الخليل بن أحمد.\nويتألف المتدارك من ثماني تفاعيل ووزنه هو:\nفاعلن فاعلن فاعلن فاعلن ... فاعلن فاعلن فاعلن فاعلن\nزحاف المتدارك:\nويدخل المتدارك من الزحاف الخبن، وهو هنا حذف الألف الثانية من فاعلن فتصبح التفعيلة فعِلن بتحريك العين.\nكذلك يدخله التشيعث وهو هنا حذف العين من فاعلن فتصبح فالن، وتنقل إلى فعْلن بسكون العين.\nوقلما ترد فاعلن في الحشو صحيحة، والغالب ورودها في الحشو إما مخبونة أو مشعثة.\n\n']"," تفعيلة البحر المتدارك هي ""فاعلن"" وتتكرر ثماني مرات في البيت الشعري. البحر المتدارك يعتبر من البحور الشعرية الستة عشر التي وضعها الخليل بن أحمد والأخفش. يتميز هذا البحر بأنه يتكون من تفعيلتين رئيسيتين هما ""فاعلن"" و""فاعلن""، حيث تتكرر كل منهما أربع مرات في البيت الشعري.

في البحر المتدارك، يمكن أن تحدث تغييرات على التفعيلات من خلال الزحافات والعلل. الزحاف الأكثر شيوعًا في البحر المتدارك هو الخبن، حيث يتم حذف الألف الثانية من التفعيلة ""فاعلن"" لتصبح ""فعِلن"" بتحريك العين. بالإضافة إلى ذلك، يمكن أن يحدث التشعيث، وهو حذف العين من التفعيلة ""فاعلن"" لتصبح ""فالن"" وتنقل إلى ""فعْلن"" بسكون العين.

من الجدير بالذكر أن البحر المتدارك يتميز بمرونته وقابليته للتشكيل والتغيير في التفعيلات، مما يجعله مناسبًا للتعبير عن مجموعة متنوعة من الموضوعات والأفكار في الشعر العربي. ",تفعيلة البحر المتدارك هي 'فاعلن'.,,0.13,0.6111111111111112,0.8916514064213195
ما الفرق بين البحر المتقارب والبحر المتدارك؟,"['العنوان: أوزان البحور\nالمحتوى: ... 1 مقدمة.\n2 البحر الأول:\nبحر الطويل.\nمقدمة:\nأشرنا سابقًا إلى أن الخليل بن أحمد وضع خمسة عشر بحرًا وأن تلميذه الأخفش زاد عليها بحرًا سماه:\nالمتدارك، وبذلك أصبح مجموع البحور ستة عشر بحرًا.\nوبعد هذه البحور كما ذكرنا من قبل تشترك تفعيلاتها في عدد المقاطع بحيث إذا قدمنا مقطعًا متأخرًا أو أخرنا مقطعًا متقدمًا تولد عن ذلك البحر المماثل.\nفالتفعيلة فعولن مثلاً مكونة من وتد مجموع فسبب خفيف، فإذا تكررت ثماني مرات فإنه ينتج عنها بحر المتقارب، أما إذا قدمنا السبب الخفيف على الوتد المجموع في التفعيلة ذاتها فإن فعولن تصبح فاعلن، وهذه إذا تكررت كذلك ثماني مرات فإنه يتولد عنها بحر المتدارك.\n\n', 'العنوان: أوزان البحور\nالمحتوى: وكذلك متفاعلن إذا عكست تصير مفاعلتن وتكوِّن بتكرارها مع تفعيلة من نوع آخر بحرًا يسمى:\nالوافر،\nبينما تكرار متفاعلن ست مرات يولد بحرًا آخر هو:\nالكامل، وهكذا.\nوقد رتب العروضيون بحور الشعر الستة عشر على حسب اشتراك كل مجموعة منها في دائرة عروضية واحدة على الوجه التالي:\n1 الطويل، والمديد، والبسيط.\n2 الوافر، والكامل.\n3 الهزج، والرجز، والرمل.\n4 السريع والمنسرح، والخفيف، والمضارع، والمقتضب، والمجتث.\n5 المتقارب، والمتدارك.\nوهذا الترتيب كما ذكرت هو بحسب اشتراك كل مجموعة من البحور في دائرة عروضية لا بحسب كثرة استعمالها أو قلة استعمالها، وسوف نفصل الكلام عن الدوائر العروضية فيما بعد.\nأجزاء البيت:\nينقسم البيت الشعري إلى قسمين متساويين من حيث النغم والقياس الموسيقي، ويعرف كل قسم بالمصراع تشبيهًا بمصراعي الباب، أو بالشطر،\nفيقال:\nالشطر الأول أو الثاني،\nكما يقال:\nالمصراع الأول أو الثاني من البيت.\nالتفعيلة الأخيرة.\nولما كان للتفعيلة الأخيرة من كل شطر أهمية خاصة فقد انفردت بتسمية خاصة.\n\n', 'العنوان: أوزان البحور\nالمحتوى: فالتفعيلة التي في آخر الشطر من البيت تسمى:\nالعروض -بفتح العين-\nوالتفعيلة التي في آخر الشطر الثاني تسمى:\nالضرب،\nوما عدا ذلك من تفاعيل البيت يسمى:\nالحشو،\nهكذا:\nفعولن مفاعيلن فعولن مفاعلن\nحشو عروض\nفعولن مفاعيلن فعولن مفاعلن\nحشو ضرب\nوكل بحر من بحور الشعر له نظام خاص في التغييرات التي تدخل على الحشو أو على العروض أو على الضرب. وسنوضح ذلك عند الكلام على وزن كل بحر.\n\n', 'العنوان: البحر الطويل\nالمحتوى: ...\nالبحر الأول:\nالطويل\n1 وزنه:\nفعولن مفاعيلن فعولن مفاعيلن\nفعولن مفاعيلن فعولن مفاعيلن.\n2 عروضه:\nعروض هذا البحر، أي تفعيلته التي تقع في آخر الشطر الأول من البيت، لا تستعمل تامة، بل يحذف منها الحرف الخامس، أي الياء الساكنة فتصبح مفاعيلن مفاعلن.\nوحذف الخامس الساكن له في العروض اسم اصطلاحي هو:\nالقبض،\nوتسمى التفعيلة التي وقع فيها القبض:\nمقبوضة.\n3 ضربه:\nوضرب هذا البحر، أي تفعيلته التي تقع في آخر الشطر الثاني من البيت، قد يكون مقبوضًا في قصيدة أو غير مقبوض في أخرى.\nوإذا جاء البيت الأول من القصيدة مقبوض العروض والضرب معًا لزم أن يستمر ذلك في بقية أبياتها.\n\n', 'العنوان: البحر الطويل\nالمحتوى: 4 حشو البيت:\nعرفنا أن الحشو هو جميع تفعيلات البيت ما عدا تفعيلة العروض وتفعيلة الضرب.\nوحشو البيت في بحر الطويل يحدث فيه تغيير اختياري بحذف النون الساكنة من فعولن الأولى أو الثالثة أو الخامسة أو السابعة في ترتيب التفاعيل،\nوبذلك تصبح فعولن فعولُ بلام متحركة أي بحذف الخامس الساكن:\nفتكون مقبوضة أيضًا.\nوهذا التغيير غير لازم، فإذا ورد التغيير في فعولن الأولى فلا يلزم في غيرها من بقية البيت، كما أن قبض فعولن في حشو بيت ما لا يستدعي قبضها في حشو بقية الأبيات.\nويجب التنبيه على أن هناك فرقًا من جهة التسمية بين التغيير الذي يحدث في الحشو، والتغيير الذي يحدث في العروض والضرب.\nفالتغيير الذي يحدث في الحشو يسمى:\nالزحاف،\nأما التغيير الذي يحدث في العروض والضرب فيسمى:\nالعلة، وهو تغيير يلتزم.\nوكما يكون الزحاف والعلة في بحر الطويل يكونان كذلك في غيره من البحور، ولكن ينبغي أن نتذكر أن لكل بحر زحافًا خاصًّا وعلة خاصة.\nعروض الطويل وضربه:\nعروض الطويل تأتي مقبوضة دائمًا.\nأما ضربه فيأتي على ثلاثة أنواع:\n\n', 'العنوان: البحر الطويل\nالمحتوى: 1 مقبوضًا كذلك، أي بحذف الخامس الساكن لتصير مفاعيلن مفاعلن.\n2 أو محذوفًا، أي بحذف السبب الأخير من مفاعيلن لتصير مفاعي وتحول إلى مفاعلْ بسكون اللام تسهيلاً للنطق، أو فعولن.\n3 أو صحيحًا، مفاعيلن.\nوعلى هذا يكون نظام البحر الطويل على الوجه التالي:\n1. --- مفاعلن أ. --- مفاعلن أ\n2. --- مفاعلن أ. --- مفاعل ب\n3. --- مفاعلن أ. --- مفاعيلن جـ\nمثال النوع الأول:\nمن معلقة زهير:\nومن هاب أسباب المنايا ينلنه ... وإن يرق أسباب السماء بسلم\nومن ها بأسبابل منايا ينلنهو\nااه اه ااه اه اه ااه اه ااه ااه\nفعولن مفاعيلن فعولن مفاعلن\nوإن ير قأسبابس سماء بسللمي\nااه اه ااه اه اه ااه اااه ااه\nفعولن مفاعيلن فعولُ مفاعلن\n\n', 'العنوان: البحر الطويل\nالمحتوى: ومن ذلك نلاحظ أن عروض هذا البيت هي:\nمفاعلن، وضربه كذلك.\nوهكذا يسير زهير في جميع أبيات معلقته من أولها إلى آخرها.\nأما حشو البيت فنجد أن إحدى تفعيلاته وهي السابعة فعولن دخلها القبض فحولت إلى فعولُ بتحريك اللام وهذا غير لازم.\nالنوع الثاني:\nوهو ما عروضه مقبوضة وضربه محذوف أي: مفاعلْ بسكون اللام.\nوقد افترض العروضيون أن أصل الضرب مفاعيلن فحذف من التفعيلة الأخيرة، أي تفعيلة الضرب السبب الخفيف من آخرها فصارت مفاعي، ولسهولة النطق بها تحولت إلى مفاعلْ بسكون اللام أي تفعيلة خماسية.\nوهذا الضرب يسمى:\nمحذوفًا؛ لحذف السبب الأخير من تفعيلته.\nومثال هذا النوع قول أبي نواس في مدح الخصيب أمير مصر:\nتقول التي من بيتها خف محملي ... عزيز علينا أن نراك تسير\nأما دون مصر للغني متطلب ... بلى.. إن أسباب الغنى لكثير\nفقلت لها واستعجلتها بوادر ... جرت فجرى في جريهن عبير\nذريني أكثر حاسديك برحلة ... إلى بلد فيه الخصيب أمير\nفتى يشتري حسن الثناء بماله ... ويعلم أن الدائرات تدور\nفما جازه جود ولا حل دونه ... ولكن يسير الجود حيث يسير\n\n', 'العنوان: البحر الطويل\nالمحتوى: فتقطيع البيت الأول هكذا:\nتقولل لتي من بيـ تهاخف فمحملي\nفعولن مفاعيلن فعولن مفاعلن\nعزيزن علينا أن نراك تسيرو\nفعولن مفاعيلن فعولُ مفاعلْ\nفالتفعيلة الأخيرة من الشطر الثاني أي الضرب محذوفة.\nومثال آخر قول مسكين الدارمي عندما أوعز إليه معاوية أن يقترح البيعة من بعده لابنه يزيد؛\nليعلم رأي قومه في ذلك:\nألا ليت شعري ما يقول ابن عامر ... ومروان أم ماذا يقول سعيد؟\nبني خلفاء الله مهلاً فإنما ... يبوّئها الرحمن حيث يريد\nإذا المنبر الغربي خلَّاه ربه ... فإن أمير المؤمنين يزيد\nفتقطيع البيت الأول هكذا:\nألالي تشعري ما يقولب نُعامرن\nفعولن مفاعيلن فعولن مفاعلن\nومروا نُأَ مْ مَاذا يقول سعيدو\nفعولن مفاعيلن فعولُ مفاعلْ\nالنوع الثالث:\nما كان عروضه مقبوضة وضربه صحيحًا أي: مفاعيلن،\nكقول الحطيئة في المدح:\nأولئك قوم إن بنوا أحسنوا البنا ... وإن عاهدوا أوفوا وإن عقدوا شدوا\nوإن كانت النعماء فيهم جزوا بها ... وإن أنعموا لا كدَّروها ولا كدُّوا\nمطاعين في الهيجا مكاشيف للدجى ... بنى لهم آؤباهم.. وبنى الجد\nويعذلني أبناء سعد عليهم ... وما قلت إلا بالذي علمت سعد\n\n', 'العنوان: البحر الطويل\nالمحتوى: فتقطيع البيت الأول هكذا:\nألاء كقومي إن بنو أح سنلبنا\nفعولُ مفاعلين فعولن مفاعلن\nوإن عا هدو أوْفَو وإن ع قدو شددو\nفعولن مفاعلين فعولُ مفاعلين\nفالعروض مقبوضة والضرب هنا صحيح وكذلك في بقية الأبيات الأخرى.\nوالخلاصة:\n1 إن عروض الطويل مفاعلن\n2 أما الضرب فهو:\nمفاعلن، أو مفاعلْ بسكون اللام، أو مفاعيلن.\nفإذا رمزنا إلى العروض بالرمز\n(أ)\nأيضًا كان نظام قصائد الطويل كما يلي:\n1 قصيدة فيها الوضع هكذا:\n---- أ ---أ\n---- أ ---أ\nأي مفاعلن في العرض ومفاعلن في الضرب حتى نهاية القصيدة.\n2 وقصيدة أخرى تكون العروض مفاعلن أي\n(أ)\nوالضرب مفاعل أي\n(ب)\nفيكون نظامها كالآتي:\n--- أ ---ب\n--- أ --- ب حتى نهاية القصيدة.\n\n', 'العنوان: البحر الطويل\nالمحتوى: 3 وقصدة ثالثة تكون العروض مفاعل أي\n(أ)\nوالضرب مفاعيلن أي\n(جـ)\nفيكون نظامها هكذا:\n--- أ ---- جـ.\n--- أ ----جـ حتى نهاية القصيدة.\nوالخطوط الأفقية تمثل حشو البيت.\nالتصريع.\nوالتصريع هو أن يجانس الشاعر بين شطري البيت الواحد في مطلع القصيدة أي يجعل العروض مشبهًا للضرب وزنًا وقافية.\nويحدث في النوع الثاني الذي ضربه\n(مفاعل)\nأي\n(ب)\nوفي النوع الثالث الذي ضربه\n(مفاعيلن)\nأي\n(جـ)\n.\nومثال النوع الثاني مطلع قصيدة في الرثاء لشاعر معاصر:\nأفيقوا وإن جل المصاب أفيقوا ... وصونوا عيونًا للدماء تريق.\nوقولوا هنيئًا للألى وهبوا العلى ... نفوسًا إلى نيل المرام تنوق\nوتقطيع الشطر الأول:\nأفيقو وإن جللل مصاب أفيقو\nفعولن مفاعيلن فعولُ مفاعلْ\n(بسكون اللام)\nوتقطيع الشطر الثاني:\nوصونو عيوننلد دماء تريقو\nفعولن مفاعيلن فعولُ مفاعلْ\n(بسكون اللام)\n\n']"," الفرق بين البحر المتقارب والبحر المتدارك يكمن في تركيبتهما الوزنية وعدد التفعيلات المستخدمة في كل منهما.

1. البحر المتقارب:
   - الوزن: يتكون البحر المتقارب من تفعيلتين أساسيتين هما ""فعولن"" و""فاعلن"". تتكرر هذه التفعيلتين في كل شطر من البيت الشعري.
   - التفعيلة الأخيرة: تتميز التفعيلة الأخيرة في كل شطر بأنها ""فعِل""، حيث يتم حذف الحرف الخامس من التفعيلة ""فعولن"" لتصبح ""فعو"" ومن ثم تتحول إلى ""فعِل"".
   - مثال:
     - البيت الأول:
       فعولن فعولن فعولن فعولن
       فعولن فعولن فعولن فعولن
     - البيت الثاني:
       فعولن فعولن فعولن فعولن
       فعولن فعولن فعولن فعولن

2. البحر المتدارك:
   - الوزن: يتكون البحر المتدارك من تفعيلتين أساسيتين هما ""فاعلن"" و""فعلن"". تتكرر هذه التفعيلتين في كل شطر من البيت الشعري.
   - التفعيلة الأخيرة: تتميز التفعيلة الأخيرة في كل شطر بأنها ""فعلن""، حيث يتم حذف الحرف الثاني من التفعيلة ""فاعلن"" لتصبح ""فعِلن"".
   - مثال:
     - البيت الأول:
       فاعلن فاعلن فاعلن فاعلن
       فاعلن فاعلن فاعلن فاعلن
     - البيت الثاني:
       فاعلن فاعلن فاعلن فاعلن
       فاعلن فاعلن فاعلن فاعلن

في المجمل، يتميز البحر المتقارب بتكرار تفعيلتي ""فعولن"" و""فاعلن"" مع حذف الحرف الخامس من التفعيلة الأخيرة، بينما يتميز البحر المتدارك بتكرار تفعيلتي ""فاعلن"" و""فعلن"" مع حذف الحرف الثاني من التفعيلة الأخيرة. ",البحر المتقارب يتكون من 'فعولن'، بينما البحر المتدارك يتكون من 'فاعلن'.,,0.17,,0.8948465202596027
ما هو الفرق بين العروض والضرب في البيت الشعري؟,"['العنوان: أوزان البحور\nالمحتوى: ... 1 مقدمة.\n2 البحر الأول:\nبحر الطويل.\nمقدمة:\nأشرنا سابقًا إلى أن الخليل بن أحمد وضع خمسة عشر بحرًا وأن تلميذه الأخفش زاد عليها بحرًا سماه:\nالمتدارك، وبذلك أصبح مجموع البحور ستة عشر بحرًا.\nوبعد هذه البحور كما ذكرنا من قبل تشترك تفعيلاتها في عدد المقاطع بحيث إذا قدمنا مقطعًا متأخرًا أو أخرنا مقطعًا متقدمًا تولد عن ذلك البحر المماثل.\nفالتفعيلة فعولن مثلاً مكونة من وتد مجموع فسبب خفيف، فإذا تكررت ثماني مرات فإنه ينتج عنها بحر المتقارب، أما إذا قدمنا السبب الخفيف على الوتد المجموع في التفعيلة ذاتها فإن فعولن تصبح فاعلن، وهذه إذا تكررت كذلك ثماني مرات فإنه يتولد عنها بحر المتدارك.\n\n', 'العنوان: أوزان البحور\nالمحتوى: وكذلك متفاعلن إذا عكست تصير مفاعلتن وتكوِّن بتكرارها مع تفعيلة من نوع آخر بحرًا يسمى:\nالوافر،\nبينما تكرار متفاعلن ست مرات يولد بحرًا آخر هو:\nالكامل، وهكذا.\nوقد رتب العروضيون بحور الشعر الستة عشر على حسب اشتراك كل مجموعة منها في دائرة عروضية واحدة على الوجه التالي:\n1 الطويل، والمديد، والبسيط.\n2 الوافر، والكامل.\n3 الهزج، والرجز، والرمل.\n4 السريع والمنسرح، والخفيف، والمضارع، والمقتضب، والمجتث.\n5 المتقارب، والمتدارك.\nوهذا الترتيب كما ذكرت هو بحسب اشتراك كل مجموعة من البحور في دائرة عروضية لا بحسب كثرة استعمالها أو قلة استعمالها، وسوف نفصل الكلام عن الدوائر العروضية فيما بعد.\nأجزاء البيت:\nينقسم البيت الشعري إلى قسمين متساويين من حيث النغم والقياس الموسيقي، ويعرف كل قسم بالمصراع تشبيهًا بمصراعي الباب، أو بالشطر،\nفيقال:\nالشطر الأول أو الثاني،\nكما يقال:\nالمصراع الأول أو الثاني من البيت.\nالتفعيلة الأخيرة.\nولما كان للتفعيلة الأخيرة من كل شطر أهمية خاصة فقد انفردت بتسمية خاصة.\n\n', 'العنوان: أوزان البحور\nالمحتوى: فالتفعيلة التي في آخر الشطر من البيت تسمى:\nالعروض -بفتح العين-\nوالتفعيلة التي في آخر الشطر الثاني تسمى:\nالضرب،\nوما عدا ذلك من تفاعيل البيت يسمى:\nالحشو،\nهكذا:\nفعولن مفاعيلن فعولن مفاعلن\nحشو عروض\nفعولن مفاعيلن فعولن مفاعلن\nحشو ضرب\nوكل بحر من بحور الشعر له نظام خاص في التغييرات التي تدخل على الحشو أو على العروض أو على الضرب. وسنوضح ذلك عند الكلام على وزن كل بحر.\n\n', 'العنوان: البحر الطويل\nالمحتوى: ...\nالبحر الأول:\nالطويل\n1 وزنه:\nفعولن مفاعيلن فعولن مفاعيلن\nفعولن مفاعيلن فعولن مفاعيلن.\n2 عروضه:\nعروض هذا البحر، أي تفعيلته التي تقع في آخر الشطر الأول من البيت، لا تستعمل تامة، بل يحذف منها الحرف الخامس، أي الياء الساكنة فتصبح مفاعيلن مفاعلن.\nوحذف الخامس الساكن له في العروض اسم اصطلاحي هو:\nالقبض،\nوتسمى التفعيلة التي وقع فيها القبض:\nمقبوضة.\n3 ضربه:\nوضرب هذا البحر، أي تفعيلته التي تقع في آخر الشطر الثاني من البيت، قد يكون مقبوضًا في قصيدة أو غير مقبوض في أخرى.\nوإذا جاء البيت الأول من القصيدة مقبوض العروض والضرب معًا لزم أن يستمر ذلك في بقية أبياتها.\n\n', 'العنوان: البحر الطويل\nالمحتوى: 4 حشو البيت:\nعرفنا أن الحشو هو جميع تفعيلات البيت ما عدا تفعيلة العروض وتفعيلة الضرب.\nوحشو البيت في بحر الطويل يحدث فيه تغيير اختياري بحذف النون الساكنة من فعولن الأولى أو الثالثة أو الخامسة أو السابعة في ترتيب التفاعيل،\nوبذلك تصبح فعولن فعولُ بلام متحركة أي بحذف الخامس الساكن:\nفتكون مقبوضة أيضًا.\nوهذا التغيير غير لازم، فإذا ورد التغيير في فعولن الأولى فلا يلزم في غيرها من بقية البيت، كما أن قبض فعولن في حشو بيت ما لا يستدعي قبضها في حشو بقية الأبيات.\nويجب التنبيه على أن هناك فرقًا من جهة التسمية بين التغيير الذي يحدث في الحشو، والتغيير الذي يحدث في العروض والضرب.\nفالتغيير الذي يحدث في الحشو يسمى:\nالزحاف،\nأما التغيير الذي يحدث في العروض والضرب فيسمى:\nالعلة، وهو تغيير يلتزم.\nوكما يكون الزحاف والعلة في بحر الطويل يكونان كذلك في غيره من البحور، ولكن ينبغي أن نتذكر أن لكل بحر زحافًا خاصًّا وعلة خاصة.\nعروض الطويل وضربه:\nعروض الطويل تأتي مقبوضة دائمًا.\nأما ضربه فيأتي على ثلاثة أنواع:\n\n', 'العنوان: البحر الطويل\nالمحتوى: 1 مقبوضًا كذلك، أي بحذف الخامس الساكن لتصير مفاعيلن مفاعلن.\n2 أو محذوفًا، أي بحذف السبب الأخير من مفاعيلن لتصير مفاعي وتحول إلى مفاعلْ بسكون اللام تسهيلاً للنطق، أو فعولن.\n3 أو صحيحًا، مفاعيلن.\nوعلى هذا يكون نظام البحر الطويل على الوجه التالي:\n1. --- مفاعلن أ. --- مفاعلن أ\n2. --- مفاعلن أ. --- مفاعل ب\n3. --- مفاعلن أ. --- مفاعيلن جـ\nمثال النوع الأول:\nمن معلقة زهير:\nومن هاب أسباب المنايا ينلنه ... وإن يرق أسباب السماء بسلم\nومن ها بأسبابل منايا ينلنهو\nااه اه ااه اه اه ااه اه ااه ااه\nفعولن مفاعيلن فعولن مفاعلن\nوإن ير قأسبابس سماء بسللمي\nااه اه ااه اه اه ااه اااه ااه\nفعولن مفاعيلن فعولُ مفاعلن\n\n', 'العنوان: البحر الطويل\nالمحتوى: ومن ذلك نلاحظ أن عروض هذا البيت هي:\nمفاعلن، وضربه كذلك.\nوهكذا يسير زهير في جميع أبيات معلقته من أولها إلى آخرها.\nأما حشو البيت فنجد أن إحدى تفعيلاته وهي السابعة فعولن دخلها القبض فحولت إلى فعولُ بتحريك اللام وهذا غير لازم.\nالنوع الثاني:\nوهو ما عروضه مقبوضة وضربه محذوف أي: مفاعلْ بسكون اللام.\nوقد افترض العروضيون أن أصل الضرب مفاعيلن فحذف من التفعيلة الأخيرة، أي تفعيلة الضرب السبب الخفيف من آخرها فصارت مفاعي، ولسهولة النطق بها تحولت إلى مفاعلْ بسكون اللام أي تفعيلة خماسية.\nوهذا الضرب يسمى:\nمحذوفًا؛ لحذف السبب الأخير من تفعيلته.\nومثال هذا النوع قول أبي نواس في مدح الخصيب أمير مصر:\nتقول التي من بيتها خف محملي ... عزيز علينا أن نراك تسير\nأما دون مصر للغني متطلب ... بلى.. إن أسباب الغنى لكثير\nفقلت لها واستعجلتها بوادر ... جرت فجرى في جريهن عبير\nذريني أكثر حاسديك برحلة ... إلى بلد فيه الخصيب أمير\nفتى يشتري حسن الثناء بماله ... ويعلم أن الدائرات تدور\nفما جازه جود ولا حل دونه ... ولكن يسير الجود حيث يسير\n\n', 'العنوان: البحر الطويل\nالمحتوى: فتقطيع البيت الأول هكذا:\nتقولل لتي من بيـ تهاخف فمحملي\nفعولن مفاعيلن فعولن مفاعلن\nعزيزن علينا أن نراك تسيرو\nفعولن مفاعيلن فعولُ مفاعلْ\nفالتفعيلة الأخيرة من الشطر الثاني أي الضرب محذوفة.\nومثال آخر قول مسكين الدارمي عندما أوعز إليه معاوية أن يقترح البيعة من بعده لابنه يزيد؛\nليعلم رأي قومه في ذلك:\nألا ليت شعري ما يقول ابن عامر ... ومروان أم ماذا يقول سعيد؟\nبني خلفاء الله مهلاً فإنما ... يبوّئها الرحمن حيث يريد\nإذا المنبر الغربي خلَّاه ربه ... فإن أمير المؤمنين يزيد\nفتقطيع البيت الأول هكذا:\nألالي تشعري ما يقولب نُعامرن\nفعولن مفاعيلن فعولن مفاعلن\nومروا نُأَ مْ مَاذا يقول سعيدو\nفعولن مفاعيلن فعولُ مفاعلْ\nالنوع الثالث:\nما كان عروضه مقبوضة وضربه صحيحًا أي: مفاعيلن،\nكقول الحطيئة في المدح:\nأولئك قوم إن بنوا أحسنوا البنا ... وإن عاهدوا أوفوا وإن عقدوا شدوا\nوإن كانت النعماء فيهم جزوا بها ... وإن أنعموا لا كدَّروها ولا كدُّوا\nمطاعين في الهيجا مكاشيف للدجى ... بنى لهم آؤباهم.. وبنى الجد\nويعذلني أبناء سعد عليهم ... وما قلت إلا بالذي علمت سعد\n\n', 'العنوان: البحر الطويل\nالمحتوى: فتقطيع البيت الأول هكذا:\nألاء كقومي إن بنو أح سنلبنا\nفعولُ مفاعلين فعولن مفاعلن\nوإن عا هدو أوْفَو وإن ع قدو شددو\nفعولن مفاعلين فعولُ مفاعلين\nفالعروض مقبوضة والضرب هنا صحيح وكذلك في بقية الأبيات الأخرى.\nوالخلاصة:\n1 إن عروض الطويل مفاعلن\n2 أما الضرب فهو:\nمفاعلن، أو مفاعلْ بسكون اللام، أو مفاعيلن.\nفإذا رمزنا إلى العروض بالرمز\n(أ)\nأيضًا كان نظام قصائد الطويل كما يلي:\n1 قصيدة فيها الوضع هكذا:\n---- أ ---أ\n---- أ ---أ\nأي مفاعلن في العرض ومفاعلن في الضرب حتى نهاية القصيدة.\n2 وقصيدة أخرى تكون العروض مفاعلن أي\n(أ)\nوالضرب مفاعل أي\n(ب)\nفيكون نظامها كالآتي:\n--- أ ---ب\n--- أ --- ب حتى نهاية القصيدة.\n\n', 'العنوان: البحر الطويل\nالمحتوى: 3 وقصدة ثالثة تكون العروض مفاعل أي\n(أ)\nوالضرب مفاعيلن أي\n(جـ)\nفيكون نظامها هكذا:\n--- أ ---- جـ.\n--- أ ----جـ حتى نهاية القصيدة.\nوالخطوط الأفقية تمثل حشو البيت.\nالتصريع.\nوالتصريع هو أن يجانس الشاعر بين شطري البيت الواحد في مطلع القصيدة أي يجعل العروض مشبهًا للضرب وزنًا وقافية.\nويحدث في النوع الثاني الذي ضربه\n(مفاعل)\nأي\n(ب)\nوفي النوع الثالث الذي ضربه\n(مفاعيلن)\nأي\n(جـ)\n.\nومثال النوع الثاني مطلع قصيدة في الرثاء لشاعر معاصر:\nأفيقوا وإن جل المصاب أفيقوا ... وصونوا عيونًا للدماء تريق.\nوقولوا هنيئًا للألى وهبوا العلى ... نفوسًا إلى نيل المرام تنوق\nوتقطيع الشطر الأول:\nأفيقو وإن جللل مصاب أفيقو\nفعولن مفاعيلن فعولُ مفاعلْ\n(بسكون اللام)\nوتقطيع الشطر الثاني:\nوصونو عيوننلد دماء تريقو\nفعولن مفاعيلن فعولُ مفاعلْ\n(بسكون اللام)\n\n']"," الفرق بين العروض والضرب في البيت الشعري يتعلق بمفهومين أساسيين في علم العروض والقافية.

1. العروض: العروض هي التفعيلة الأخيرة من الشطر الأول في البيت الشعري. تعتبر العروض أساساً لتحديد وزن البيت الشعري وتسمى أيضاً ""المصراع الأول"" أو ""الشطر الأول"". لا تتغير العروض في القصيدة إلا إذا كانت القصيدة من نوع ""المخلع"" حيث تتغير العروض في الشطر الثاني.

2. الضرب: الضرب هو التفعيلة الأخيرة من الشطر الثاني في البيت الشعري. يعتبر الضرب أساساً لتحديد وزن البيت الشعري ويسمى أيضاً ""المصراع الثاني"" أو ""الشطر الثاني"". يمكن أن يتغير الضرب في القصيدة بناءً على قواعد العروض والقافية.

في الشعر العربي، يتم تحديد وزن البيت الشعري بناءً على تكرار التفعيلات المتشابهة في العروض والضرب. على سبيل المثال، في البحر الطويل، تتكون العروض والضرب من تفعيلتين متشابهتين (فعولن مفاعيلن) وتتكرر هذه التفعيلات في جميع أبيات القصيدة.

إذاً، الفرق بين العروض والضرب يكمن في موقعهما داخل البيت الشعري ودورهما في تحديد وزن القصيدة وتكرارها. ",العروض هي التفعيلة الأخيرة من الشطر الأول، والضرب هو التفعيلة الأخيرة من الشطر الثاني.,,0.35,,0.8775790066537338
ما هي الزحافات والعلل في علم العروض؟,"['العنوان: أوزان البحور\nالمحتوى: ... 1 مقدمة.\n2 البحر الأول:\nبحر الطويل.\nمقدمة:\nأشرنا سابقًا إلى أن الخليل بن أحمد وضع خمسة عشر بحرًا وأن تلميذه الأخفش زاد عليها بحرًا سماه:\nالمتدارك، وبذلك أصبح مجموع البحور ستة عشر بحرًا.\nوبعد هذه البحور كما ذكرنا من قبل تشترك تفعيلاتها في عدد المقاطع بحيث إذا قدمنا مقطعًا متأخرًا أو أخرنا مقطعًا متقدمًا تولد عن ذلك البحر المماثل.\nفالتفعيلة فعولن مثلاً مكونة من وتد مجموع فسبب خفيف، فإذا تكررت ثماني مرات فإنه ينتج عنها بحر المتقارب، أما إذا قدمنا السبب الخفيف على الوتد المجموع في التفعيلة ذاتها فإن فعولن تصبح فاعلن، وهذه إذا تكررت كذلك ثماني مرات فإنه يتولد عنها بحر المتدارك.\n\n', 'العنوان: أوزان البحور\nالمحتوى: وكذلك متفاعلن إذا عكست تصير مفاعلتن وتكوِّن بتكرارها مع تفعيلة من نوع آخر بحرًا يسمى:\nالوافر،\nبينما تكرار متفاعلن ست مرات يولد بحرًا آخر هو:\nالكامل، وهكذا.\nوقد رتب العروضيون بحور الشعر الستة عشر على حسب اشتراك كل مجموعة منها في دائرة عروضية واحدة على الوجه التالي:\n1 الطويل، والمديد، والبسيط.\n2 الوافر، والكامل.\n3 الهزج، والرجز، والرمل.\n4 السريع والمنسرح، والخفيف، والمضارع، والمقتضب، والمجتث.\n5 المتقارب، والمتدارك.\nوهذا الترتيب كما ذكرت هو بحسب اشتراك كل مجموعة من البحور في دائرة عروضية لا بحسب كثرة استعمالها أو قلة استعمالها، وسوف نفصل الكلام عن الدوائر العروضية فيما بعد.\nأجزاء البيت:\nينقسم البيت الشعري إلى قسمين متساويين من حيث النغم والقياس الموسيقي، ويعرف كل قسم بالمصراع تشبيهًا بمصراعي الباب، أو بالشطر،\nفيقال:\nالشطر الأول أو الثاني،\nكما يقال:\nالمصراع الأول أو الثاني من البيت.\nالتفعيلة الأخيرة.\nولما كان للتفعيلة الأخيرة من كل شطر أهمية خاصة فقد انفردت بتسمية خاصة.\n\n', 'العنوان: أوزان البحور\nالمحتوى: فالتفعيلة التي في آخر الشطر من البيت تسمى:\nالعروض -بفتح العين-\nوالتفعيلة التي في آخر الشطر الثاني تسمى:\nالضرب،\nوما عدا ذلك من تفاعيل البيت يسمى:\nالحشو،\nهكذا:\nفعولن مفاعيلن فعولن مفاعلن\nحشو عروض\nفعولن مفاعيلن فعولن مفاعلن\nحشو ضرب\nوكل بحر من بحور الشعر له نظام خاص في التغييرات التي تدخل على الحشو أو على العروض أو على الضرب. وسنوضح ذلك عند الكلام على وزن كل بحر.\n\n']"," في علم العروض، الزحافات والعلل هي تغييرات تطرأ على التفعيلات الشعرية داخل البيت الشعري. الزحافات هي تغييرات مؤقتة تحدث في التفعيلات ولا تؤثر على الوزن الشعري بشكل كبير، بينما العلل هي تغييرات أكثر تأثيرًا وقد تؤدي إلى تغيير الوزن الشعري.

الزحافات تشمل:
1. الخبن: حذف الثاني الساكن من التفعيلة (مثل: فاعلن تصبح فعلن).
2. الطي: حذف الرابع الساكن من التفعيلة (مثل: مستفعلن تصبح مستعلن).
3. الإضمار: تسكين الثاني المتحرك من التفعيلة (مثل: متفاعلن تصبح متفاعلن).
4. الوقص: حذف الثاني المتحرك من التفعيلة (مثل: متفاعلن تصبح مفاعلن).
5. العصب: تسكين الخامس المتحرك من التفعيلة (مثل: مفاعيلن تصبح مفاعيل).

العلل تشمل:
1. الحذف: حذف السبب الخفيف من آخر التفعيلة (مثل: فعولن تصبح فعو).
2. القصر: حذف ساكن السبب الخفيف وتسكين متحركه (مثل: فعولن تصبح فعول).
3. البتر: حذف السبب الخفيف وتسكين متحركه (مثل: فاعلن تصبح فاعل).
4. القطع: حذف ساكن الوتد المجموع وتسكين متحركه (مثل: فاعلن تصبح فاعل).
5. التشعيث: حذف أحد متحركي الوتد المجموع (مثل: فاعلاتن تصبح فاعلات).

هذه الزحافات والعلل تستخدم لإضفاء جمالية وتنوع على الأبيات الشعرية وتسمح للشعراء بالتعبير عن أفكارهم بطرق مختلفة. ",الزحافات هي تغييرات جزئية في التفعيلات، والعلل تغييرات كلية تؤثر على التفعيلة.,0.0,0.33,0.0,0.8896765756304573
كيف يساعد علم العروض على تحسين جودة الشعر؟,"['العنوان: مقدمة\nالمحتوى: بسم الله الرحمن الرحيم هذه محاضرات في علم العروض والقافية ألقيتها على طلبة الصف الأول بقسم اللغة العربية في جامعة بيروت العربية.\nوقد حاولت جهدي عرض قضايا هذا العلم على نحو ييسر على دارسيه تفهمه والإلمام بأهم مصطلحاته وجوانبه التي لها أثر في موسيقي الشعر.\nولما كان تمثل الدارس للجانب النظري من هذا العلم لا يتم إلا إذا كان معززًا بالجانب التطبيقي، فقد أكثرت من الأمثلة والشواهد المختارة من قديم الشعر وحديثه.\nوعسى أن يجد القارئ في هذا الجهد المتواضع عونًا له على إدراك موسيقى الشعر ممثلة في أوزانه وقوافيه وكل ما يتصل بهما.\nالمؤلف\n\n', 'العنوان: تمهيد\nالمحتوى: 1 العروض والخليل بن أحمد:\nالعروض:\n""علم يُبْحث فيه عن أحوال الأوزان المعتبرة""\n1 أو\n""هو ميزان الشعر، به يعرف مكسوره من موزونه، كما أن النحو معيار الكلام به يعرف معربه من ملحونه""\n2.\nويرجع رجال التراجم الفضل في نشأة علم العروض إلى الخليل بن أحمد، أحد أئمة اللغة والأدب في القرن الثاني الهجري، فابن خلكان يذكر أن الخليل كان إمامًا في علم النحو، وأنه هو الذي استنبط علم العروض وأخرجه إلى الوجود وحصر أقسامه في خمس دوائر يستخرج منها خمسة عشر بحرًا، ثم زاد الأخفش بحرًا واحدًا وسماه الخبب، كما يذكر أن الخليل كان له معرفة بالإيقاع والنغم، وتلك المعرفة أحدثت له علم العروض، فإنهما متقاربان في المأخذ 3\n\n', 'العنوان: تمهيد\nالمحتوى: ويحدثنا ياقوت عن الخليل بن أحمد بأنه أول من استخرج العروض وضبط اللغة وحصر أشعار العرب، وأن معرفته بالإيقاع -بناء ألحان الغناء على موقعها وميزانها- هي التي أحدثت له علم العروض1.\nكذلك يحدثنا القفطيّ عن الخليل بأنه سيد الأدباء في علمه وزهده، وأنه نحويّ لغويّ عروضيّ، استنبط من العروض وعلله ما لم يستخرجه أحد، ولم يسبقه إلى علمه سابق من العلماء كلهم2.\nوروى ابن خلكان عن حمزة بن الحسن الأصفهاني نقلاً عن كتابه التنبيه على حدوث التصحيف.\nقوله:\nإن دولة الإسلام لم تخرج أبدع للعلوم التي لم يكن لها عند العرب أصول من الخليل، وليس على ذلك برهان أوضح من علم العروض الذي لا عن حكيم أخذه، ولا على مثال تقدمه احتذاه، وإنما اخترعه من ممر له بالصفارين، من وقع مطرقة على طست.\nمن ذلك يرى أن الخليل هو أول مبتكر لعلم العروض وحصر كل أشعار العرب في بحوره. ولم تقف عقليته المبتكرة عند هذا الحد، وإنما تجاوزته إلى ابتكار علوم أخرى، فهو أول مبتكر لفكرة المعاجم العربية بوضعه معجم العين، الذي يحصر لغة أمة من الأمم قاطبة، وهو الذي وضع أساس علم النحو باستخراج مسائله وتعليله، وإمداده سيبويه من علم النحو بما صنف منه كتابه الذي هو زينة لدولة الإسلام كما يذكر القفطيّ، ثم هو الذي اخترع علم الموسيقى العربية وجمع فيه أصناف النغم.\nولكن لا ينبغي أن يفهم من وضع الخليل لعلم العروض أن العرب لم تكن\n\n', 'العنوان: تمهيد\nالمحتوى: تعرف أوزان الشعر من قبل، فالواقع أنهم كانوا قبل وضع علم العروض على علم بأوزان الشعر العربي وبحوره على تباينها، وإن لم تكن تعرفها بالأسماء التي وضعها الخليل لها فيما بعد. وما أشبه علمها بذلك بعلمها بالإعراب في الكلام حين كانوا عن سليقة يرفعون أو ينصبون أو يجرون ما حقه الرفع أو النصب أو الجر دون علم بما وضعه النحاة فيما بعد من مصطلحات الإعراب وقواعده.\nكذلك كانوا بذوقهم وسيلقتهم يدركون ما يعتور الأوزان المختلفة من زحافات وعلل وإن لم يعطوها أسماء ومصطلحات خاصة كما فعل العروضيون.\nوإذا كان الخليل بن أحمد غير مسبوق في وضع علم العروض، فإن أبا عمرو بن العلاء قد سبقه في الكلام عن القوافي وقواعدها ووضع لها أسماء ومصطلحات خاصة.\nوالرواة مختلفون بشأن الباعث الذي دعا الخليل إلى التفكير في علم العروض ووضع قواعده.\nفمن قائل:\nإنه دعا بمكة أن يرزقه الله علمًا لم يسبقه إليه أحد ولا يؤخذ إلا عنه، فرجع من حجه، ففتح عليه بعلم العروض1.\nومن قائل:\nإن الدافع هو إشفاقه من اتجاه بعض شعراء عصره إلى نظم الشعر على أوزان لم يعرفها العرب ولم تسمع عنهم؛ ولهذا راح يقضي الساعات والأيام يوقع بأصابعه ويحركها حتى حصر أوزان الشعر العربي وضبط أحوال قوافيه.\nومن قائل:\nإنه وجد نفسه وهو بمكة يعيش في بيئة يشيع فيها الغناء فدفعه ذلك إلى التفكير في الوزن الشعري وما يمكن أن يخضع له من قواعد\n\n', 'العنوان: تمهيد\nالمحتوى: وأصول. وقد عكف أيامًا وليالي يستعرض فيها ما روي من أشعار ذات أنغام موسيقية متعددة،\nثم خرج على الناس بقواعد مضبوطة وأصول محكمة سماها:\nعلم العروض.\nوأيًّا كان الدافع فالثابت أن الخليل هو واضع أصول علم العروض وقوانينه التي لم يطرأ تغيير جوهري عليها، وأن الناس ظلوا حتى اليوم يتدارسونها ويتفهمونها من غير أن يزيد عليها أحد شيئًا. فلا تزال الوحدات القياسية للأوزان هي التفعيلات التي اخترعها الخليل، ولا تزال المقاطع الصوتية التي تتألف منها التفعيلات هي الأسباب والأوتاد، كما أن عدد البحور لا يزال ثابتًا عند البحور الخمسة عشر التي وضعها الخليل وبحر الخبب أو المتدارك الذي وضعه تلميذه الأخفش الأوسط أبو الحسن سعيد بن مسعدة، ولا يرد علينا هنا بما استحدث من أوزان في العصر العباسي؛ لأن هذه يمكن إرجاع أصولها إلى أوزان الخليل.\nوتجدر الإشارة إلى أن هناك فارقًا ملحوظًا بين علم العروض وعلوم العربية الأخرى من حيث النشأة. فعلوم النحو والصرف والبلاغة واللغة مثلاً قد استحدثت ثم أخذت تنمو جيلاً بعد جيل وعصرًا بعد عصر حتى بلغت ذروة اكتمالها، أما العروض فقد أخرجه الخليل علمًا يكاد يكون متكاملاً، ولعل ذلك هو السر في أن من أتى بعد الخليل من العروضيين لم يستطيعوا أن يزيدوا على عروضه أي زيادة تذكر أو تمس الجوهر.\nوكما اختلفت الآراء بالنسبة إلى الباعث الذي دعا الخليل إلى التفكير في علم العروض، اختلفت كذلك بالنسبة إلى سبب تسمية هذا العلم بالعروض.\nفمن قائل:\nإن من معاني العروض مكة لاعتراضها وسط البلاد، ومن ثم أطلق الخليل على علم ميزان الشعر الذي اخترعه اسم المكان الذي ألهم فيه قواعده وأصوله.\n\n', 'العنوان: تمهيد\nالمحتوى: ومن قائل:\nإنه سمي عروضًا باسم عمان التي كان يقيم فيها واضعه ومخترعه الخليل بن أحمد. ويذكر صاحب لسان العرب أنه سمي عروضًا؛ لأن الشعر يعرض عليه،\nأي:\nيوزن بواسطته.\n2 الحاجة إلى علم العروض:\nعرفنا مما سبق أن العروض هو علم ميزان الشعر أو موسيقى الشعر، وهو علم له قواعده وأصوله ونظرياته التي تحصل وتكتسب بالتعلم، وإذا كان الشعر من الناحية العملية هو الجانب التطبيقي لقواعد العروض وأصوله ونظرياته، فإنه قبل ذلك فن كسائر الفنون مصدره الموهبة والاستعداد.\nوقد يستطيع الشاعر الموهوب بما له من أذن موسيقية وحس وذوق مرهفين أن يقول الشعر دون علم بالعروض وحاجة إلى قوانينه، ولكنه مع ذلك يظل بحاجة إلى دراسة علم العروض والإلمام بأصوله.\nفأذن الشاعر الموسيقية -مهما كانت درجة رهافتها وحساسيتها- قد تخذل صاحبها أحيانًا في التمييز بين الأوزان المتقاربة أو بين قافية سليمة وأخرى معيبة، أو بين زحاف جائز وآخر غير جائز.\nوجهل الشاعر الموهوب بأوزان الشعر وبحوره المختلفة من تامة ومجزوءة ومشطورة ومنهوكة قد يحصر شعره في بعض أوزان خاصة، وبذلك يحرم نفسه من العزف على أوتار شتى تجعل شعره منوع الأنغام والألحان من ذلك تتجلى أهمية دراسة الشاعر للعروض والإلمام بقوانينه وأصوله.\nوإذا كان العروض إلى هذا القدر لازمًا للشاعر الملهم الموهوب، فإنه يكون أشد لزومًا لغيره. فهو أشد لزومًا لطلاب اللغة والتخصص فيها؛ لأنه يعينهم على فهم الشعر العربي وقراءته قراءة صحيحة والتمييز بين سليمه ومختله وزنًا.\n\n', 'العنوان: تمهيد\nالمحتوى: وهو كذلك أشد لزومًا للدارسين والمتخصصين في فروع الثقافة العربية من تاريخ واجتماع وأدب وبلاغة ومذاهب دينية أو عقلية. فالباحثون في أمثال هذه العلوم العربية لا غنى لهم عن تفهم ما يرد من شعر في المراجع والكتب المختصة بهذه العلوم. وفهم أولئك للشعر متوقف على صحة قراءته، وهذه لا تتأتى إلا لمن لديه القدرة على معرفة صحيح الأوزان والتمييز بين أنواعها المختلفة.\nمن أجل ذلك كله ندرك ضرورة الإلمام بعلم العروض أو علم موسيقى الشعر وأصوله، لا بالنسبة للشعراء فحسب، ولكن بالنسبة أيضًا لذوي التخصص في علوم العربية. وإذا جاز أن يغتفر لغير متخصص ألا يقيم وزن الشعر وألا يقرأه قراءة صحيحة، فإن ذلك لا يمكن أن يغتفر مطلقًا للمتخصص.\n3 الصلة بين العروض والموسيقى:\nعرفنا أن العروض هو علم موسيقى الشعر، وعلى ذلك يكون هناك صلة تجمع بينه وبين الموسيقى بصفة عامة، وهذه الصلة تتمثل في الجانب الصوتي.\nفالموسيقى تقوم على تقسيم الجمل إلى مقاطع صوتية تختلف طولاً وقصرًا، أو إلى وحدات صوتية معينة على نسق معين، بغض النظر عن بداية الكلمات ونهايتها.\nوكذلك شأن العروض، فالبيت من الشعر يقسم إلى وحدات صوتية معينة، أو إلى مقاطع صوتية تعرف بالتفاعيل بقطع النظر عن بداية الكلمات ونهايتها. فقد ينتهي المقطع الصوتي أو التفعيلة في آخر كلمة، وقد ينتهي في وسطها، وقد يبدأ من نهاية كلمة وينتهي ببدء الكلمة التي تليها.\nوهاكم مثالاً على ذلك:\nلا تسألي القوم ما مالي وما حسبي ... وسائلي للقوم ما حزمي وما خلقي\n\n', 'العنوان: تمهيد\nالمحتوى: فتقطيع هذا البيت أو تقسيمه إلى وحدات صوتية أو تفاعيل يكون كالآتي:\nلا تَسْأَلِلْ قَومَ مَا مَالِي َمَاحَسَبِي ... مستفعلن فاعلن مستفعلن فعلن\nوَسَائِلِلْ قَومَ ما حَزْمِي وَمَا خُلُقِي ... متفعلن فاعلن مستفعلن فعلن\nولكن تقطيع البيت أو تقسيمه إلى وحدات صوتية أو تفاعيل لا يتحقق إلا إذا كتب الشعر كتابة عروضية فما الكتابة العروضية؟\n4 الكتابة العروضية.\nأوضحنا فيما سبق الصلة الوثيقة التي بين العروض والموسيقى، وهي صلة الفرع المتولد من الأصل، فالعروض في الحقيقة أمره ليس إلا ضربًا من الموسيقى اختص بالشعر على أنه مقوم من مقوماته.\nوإذا كان للموسيقى عند كتابتها رموز خاصة يدل بها على الأنغام المختلفة، فإن للعروض كذلك رموزًا خاصة به في الكتابة تخالف الكتابة الإملائية التي تكون على حسب قواعد الإملاء المتعارف عليها. وهذه الرموز العروضية يدل بها على التفاعيل التي هي بمثابة أنغام الموسيقي المختلفة.\nوالكتابة العروضية تقوم على أمرين أساسيين هما:\n1 ما ينطق يكتب.\n2 ما لا ينطق لا يكتب.\nوتحقيق هذين الأمرين عند الكتابة العروضية يستلزم زيادة بعض أحرف\n\n', 'العنوان: تمهيد\nالمحتوى: لا تكتب إملائيًا وحذف بعض أحرف تكتب إملائيًا.\nوفيما يلي تفصيل للأحرف التي تزاد أوتحذف في الكتابة العروضية:\nأ-\nالحروف التي تزاد:\nتزاد في الكتابة العروضية ستة أحرف هي:\n1 إذا كان الحرف مشددًا فك التشديد ورسم الحرف أو كتب مرتين:\nمرة ساكنًا ومرة متحركًا،\nنحو:\nرق، وعد، وهز،\nفتكتب عروضيًّا:\nرقق، وعدد، وهزز.\n2 إذا كان الحرف منونًا كتب التنوين نونًا،\nنحو:\nجبل، وشجر، وأسد،\nفتكتب عروضيًّا:\nجبلن، وشجرن، وأسدن، رفعًا ونصبًا وجرًّا.\n3 تزاد ألف في بعض أسماء الإشارة،\nنحو:\nهذا، وهذه، وهذان، وهذين، وهؤلاء، وذلك،\nفتكتب عروضيًّا:\nهاذا، وهاذه، وهاذان، وهاذين، وهاؤلاء، وذالك. كذلك تزاد ألف في لفظ الجلالة، وفي لكن المخففة والمشددة،\nفهذه الكلمات:\nالله، ولكن، ولكن،\nتكتب عروضيًّا هكذا:\nاللاه، ولاكن، ولاكنن.\n4 تزاد واو في بعض الأسماء كما في:\nداود، وطاوس، وناوس،\nفتكتب عروضيًّا:\nداوود، وطاووس، وناووس.\n5 تكتب حركة حرف القافية حرفًا مجانسًا للحركة، فإذا كانت حركة حرف القافية ضمة كتبت هذه الضمة عروضيًّا واوًا، وإذا كانت كسرة كتبت ياء، وإذا كانت فتحة كتبت ألفًا.\n6 إذا أشبعت حركة هاء الضمير للمفرد المذكر الغائب، كتبت\n\n', 'العنوان: تمهيد\nالمحتوى: حرفًا مجانسًا للحركة.\nفالضمة التي على الهاء في:\nله، ومنه، وعنه،\nإذا أشبعت كتبت عروضيًّا واوًا هكذا:\nلهو، ومنهو، وعنهو.\nوكسرة الهاء في:\nبه وإليه، وفيه،\nإذا أشبعت كتبت عروضيًّا هكذا:\nبهي، وإليهي، وفيهي.\nأما كاف المخاطب أو المخاطبة فلا تشبع، وبالتالي لا يزاد بعدها أي حرف،\nنحو:\nبك، وبكِ، ومنك ومنكِ، وإليك وإليكِ.\nب-\nالأحرف التي تحذف:\n1 تحذف همزة الوصل، وهي الألف التي يتوصل بها إلى النطق بالساكن، إن كان قبلها متحرك.\nويكون ذلك في:\nأ- ماضي الأفعال الخماسية والسداسية المبدوءة بالهمزة، وفي أمرها ومصدرها،\nنحو:\nانْطَلَق، استغْفَر، انطلِق، استغفِر، انطلاق، استغفار.\nفألف الوصل في هذه الكلمات وأمثالها تحذف إن كان قبلها متحرك عند الكتابة العروضية هكذا:\nفنطلَق، فستغفَر، فنطلِق فستغفِر، فنطلاق، فستغفار.\nب-\nالأسماء العشرة المسموعة وهي:\nاسم، ابن، ابنة، امرؤ، امرأة، اثنان، اثنتان، أيمن المختصة بالقسم، است.\nفمثلاً:\nباسمك، وهذا أب وابن، والعام اثنا عشر شهرًا،\nتكتب عروضيًّا هكذا:\nبسمك، وهاذا أبن وبنن، والعام ثنا عشر شهرن.\nج- أمر الفعل الثلاثي الساكن ثاني مضارعه،\nنحو:\nفاسمع واكتب واقرأ،\nفإنها تكتب عروضيًّا هكذا:\nفسمعْ، وكتبْ، وقرأْ.\nد- ألف الوصل من أل المعرفة. فإذا كانت أل قمرية، كما\n\n']"," علم العروض يساعد على تحسين جودة الشعر من خلال عدة جوانب:

1. فهم الأوزان الشعرية: يتيح علم العروض للشاعر فهم الأوزان الشعرية المختلفة وكيفية تركيبها. هذا الفهم يساعد الشاعر على اختيار الوزن المناسب لموضوعه وأفكاره، مما يجعل القصيدة أكثر تناسقاً وجمالاً.

2. تجنب الأخطاء الوزنية: يساعد علم العروض الشاعر على تجنب الأخطاء الوزنية التي قد تفسد جمال القصيدة. من خلال دراسة العروض، يتعلم الشاعر كيفية توزيع المقاطع الصوتية بشكل صحيح وفقاً للوزن الشعري المختار.

3. تطوير المهارات الشعرية: دراسة علم العروض تساعد الشاعر على تطوير مهاراته الشعرية وتحسين قدرته على التعبير عن أفكاره ومشاعره بطريقة فنية وجمالية.

4. فهم الشعر العربي القديم: يعتبر علم العروض مفتاحاً لفهم الشعر العربي القديم وتراثه الغني. من خلال دراسة العروض، يمكن للشاعر أن يتعرف على أساليب الشعراء القدماء ويتعلم من تجاربهم.

5. تعزيز الإبداع الشعري: يساعد علم العروض الشاعر على تعزيز إبداعه الشعري من خلال توفير الأدوات اللازمة للتعبير عن أفكاره بطريقة مبتكرة وجذابة.

في المجمل، يعتبر علم العروض أداة أساسية لتحسين جودة الشعر وتطوير مهارات الشاعر الإبداعية والفنية. ",علم العروض يساعد الشاعر على ضبط وزن القصيدة مما يحسن من جودتها.,,0.22,,0.9024995180931918
ما معنى القافية في الشعر العربي؟,"['العنوان: مقدمة\nالمحتوى: بسم الله الرحمن الرحيم هذه محاضرات في علم العروض والقافية ألقيتها على طلبة الصف الأول بقسم اللغة العربية في جامعة بيروت العربية.\nوقد حاولت جهدي عرض قضايا هذا العلم على نحو ييسر على دارسيه تفهمه والإلمام بأهم مصطلحاته وجوانبه التي لها أثر في موسيقي الشعر.\nولما كان تمثل الدارس للجانب النظري من هذا العلم لا يتم إلا إذا كان معززًا بالجانب التطبيقي، فقد أكثرت من الأمثلة والشواهد المختارة من قديم الشعر وحديثه.\nوعسى أن يجد القارئ في هذا الجهد المتواضع عونًا له على إدراك موسيقى الشعر ممثلة في أوزانه وقوافيه وكل ما يتصل بهما.\nالمؤلف\n\n', 'العنوان: تمهيد\nالمحتوى: 1 العروض والخليل بن أحمد:\nالعروض:\n""علم يُبْحث فيه عن أحوال الأوزان المعتبرة""\n1 أو\n""هو ميزان الشعر، به يعرف مكسوره من موزونه، كما أن النحو معيار الكلام به يعرف معربه من ملحونه""\n2.\nويرجع رجال التراجم الفضل في نشأة علم العروض إلى الخليل بن أحمد، أحد أئمة اللغة والأدب في القرن الثاني الهجري، فابن خلكان يذكر أن الخليل كان إمامًا في علم النحو، وأنه هو الذي استنبط علم العروض وأخرجه إلى الوجود وحصر أقسامه في خمس دوائر يستخرج منها خمسة عشر بحرًا، ثم زاد الأخفش بحرًا واحدًا وسماه الخبب، كما يذكر أن الخليل كان له معرفة بالإيقاع والنغم، وتلك المعرفة أحدثت له علم العروض، فإنهما متقاربان في المأخذ 3\n\n', 'العنوان: تمهيد\nالمحتوى: ويحدثنا ياقوت عن الخليل بن أحمد بأنه أول من استخرج العروض وضبط اللغة وحصر أشعار العرب، وأن معرفته بالإيقاع -بناء ألحان الغناء على موقعها وميزانها- هي التي أحدثت له علم العروض1.\nكذلك يحدثنا القفطيّ عن الخليل بأنه سيد الأدباء في علمه وزهده، وأنه نحويّ لغويّ عروضيّ، استنبط من العروض وعلله ما لم يستخرجه أحد، ولم يسبقه إلى علمه سابق من العلماء كلهم2.\nوروى ابن خلكان عن حمزة بن الحسن الأصفهاني نقلاً عن كتابه التنبيه على حدوث التصحيف.\nقوله:\nإن دولة الإسلام لم تخرج أبدع للعلوم التي لم يكن لها عند العرب أصول من الخليل، وليس على ذلك برهان أوضح من علم العروض الذي لا عن حكيم أخذه، ولا على مثال تقدمه احتذاه، وإنما اخترعه من ممر له بالصفارين، من وقع مطرقة على طست.\nمن ذلك يرى أن الخليل هو أول مبتكر لعلم العروض وحصر كل أشعار العرب في بحوره. ولم تقف عقليته المبتكرة عند هذا الحد، وإنما تجاوزته إلى ابتكار علوم أخرى، فهو أول مبتكر لفكرة المعاجم العربية بوضعه معجم العين، الذي يحصر لغة أمة من الأمم قاطبة، وهو الذي وضع أساس علم النحو باستخراج مسائله وتعليله، وإمداده سيبويه من علم النحو بما صنف منه كتابه الذي هو زينة لدولة الإسلام كما يذكر القفطيّ، ثم هو الذي اخترع علم الموسيقى العربية وجمع فيه أصناف النغم.\nولكن لا ينبغي أن يفهم من وضع الخليل لعلم العروض أن العرب لم تكن\n\n', 'العنوان: تمهيد\nالمحتوى: تعرف أوزان الشعر من قبل، فالواقع أنهم كانوا قبل وضع علم العروض على علم بأوزان الشعر العربي وبحوره على تباينها، وإن لم تكن تعرفها بالأسماء التي وضعها الخليل لها فيما بعد. وما أشبه علمها بذلك بعلمها بالإعراب في الكلام حين كانوا عن سليقة يرفعون أو ينصبون أو يجرون ما حقه الرفع أو النصب أو الجر دون علم بما وضعه النحاة فيما بعد من مصطلحات الإعراب وقواعده.\nكذلك كانوا بذوقهم وسيلقتهم يدركون ما يعتور الأوزان المختلفة من زحافات وعلل وإن لم يعطوها أسماء ومصطلحات خاصة كما فعل العروضيون.\nوإذا كان الخليل بن أحمد غير مسبوق في وضع علم العروض، فإن أبا عمرو بن العلاء قد سبقه في الكلام عن القوافي وقواعدها ووضع لها أسماء ومصطلحات خاصة.\nوالرواة مختلفون بشأن الباعث الذي دعا الخليل إلى التفكير في علم العروض ووضع قواعده.\nفمن قائل:\nإنه دعا بمكة أن يرزقه الله علمًا لم يسبقه إليه أحد ولا يؤخذ إلا عنه، فرجع من حجه، ففتح عليه بعلم العروض1.\nومن قائل:\nإن الدافع هو إشفاقه من اتجاه بعض شعراء عصره إلى نظم الشعر على أوزان لم يعرفها العرب ولم تسمع عنهم؛ ولهذا راح يقضي الساعات والأيام يوقع بأصابعه ويحركها حتى حصر أوزان الشعر العربي وضبط أحوال قوافيه.\nومن قائل:\nإنه وجد نفسه وهو بمكة يعيش في بيئة يشيع فيها الغناء فدفعه ذلك إلى التفكير في الوزن الشعري وما يمكن أن يخضع له من قواعد\n\n', 'العنوان: تمهيد\nالمحتوى: وأصول. وقد عكف أيامًا وليالي يستعرض فيها ما روي من أشعار ذات أنغام موسيقية متعددة،\nثم خرج على الناس بقواعد مضبوطة وأصول محكمة سماها:\nعلم العروض.\nوأيًّا كان الدافع فالثابت أن الخليل هو واضع أصول علم العروض وقوانينه التي لم يطرأ تغيير جوهري عليها، وأن الناس ظلوا حتى اليوم يتدارسونها ويتفهمونها من غير أن يزيد عليها أحد شيئًا. فلا تزال الوحدات القياسية للأوزان هي التفعيلات التي اخترعها الخليل، ولا تزال المقاطع الصوتية التي تتألف منها التفعيلات هي الأسباب والأوتاد، كما أن عدد البحور لا يزال ثابتًا عند البحور الخمسة عشر التي وضعها الخليل وبحر الخبب أو المتدارك الذي وضعه تلميذه الأخفش الأوسط أبو الحسن سعيد بن مسعدة، ولا يرد علينا هنا بما استحدث من أوزان في العصر العباسي؛ لأن هذه يمكن إرجاع أصولها إلى أوزان الخليل.\nوتجدر الإشارة إلى أن هناك فارقًا ملحوظًا بين علم العروض وعلوم العربية الأخرى من حيث النشأة. فعلوم النحو والصرف والبلاغة واللغة مثلاً قد استحدثت ثم أخذت تنمو جيلاً بعد جيل وعصرًا بعد عصر حتى بلغت ذروة اكتمالها، أما العروض فقد أخرجه الخليل علمًا يكاد يكون متكاملاً، ولعل ذلك هو السر في أن من أتى بعد الخليل من العروضيين لم يستطيعوا أن يزيدوا على عروضه أي زيادة تذكر أو تمس الجوهر.\nوكما اختلفت الآراء بالنسبة إلى الباعث الذي دعا الخليل إلى التفكير في علم العروض، اختلفت كذلك بالنسبة إلى سبب تسمية هذا العلم بالعروض.\nفمن قائل:\nإن من معاني العروض مكة لاعتراضها وسط البلاد، ومن ثم أطلق الخليل على علم ميزان الشعر الذي اخترعه اسم المكان الذي ألهم فيه قواعده وأصوله.\n\n', 'العنوان: تمهيد\nالمحتوى: ومن قائل:\nإنه سمي عروضًا باسم عمان التي كان يقيم فيها واضعه ومخترعه الخليل بن أحمد. ويذكر صاحب لسان العرب أنه سمي عروضًا؛ لأن الشعر يعرض عليه،\nأي:\nيوزن بواسطته.\n2 الحاجة إلى علم العروض:\nعرفنا مما سبق أن العروض هو علم ميزان الشعر أو موسيقى الشعر، وهو علم له قواعده وأصوله ونظرياته التي تحصل وتكتسب بالتعلم، وإذا كان الشعر من الناحية العملية هو الجانب التطبيقي لقواعد العروض وأصوله ونظرياته، فإنه قبل ذلك فن كسائر الفنون مصدره الموهبة والاستعداد.\nوقد يستطيع الشاعر الموهوب بما له من أذن موسيقية وحس وذوق مرهفين أن يقول الشعر دون علم بالعروض وحاجة إلى قوانينه، ولكنه مع ذلك يظل بحاجة إلى دراسة علم العروض والإلمام بأصوله.\nفأذن الشاعر الموسيقية -مهما كانت درجة رهافتها وحساسيتها- قد تخذل صاحبها أحيانًا في التمييز بين الأوزان المتقاربة أو بين قافية سليمة وأخرى معيبة، أو بين زحاف جائز وآخر غير جائز.\nوجهل الشاعر الموهوب بأوزان الشعر وبحوره المختلفة من تامة ومجزوءة ومشطورة ومنهوكة قد يحصر شعره في بعض أوزان خاصة، وبذلك يحرم نفسه من العزف على أوتار شتى تجعل شعره منوع الأنغام والألحان من ذلك تتجلى أهمية دراسة الشاعر للعروض والإلمام بقوانينه وأصوله.\nوإذا كان العروض إلى هذا القدر لازمًا للشاعر الملهم الموهوب، فإنه يكون أشد لزومًا لغيره. فهو أشد لزومًا لطلاب اللغة والتخصص فيها؛ لأنه يعينهم على فهم الشعر العربي وقراءته قراءة صحيحة والتمييز بين سليمه ومختله وزنًا.\n\n', 'العنوان: تمهيد\nالمحتوى: وهو كذلك أشد لزومًا للدارسين والمتخصصين في فروع الثقافة العربية من تاريخ واجتماع وأدب وبلاغة ومذاهب دينية أو عقلية. فالباحثون في أمثال هذه العلوم العربية لا غنى لهم عن تفهم ما يرد من شعر في المراجع والكتب المختصة بهذه العلوم. وفهم أولئك للشعر متوقف على صحة قراءته، وهذه لا تتأتى إلا لمن لديه القدرة على معرفة صحيح الأوزان والتمييز بين أنواعها المختلفة.\nمن أجل ذلك كله ندرك ضرورة الإلمام بعلم العروض أو علم موسيقى الشعر وأصوله، لا بالنسبة للشعراء فحسب، ولكن بالنسبة أيضًا لذوي التخصص في علوم العربية. وإذا جاز أن يغتفر لغير متخصص ألا يقيم وزن الشعر وألا يقرأه قراءة صحيحة، فإن ذلك لا يمكن أن يغتفر مطلقًا للمتخصص.\n3 الصلة بين العروض والموسيقى:\nعرفنا أن العروض هو علم موسيقى الشعر، وعلى ذلك يكون هناك صلة تجمع بينه وبين الموسيقى بصفة عامة، وهذه الصلة تتمثل في الجانب الصوتي.\nفالموسيقى تقوم على تقسيم الجمل إلى مقاطع صوتية تختلف طولاً وقصرًا، أو إلى وحدات صوتية معينة على نسق معين، بغض النظر عن بداية الكلمات ونهايتها.\nوكذلك شأن العروض، فالبيت من الشعر يقسم إلى وحدات صوتية معينة، أو إلى مقاطع صوتية تعرف بالتفاعيل بقطع النظر عن بداية الكلمات ونهايتها. فقد ينتهي المقطع الصوتي أو التفعيلة في آخر كلمة، وقد ينتهي في وسطها، وقد يبدأ من نهاية كلمة وينتهي ببدء الكلمة التي تليها.\nوهاكم مثالاً على ذلك:\nلا تسألي القوم ما مالي وما حسبي ... وسائلي للقوم ما حزمي وما خلقي\n\n', 'العنوان: تمهيد\nالمحتوى: فتقطيع هذا البيت أو تقسيمه إلى وحدات صوتية أو تفاعيل يكون كالآتي:\nلا تَسْأَلِلْ قَومَ مَا مَالِي َمَاحَسَبِي ... مستفعلن فاعلن مستفعلن فعلن\nوَسَائِلِلْ قَومَ ما حَزْمِي وَمَا خُلُقِي ... متفعلن فاعلن مستفعلن فعلن\nولكن تقطيع البيت أو تقسيمه إلى وحدات صوتية أو تفاعيل لا يتحقق إلا إذا كتب الشعر كتابة عروضية فما الكتابة العروضية؟\n4 الكتابة العروضية.\nأوضحنا فيما سبق الصلة الوثيقة التي بين العروض والموسيقى، وهي صلة الفرع المتولد من الأصل، فالعروض في الحقيقة أمره ليس إلا ضربًا من الموسيقى اختص بالشعر على أنه مقوم من مقوماته.\nوإذا كان للموسيقى عند كتابتها رموز خاصة يدل بها على الأنغام المختلفة، فإن للعروض كذلك رموزًا خاصة به في الكتابة تخالف الكتابة الإملائية التي تكون على حسب قواعد الإملاء المتعارف عليها. وهذه الرموز العروضية يدل بها على التفاعيل التي هي بمثابة أنغام الموسيقي المختلفة.\nوالكتابة العروضية تقوم على أمرين أساسيين هما:\n1 ما ينطق يكتب.\n2 ما لا ينطق لا يكتب.\nوتحقيق هذين الأمرين عند الكتابة العروضية يستلزم زيادة بعض أحرف\n\n', 'العنوان: تمهيد\nالمحتوى: لا تكتب إملائيًا وحذف بعض أحرف تكتب إملائيًا.\nوفيما يلي تفصيل للأحرف التي تزاد أوتحذف في الكتابة العروضية:\nأ-\nالحروف التي تزاد:\nتزاد في الكتابة العروضية ستة أحرف هي:\n1 إذا كان الحرف مشددًا فك التشديد ورسم الحرف أو كتب مرتين:\nمرة ساكنًا ومرة متحركًا،\nنحو:\nرق، وعد، وهز،\nفتكتب عروضيًّا:\nرقق، وعدد، وهزز.\n2 إذا كان الحرف منونًا كتب التنوين نونًا،\nنحو:\nجبل، وشجر، وأسد،\nفتكتب عروضيًّا:\nجبلن، وشجرن، وأسدن، رفعًا ونصبًا وجرًّا.\n3 تزاد ألف في بعض أسماء الإشارة،\nنحو:\nهذا، وهذه، وهذان، وهذين، وهؤلاء، وذلك،\nفتكتب عروضيًّا:\nهاذا، وهاذه، وهاذان، وهاذين، وهاؤلاء، وذالك. كذلك تزاد ألف في لفظ الجلالة، وفي لكن المخففة والمشددة،\nفهذه الكلمات:\nالله، ولكن، ولكن،\nتكتب عروضيًّا هكذا:\nاللاه، ولاكن، ولاكنن.\n4 تزاد واو في بعض الأسماء كما في:\nداود، وطاوس، وناوس،\nفتكتب عروضيًّا:\nداوود، وطاووس، وناووس.\n5 تكتب حركة حرف القافية حرفًا مجانسًا للحركة، فإذا كانت حركة حرف القافية ضمة كتبت هذه الضمة عروضيًّا واوًا، وإذا كانت كسرة كتبت ياء، وإذا كانت فتحة كتبت ألفًا.\n6 إذا أشبعت حركة هاء الضمير للمفرد المذكر الغائب، كتبت\n\n', 'العنوان: تمهيد\nالمحتوى: حرفًا مجانسًا للحركة.\nفالضمة التي على الهاء في:\nله، ومنه، وعنه،\nإذا أشبعت كتبت عروضيًّا واوًا هكذا:\nلهو، ومنهو، وعنهو.\nوكسرة الهاء في:\nبه وإليه، وفيه،\nإذا أشبعت كتبت عروضيًّا هكذا:\nبهي، وإليهي، وفيهي.\nأما كاف المخاطب أو المخاطبة فلا تشبع، وبالتالي لا يزاد بعدها أي حرف،\nنحو:\nبك، وبكِ، ومنك ومنكِ، وإليك وإليكِ.\nب-\nالأحرف التي تحذف:\n1 تحذف همزة الوصل، وهي الألف التي يتوصل بها إلى النطق بالساكن، إن كان قبلها متحرك.\nويكون ذلك في:\nأ- ماضي الأفعال الخماسية والسداسية المبدوءة بالهمزة، وفي أمرها ومصدرها،\nنحو:\nانْطَلَق، استغْفَر، انطلِق، استغفِر، انطلاق، استغفار.\nفألف الوصل في هذه الكلمات وأمثالها تحذف إن كان قبلها متحرك عند الكتابة العروضية هكذا:\nفنطلَق، فستغفَر، فنطلِق فستغفِر، فنطلاق، فستغفار.\nب-\nالأسماء العشرة المسموعة وهي:\nاسم، ابن، ابنة، امرؤ، امرأة، اثنان، اثنتان، أيمن المختصة بالقسم، است.\nفمثلاً:\nباسمك، وهذا أب وابن، والعام اثنا عشر شهرًا،\nتكتب عروضيًّا هكذا:\nبسمك، وهاذا أبن وبنن، والعام ثنا عشر شهرن.\nج- أمر الفعل الثلاثي الساكن ثاني مضارعه،\nنحو:\nفاسمع واكتب واقرأ،\nفإنها تكتب عروضيًّا هكذا:\nفسمعْ، وكتبْ، وقرأْ.\nد- ألف الوصل من أل المعرفة. فإذا كانت أل قمرية، كما\n\n']"," القافية في الشعر العربي تعني تكرار أصوات الحروف المتشابهة في نهاية الأبيات الشعرية. تتكون القافية من مجموعة من الحروف التي تظهر في آخر كل بيت شعري، وتساهم في إعطاء القصيدة تناغمًا موسيقيًا وتوازنًا إيقاعيًا. تساعد القافية أيضًا على تعزيز الذاكرة وتسهيل حفظ الشعر وتمييزه عن غيره من الأبيات.

تتكون القافية من حرف الروي (الحرف الأخير الذي يتكرر في نهاية الأبيات) وحروف الوصل (الحروف التي تأتي قبل حرف الروي وتساعد في تشكيل القافية). يمكن أن تكون القافية بسيطة أو مركبة، حيث تشمل القافية البسيطة تكرار حرف واحد في نهاية الأبيات، بينما تتضمن القافية المركبة تكرار أكثر من حرف.

تعتبر القافية عنصرًا مهمًا في الشعر العربي، حيث تساهم في إضفاء جمالية على النص الشعري وتعزيز تأثيره على المستمع أو القارئ. ",القافية هي نهاية البيت الشعري وتتكون من حروف محددة.,,0.24,0.0,0.9083066657842336
ما هي وظيفة الكتابة العروضية؟,"['العنوان: مقدمة\nالمحتوى: بسم الله الرحمن الرحيم هذه محاضرات في علم العروض والقافية ألقيتها على طلبة الصف الأول بقسم اللغة العربية في جامعة بيروت العربية.\nوقد حاولت جهدي عرض قضايا هذا العلم على نحو ييسر على دارسيه تفهمه والإلمام بأهم مصطلحاته وجوانبه التي لها أثر في موسيقي الشعر.\nولما كان تمثل الدارس للجانب النظري من هذا العلم لا يتم إلا إذا كان معززًا بالجانب التطبيقي، فقد أكثرت من الأمثلة والشواهد المختارة من قديم الشعر وحديثه.\nوعسى أن يجد القارئ في هذا الجهد المتواضع عونًا له على إدراك موسيقى الشعر ممثلة في أوزانه وقوافيه وكل ما يتصل بهما.\nالمؤلف\n\n', 'العنوان: تمهيد\nالمحتوى: 1 العروض والخليل بن أحمد:\nالعروض:\n""علم يُبْحث فيه عن أحوال الأوزان المعتبرة""\n1 أو\n""هو ميزان الشعر، به يعرف مكسوره من موزونه، كما أن النحو معيار الكلام به يعرف معربه من ملحونه""\n2.\nويرجع رجال التراجم الفضل في نشأة علم العروض إلى الخليل بن أحمد، أحد أئمة اللغة والأدب في القرن الثاني الهجري، فابن خلكان يذكر أن الخليل كان إمامًا في علم النحو، وأنه هو الذي استنبط علم العروض وأخرجه إلى الوجود وحصر أقسامه في خمس دوائر يستخرج منها خمسة عشر بحرًا، ثم زاد الأخفش بحرًا واحدًا وسماه الخبب، كما يذكر أن الخليل كان له معرفة بالإيقاع والنغم، وتلك المعرفة أحدثت له علم العروض، فإنهما متقاربان في المأخذ 3\n\n', 'العنوان: تمهيد\nالمحتوى: ويحدثنا ياقوت عن الخليل بن أحمد بأنه أول من استخرج العروض وضبط اللغة وحصر أشعار العرب، وأن معرفته بالإيقاع -بناء ألحان الغناء على موقعها وميزانها- هي التي أحدثت له علم العروض1.\nكذلك يحدثنا القفطيّ عن الخليل بأنه سيد الأدباء في علمه وزهده، وأنه نحويّ لغويّ عروضيّ، استنبط من العروض وعلله ما لم يستخرجه أحد، ولم يسبقه إلى علمه سابق من العلماء كلهم2.\nوروى ابن خلكان عن حمزة بن الحسن الأصفهاني نقلاً عن كتابه التنبيه على حدوث التصحيف.\nقوله:\nإن دولة الإسلام لم تخرج أبدع للعلوم التي لم يكن لها عند العرب أصول من الخليل، وليس على ذلك برهان أوضح من علم العروض الذي لا عن حكيم أخذه، ولا على مثال تقدمه احتذاه، وإنما اخترعه من ممر له بالصفارين، من وقع مطرقة على طست.\nمن ذلك يرى أن الخليل هو أول مبتكر لعلم العروض وحصر كل أشعار العرب في بحوره. ولم تقف عقليته المبتكرة عند هذا الحد، وإنما تجاوزته إلى ابتكار علوم أخرى، فهو أول مبتكر لفكرة المعاجم العربية بوضعه معجم العين، الذي يحصر لغة أمة من الأمم قاطبة، وهو الذي وضع أساس علم النحو باستخراج مسائله وتعليله، وإمداده سيبويه من علم النحو بما صنف منه كتابه الذي هو زينة لدولة الإسلام كما يذكر القفطيّ، ثم هو الذي اخترع علم الموسيقى العربية وجمع فيه أصناف النغم.\nولكن لا ينبغي أن يفهم من وضع الخليل لعلم العروض أن العرب لم تكن\n\n', 'العنوان: تمهيد\nالمحتوى: تعرف أوزان الشعر من قبل، فالواقع أنهم كانوا قبل وضع علم العروض على علم بأوزان الشعر العربي وبحوره على تباينها، وإن لم تكن تعرفها بالأسماء التي وضعها الخليل لها فيما بعد. وما أشبه علمها بذلك بعلمها بالإعراب في الكلام حين كانوا عن سليقة يرفعون أو ينصبون أو يجرون ما حقه الرفع أو النصب أو الجر دون علم بما وضعه النحاة فيما بعد من مصطلحات الإعراب وقواعده.\nكذلك كانوا بذوقهم وسيلقتهم يدركون ما يعتور الأوزان المختلفة من زحافات وعلل وإن لم يعطوها أسماء ومصطلحات خاصة كما فعل العروضيون.\nوإذا كان الخليل بن أحمد غير مسبوق في وضع علم العروض، فإن أبا عمرو بن العلاء قد سبقه في الكلام عن القوافي وقواعدها ووضع لها أسماء ومصطلحات خاصة.\nوالرواة مختلفون بشأن الباعث الذي دعا الخليل إلى التفكير في علم العروض ووضع قواعده.\nفمن قائل:\nإنه دعا بمكة أن يرزقه الله علمًا لم يسبقه إليه أحد ولا يؤخذ إلا عنه، فرجع من حجه، ففتح عليه بعلم العروض1.\nومن قائل:\nإن الدافع هو إشفاقه من اتجاه بعض شعراء عصره إلى نظم الشعر على أوزان لم يعرفها العرب ولم تسمع عنهم؛ ولهذا راح يقضي الساعات والأيام يوقع بأصابعه ويحركها حتى حصر أوزان الشعر العربي وضبط أحوال قوافيه.\nومن قائل:\nإنه وجد نفسه وهو بمكة يعيش في بيئة يشيع فيها الغناء فدفعه ذلك إلى التفكير في الوزن الشعري وما يمكن أن يخضع له من قواعد\n\n', 'العنوان: تمهيد\nالمحتوى: وأصول. وقد عكف أيامًا وليالي يستعرض فيها ما روي من أشعار ذات أنغام موسيقية متعددة،\nثم خرج على الناس بقواعد مضبوطة وأصول محكمة سماها:\nعلم العروض.\nوأيًّا كان الدافع فالثابت أن الخليل هو واضع أصول علم العروض وقوانينه التي لم يطرأ تغيير جوهري عليها، وأن الناس ظلوا حتى اليوم يتدارسونها ويتفهمونها من غير أن يزيد عليها أحد شيئًا. فلا تزال الوحدات القياسية للأوزان هي التفعيلات التي اخترعها الخليل، ولا تزال المقاطع الصوتية التي تتألف منها التفعيلات هي الأسباب والأوتاد، كما أن عدد البحور لا يزال ثابتًا عند البحور الخمسة عشر التي وضعها الخليل وبحر الخبب أو المتدارك الذي وضعه تلميذه الأخفش الأوسط أبو الحسن سعيد بن مسعدة، ولا يرد علينا هنا بما استحدث من أوزان في العصر العباسي؛ لأن هذه يمكن إرجاع أصولها إلى أوزان الخليل.\nوتجدر الإشارة إلى أن هناك فارقًا ملحوظًا بين علم العروض وعلوم العربية الأخرى من حيث النشأة. فعلوم النحو والصرف والبلاغة واللغة مثلاً قد استحدثت ثم أخذت تنمو جيلاً بعد جيل وعصرًا بعد عصر حتى بلغت ذروة اكتمالها، أما العروض فقد أخرجه الخليل علمًا يكاد يكون متكاملاً، ولعل ذلك هو السر في أن من أتى بعد الخليل من العروضيين لم يستطيعوا أن يزيدوا على عروضه أي زيادة تذكر أو تمس الجوهر.\nوكما اختلفت الآراء بالنسبة إلى الباعث الذي دعا الخليل إلى التفكير في علم العروض، اختلفت كذلك بالنسبة إلى سبب تسمية هذا العلم بالعروض.\nفمن قائل:\nإن من معاني العروض مكة لاعتراضها وسط البلاد، ومن ثم أطلق الخليل على علم ميزان الشعر الذي اخترعه اسم المكان الذي ألهم فيه قواعده وأصوله.\n\n', 'العنوان: تمهيد\nالمحتوى: ومن قائل:\nإنه سمي عروضًا باسم عمان التي كان يقيم فيها واضعه ومخترعه الخليل بن أحمد. ويذكر صاحب لسان العرب أنه سمي عروضًا؛ لأن الشعر يعرض عليه،\nأي:\nيوزن بواسطته.\n2 الحاجة إلى علم العروض:\nعرفنا مما سبق أن العروض هو علم ميزان الشعر أو موسيقى الشعر، وهو علم له قواعده وأصوله ونظرياته التي تحصل وتكتسب بالتعلم، وإذا كان الشعر من الناحية العملية هو الجانب التطبيقي لقواعد العروض وأصوله ونظرياته، فإنه قبل ذلك فن كسائر الفنون مصدره الموهبة والاستعداد.\nوقد يستطيع الشاعر الموهوب بما له من أذن موسيقية وحس وذوق مرهفين أن يقول الشعر دون علم بالعروض وحاجة إلى قوانينه، ولكنه مع ذلك يظل بحاجة إلى دراسة علم العروض والإلمام بأصوله.\nفأذن الشاعر الموسيقية -مهما كانت درجة رهافتها وحساسيتها- قد تخذل صاحبها أحيانًا في التمييز بين الأوزان المتقاربة أو بين قافية سليمة وأخرى معيبة، أو بين زحاف جائز وآخر غير جائز.\nوجهل الشاعر الموهوب بأوزان الشعر وبحوره المختلفة من تامة ومجزوءة ومشطورة ومنهوكة قد يحصر شعره في بعض أوزان خاصة، وبذلك يحرم نفسه من العزف على أوتار شتى تجعل شعره منوع الأنغام والألحان من ذلك تتجلى أهمية دراسة الشاعر للعروض والإلمام بقوانينه وأصوله.\nوإذا كان العروض إلى هذا القدر لازمًا للشاعر الملهم الموهوب، فإنه يكون أشد لزومًا لغيره. فهو أشد لزومًا لطلاب اللغة والتخصص فيها؛ لأنه يعينهم على فهم الشعر العربي وقراءته قراءة صحيحة والتمييز بين سليمه ومختله وزنًا.\n\n', 'العنوان: تمهيد\nالمحتوى: وهو كذلك أشد لزومًا للدارسين والمتخصصين في فروع الثقافة العربية من تاريخ واجتماع وأدب وبلاغة ومذاهب دينية أو عقلية. فالباحثون في أمثال هذه العلوم العربية لا غنى لهم عن تفهم ما يرد من شعر في المراجع والكتب المختصة بهذه العلوم. وفهم أولئك للشعر متوقف على صحة قراءته، وهذه لا تتأتى إلا لمن لديه القدرة على معرفة صحيح الأوزان والتمييز بين أنواعها المختلفة.\nمن أجل ذلك كله ندرك ضرورة الإلمام بعلم العروض أو علم موسيقى الشعر وأصوله، لا بالنسبة للشعراء فحسب، ولكن بالنسبة أيضًا لذوي التخصص في علوم العربية. وإذا جاز أن يغتفر لغير متخصص ألا يقيم وزن الشعر وألا يقرأه قراءة صحيحة، فإن ذلك لا يمكن أن يغتفر مطلقًا للمتخصص.\n3 الصلة بين العروض والموسيقى:\nعرفنا أن العروض هو علم موسيقى الشعر، وعلى ذلك يكون هناك صلة تجمع بينه وبين الموسيقى بصفة عامة، وهذه الصلة تتمثل في الجانب الصوتي.\nفالموسيقى تقوم على تقسيم الجمل إلى مقاطع صوتية تختلف طولاً وقصرًا، أو إلى وحدات صوتية معينة على نسق معين، بغض النظر عن بداية الكلمات ونهايتها.\nوكذلك شأن العروض، فالبيت من الشعر يقسم إلى وحدات صوتية معينة، أو إلى مقاطع صوتية تعرف بالتفاعيل بقطع النظر عن بداية الكلمات ونهايتها. فقد ينتهي المقطع الصوتي أو التفعيلة في آخر كلمة، وقد ينتهي في وسطها، وقد يبدأ من نهاية كلمة وينتهي ببدء الكلمة التي تليها.\nوهاكم مثالاً على ذلك:\nلا تسألي القوم ما مالي وما حسبي ... وسائلي للقوم ما حزمي وما خلقي\n\n', 'العنوان: تمهيد\nالمحتوى: فتقطيع هذا البيت أو تقسيمه إلى وحدات صوتية أو تفاعيل يكون كالآتي:\nلا تَسْأَلِلْ قَومَ مَا مَالِي َمَاحَسَبِي ... مستفعلن فاعلن مستفعلن فعلن\nوَسَائِلِلْ قَومَ ما حَزْمِي وَمَا خُلُقِي ... متفعلن فاعلن مستفعلن فعلن\nولكن تقطيع البيت أو تقسيمه إلى وحدات صوتية أو تفاعيل لا يتحقق إلا إذا كتب الشعر كتابة عروضية فما الكتابة العروضية؟\n4 الكتابة العروضية.\nأوضحنا فيما سبق الصلة الوثيقة التي بين العروض والموسيقى، وهي صلة الفرع المتولد من الأصل، فالعروض في الحقيقة أمره ليس إلا ضربًا من الموسيقى اختص بالشعر على أنه مقوم من مقوماته.\nوإذا كان للموسيقى عند كتابتها رموز خاصة يدل بها على الأنغام المختلفة، فإن للعروض كذلك رموزًا خاصة به في الكتابة تخالف الكتابة الإملائية التي تكون على حسب قواعد الإملاء المتعارف عليها. وهذه الرموز العروضية يدل بها على التفاعيل التي هي بمثابة أنغام الموسيقي المختلفة.\nوالكتابة العروضية تقوم على أمرين أساسيين هما:\n1 ما ينطق يكتب.\n2 ما لا ينطق لا يكتب.\nوتحقيق هذين الأمرين عند الكتابة العروضية يستلزم زيادة بعض أحرف\n\n', 'العنوان: تمهيد\nالمحتوى: لا تكتب إملائيًا وحذف بعض أحرف تكتب إملائيًا.\nوفيما يلي تفصيل للأحرف التي تزاد أوتحذف في الكتابة العروضية:\nأ-\nالحروف التي تزاد:\nتزاد في الكتابة العروضية ستة أحرف هي:\n1 إذا كان الحرف مشددًا فك التشديد ورسم الحرف أو كتب مرتين:\nمرة ساكنًا ومرة متحركًا،\nنحو:\nرق، وعد، وهز،\nفتكتب عروضيًّا:\nرقق، وعدد، وهزز.\n2 إذا كان الحرف منونًا كتب التنوين نونًا،\nنحو:\nجبل، وشجر، وأسد،\nفتكتب عروضيًّا:\nجبلن، وشجرن، وأسدن، رفعًا ونصبًا وجرًّا.\n3 تزاد ألف في بعض أسماء الإشارة،\nنحو:\nهذا، وهذه، وهذان، وهذين، وهؤلاء، وذلك،\nفتكتب عروضيًّا:\nهاذا، وهاذه، وهاذان، وهاذين، وهاؤلاء، وذالك. كذلك تزاد ألف في لفظ الجلالة، وفي لكن المخففة والمشددة،\nفهذه الكلمات:\nالله، ولكن، ولكن،\nتكتب عروضيًّا هكذا:\nاللاه، ولاكن، ولاكنن.\n4 تزاد واو في بعض الأسماء كما في:\nداود، وطاوس، وناوس،\nفتكتب عروضيًّا:\nداوود، وطاووس، وناووس.\n5 تكتب حركة حرف القافية حرفًا مجانسًا للحركة، فإذا كانت حركة حرف القافية ضمة كتبت هذه الضمة عروضيًّا واوًا، وإذا كانت كسرة كتبت ياء، وإذا كانت فتحة كتبت ألفًا.\n6 إذا أشبعت حركة هاء الضمير للمفرد المذكر الغائب، كتبت\n\n', 'العنوان: تمهيد\nالمحتوى: حرفًا مجانسًا للحركة.\nفالضمة التي على الهاء في:\nله، ومنه، وعنه،\nإذا أشبعت كتبت عروضيًّا واوًا هكذا:\nلهو، ومنهو، وعنهو.\nوكسرة الهاء في:\nبه وإليه، وفيه،\nإذا أشبعت كتبت عروضيًّا هكذا:\nبهي، وإليهي، وفيهي.\nأما كاف المخاطب أو المخاطبة فلا تشبع، وبالتالي لا يزاد بعدها أي حرف،\nنحو:\nبك، وبكِ، ومنك ومنكِ، وإليك وإليكِ.\nب-\nالأحرف التي تحذف:\n1 تحذف همزة الوصل، وهي الألف التي يتوصل بها إلى النطق بالساكن، إن كان قبلها متحرك.\nويكون ذلك في:\nأ- ماضي الأفعال الخماسية والسداسية المبدوءة بالهمزة، وفي أمرها ومصدرها،\nنحو:\nانْطَلَق، استغْفَر، انطلِق، استغفِر، انطلاق، استغفار.\nفألف الوصل في هذه الكلمات وأمثالها تحذف إن كان قبلها متحرك عند الكتابة العروضية هكذا:\nفنطلَق، فستغفَر، فنطلِق فستغفِر، فنطلاق، فستغفار.\nب-\nالأسماء العشرة المسموعة وهي:\nاسم، ابن، ابنة، امرؤ، امرأة، اثنان، اثنتان، أيمن المختصة بالقسم، است.\nفمثلاً:\nباسمك، وهذا أب وابن، والعام اثنا عشر شهرًا،\nتكتب عروضيًّا هكذا:\nبسمك، وهاذا أبن وبنن، والعام ثنا عشر شهرن.\nج- أمر الفعل الثلاثي الساكن ثاني مضارعه،\nنحو:\nفاسمع واكتب واقرأ،\nفإنها تكتب عروضيًّا هكذا:\nفسمعْ، وكتبْ، وقرأْ.\nد- ألف الوصل من أل المعرفة. فإذا كانت أل قمرية، كما\n\n']"," وظيفة الكتابة العروضية هي تمثيل الأوزان الشعرية بطريقة دقيقة ومنظمة. تستخدم هذه الكتابة لتوضيح التفاعيل الشعرية والأنغام الموسيقية في البيت الشعري. تساعد الكتابة العروضية الشعراء والباحثين على فهم وتحليل الأوزان الشعرية بشكل أفضل، وتمكنهم من التمييز بين الأوزان المختلفة والتفاعيل الشعرية.

في الكتابة العروضية، يتم تمثيل الحروف التي تنطق ولا تكتب، مثل التشديد والتنوين، وكذلك الحروف التي تكتب ولا تنطق، مثل الألف في بعض الأسماء والألف والواو والياء في بعض الكلمات. هذا التمثيل يساعد على توضيح البنية الموسيقية للبيت الشعري ويسهل عملية تحليل الشعر وفهمه.

باختصار، الكتابة العروضية هي أداة مهمة لفهم وتحليل الأوزان الشعرية والموسيقى في الشعر العربي، وتساعد الشعراء والباحثين على دراسة وفهم الشعر بشكل أعمق وأكثر دقة. ",الكتابة العروضية تُظهر النطق الفعلي للمقاطع الصوتية في البيت الشعري.,1.0,0.18,1.0,0.8984333265440585
كيف يمكن تحديد البحر الذي ينتمي إليه البيت الشعري؟,"['العنوان: أوزان البحور\nالمحتوى: ... 1 مقدمة.\n2 البحر الأول:\nبحر الطويل.\nمقدمة:\nأشرنا سابقًا إلى أن الخليل بن أحمد وضع خمسة عشر بحرًا وأن تلميذه الأخفش زاد عليها بحرًا سماه:\nالمتدارك، وبذلك أصبح مجموع البحور ستة عشر بحرًا.\nوبعد هذه البحور كما ذكرنا من قبل تشترك تفعيلاتها في عدد المقاطع بحيث إذا قدمنا مقطعًا متأخرًا أو أخرنا مقطعًا متقدمًا تولد عن ذلك البحر المماثل.\nفالتفعيلة فعولن مثلاً مكونة من وتد مجموع فسبب خفيف، فإذا تكررت ثماني مرات فإنه ينتج عنها بحر المتقارب، أما إذا قدمنا السبب الخفيف على الوتد المجموع في التفعيلة ذاتها فإن فعولن تصبح فاعلن، وهذه إذا تكررت كذلك ثماني مرات فإنه يتولد عنها بحر المتدارك.\n\n', 'العنوان: أوزان البحور\nالمحتوى: وكذلك متفاعلن إذا عكست تصير مفاعلتن وتكوِّن بتكرارها مع تفعيلة من نوع آخر بحرًا يسمى:\nالوافر،\nبينما تكرار متفاعلن ست مرات يولد بحرًا آخر هو:\nالكامل، وهكذا.\nوقد رتب العروضيون بحور الشعر الستة عشر على حسب اشتراك كل مجموعة منها في دائرة عروضية واحدة على الوجه التالي:\n1 الطويل، والمديد، والبسيط.\n2 الوافر، والكامل.\n3 الهزج، والرجز، والرمل.\n4 السريع والمنسرح، والخفيف، والمضارع، والمقتضب، والمجتث.\n5 المتقارب، والمتدارك.\nوهذا الترتيب كما ذكرت هو بحسب اشتراك كل مجموعة من البحور في دائرة عروضية لا بحسب كثرة استعمالها أو قلة استعمالها، وسوف نفصل الكلام عن الدوائر العروضية فيما بعد.\nأجزاء البيت:\nينقسم البيت الشعري إلى قسمين متساويين من حيث النغم والقياس الموسيقي، ويعرف كل قسم بالمصراع تشبيهًا بمصراعي الباب، أو بالشطر،\nفيقال:\nالشطر الأول أو الثاني،\nكما يقال:\nالمصراع الأول أو الثاني من البيت.\nالتفعيلة الأخيرة.\nولما كان للتفعيلة الأخيرة من كل شطر أهمية خاصة فقد انفردت بتسمية خاصة.\n\n', 'العنوان: أوزان البحور\nالمحتوى: فالتفعيلة التي في آخر الشطر من البيت تسمى:\nالعروض -بفتح العين-\nوالتفعيلة التي في آخر الشطر الثاني تسمى:\nالضرب،\nوما عدا ذلك من تفاعيل البيت يسمى:\nالحشو،\nهكذا:\nفعولن مفاعيلن فعولن مفاعلن\nحشو عروض\nفعولن مفاعيلن فعولن مفاعلن\nحشو ضرب\nوكل بحر من بحور الشعر له نظام خاص في التغييرات التي تدخل على الحشو أو على العروض أو على الضرب. وسنوضح ذلك عند الكلام على وزن كل بحر.\n\n', 'العنوان: البحر الطويل\nالمحتوى: ...\nالبحر الأول:\nالطويل\n1 وزنه:\nفعولن مفاعيلن فعولن مفاعيلن\nفعولن مفاعيلن فعولن مفاعيلن.\n2 عروضه:\nعروض هذا البحر، أي تفعيلته التي تقع في آخر الشطر الأول من البيت، لا تستعمل تامة، بل يحذف منها الحرف الخامس، أي الياء الساكنة فتصبح مفاعيلن مفاعلن.\nوحذف الخامس الساكن له في العروض اسم اصطلاحي هو:\nالقبض،\nوتسمى التفعيلة التي وقع فيها القبض:\nمقبوضة.\n3 ضربه:\nوضرب هذا البحر، أي تفعيلته التي تقع في آخر الشطر الثاني من البيت، قد يكون مقبوضًا في قصيدة أو غير مقبوض في أخرى.\nوإذا جاء البيت الأول من القصيدة مقبوض العروض والضرب معًا لزم أن يستمر ذلك في بقية أبياتها.\n\n', 'العنوان: البحر الطويل\nالمحتوى: 4 حشو البيت:\nعرفنا أن الحشو هو جميع تفعيلات البيت ما عدا تفعيلة العروض وتفعيلة الضرب.\nوحشو البيت في بحر الطويل يحدث فيه تغيير اختياري بحذف النون الساكنة من فعولن الأولى أو الثالثة أو الخامسة أو السابعة في ترتيب التفاعيل،\nوبذلك تصبح فعولن فعولُ بلام متحركة أي بحذف الخامس الساكن:\nفتكون مقبوضة أيضًا.\nوهذا التغيير غير لازم، فإذا ورد التغيير في فعولن الأولى فلا يلزم في غيرها من بقية البيت، كما أن قبض فعولن في حشو بيت ما لا يستدعي قبضها في حشو بقية الأبيات.\nويجب التنبيه على أن هناك فرقًا من جهة التسمية بين التغيير الذي يحدث في الحشو، والتغيير الذي يحدث في العروض والضرب.\nفالتغيير الذي يحدث في الحشو يسمى:\nالزحاف،\nأما التغيير الذي يحدث في العروض والضرب فيسمى:\nالعلة، وهو تغيير يلتزم.\nوكما يكون الزحاف والعلة في بحر الطويل يكونان كذلك في غيره من البحور، ولكن ينبغي أن نتذكر أن لكل بحر زحافًا خاصًّا وعلة خاصة.\nعروض الطويل وضربه:\nعروض الطويل تأتي مقبوضة دائمًا.\nأما ضربه فيأتي على ثلاثة أنواع:\n\n', 'العنوان: البحر الطويل\nالمحتوى: 1 مقبوضًا كذلك، أي بحذف الخامس الساكن لتصير مفاعيلن مفاعلن.\n2 أو محذوفًا، أي بحذف السبب الأخير من مفاعيلن لتصير مفاعي وتحول إلى مفاعلْ بسكون اللام تسهيلاً للنطق، أو فعولن.\n3 أو صحيحًا، مفاعيلن.\nوعلى هذا يكون نظام البحر الطويل على الوجه التالي:\n1. --- مفاعلن أ. --- مفاعلن أ\n2. --- مفاعلن أ. --- مفاعل ب\n3. --- مفاعلن أ. --- مفاعيلن جـ\nمثال النوع الأول:\nمن معلقة زهير:\nومن هاب أسباب المنايا ينلنه ... وإن يرق أسباب السماء بسلم\nومن ها بأسبابل منايا ينلنهو\nااه اه ااه اه اه ااه اه ااه ااه\nفعولن مفاعيلن فعولن مفاعلن\nوإن ير قأسبابس سماء بسللمي\nااه اه ااه اه اه ااه اااه ااه\nفعولن مفاعيلن فعولُ مفاعلن\n\n', 'العنوان: البحر الطويل\nالمحتوى: ومن ذلك نلاحظ أن عروض هذا البيت هي:\nمفاعلن، وضربه كذلك.\nوهكذا يسير زهير في جميع أبيات معلقته من أولها إلى آخرها.\nأما حشو البيت فنجد أن إحدى تفعيلاته وهي السابعة فعولن دخلها القبض فحولت إلى فعولُ بتحريك اللام وهذا غير لازم.\nالنوع الثاني:\nوهو ما عروضه مقبوضة وضربه محذوف أي: مفاعلْ بسكون اللام.\nوقد افترض العروضيون أن أصل الضرب مفاعيلن فحذف من التفعيلة الأخيرة، أي تفعيلة الضرب السبب الخفيف من آخرها فصارت مفاعي، ولسهولة النطق بها تحولت إلى مفاعلْ بسكون اللام أي تفعيلة خماسية.\nوهذا الضرب يسمى:\nمحذوفًا؛ لحذف السبب الأخير من تفعيلته.\nومثال هذا النوع قول أبي نواس في مدح الخصيب أمير مصر:\nتقول التي من بيتها خف محملي ... عزيز علينا أن نراك تسير\nأما دون مصر للغني متطلب ... بلى.. إن أسباب الغنى لكثير\nفقلت لها واستعجلتها بوادر ... جرت فجرى في جريهن عبير\nذريني أكثر حاسديك برحلة ... إلى بلد فيه الخصيب أمير\nفتى يشتري حسن الثناء بماله ... ويعلم أن الدائرات تدور\nفما جازه جود ولا حل دونه ... ولكن يسير الجود حيث يسير\n\n', 'العنوان: البحر الطويل\nالمحتوى: فتقطيع البيت الأول هكذا:\nتقولل لتي من بيـ تهاخف فمحملي\nفعولن مفاعيلن فعولن مفاعلن\nعزيزن علينا أن نراك تسيرو\nفعولن مفاعيلن فعولُ مفاعلْ\nفالتفعيلة الأخيرة من الشطر الثاني أي الضرب محذوفة.\nومثال آخر قول مسكين الدارمي عندما أوعز إليه معاوية أن يقترح البيعة من بعده لابنه يزيد؛\nليعلم رأي قومه في ذلك:\nألا ليت شعري ما يقول ابن عامر ... ومروان أم ماذا يقول سعيد؟\nبني خلفاء الله مهلاً فإنما ... يبوّئها الرحمن حيث يريد\nإذا المنبر الغربي خلَّاه ربه ... فإن أمير المؤمنين يزيد\nفتقطيع البيت الأول هكذا:\nألالي تشعري ما يقولب نُعامرن\nفعولن مفاعيلن فعولن مفاعلن\nومروا نُأَ مْ مَاذا يقول سعيدو\nفعولن مفاعيلن فعولُ مفاعلْ\nالنوع الثالث:\nما كان عروضه مقبوضة وضربه صحيحًا أي: مفاعيلن،\nكقول الحطيئة في المدح:\nأولئك قوم إن بنوا أحسنوا البنا ... وإن عاهدوا أوفوا وإن عقدوا شدوا\nوإن كانت النعماء فيهم جزوا بها ... وإن أنعموا لا كدَّروها ولا كدُّوا\nمطاعين في الهيجا مكاشيف للدجى ... بنى لهم آؤباهم.. وبنى الجد\nويعذلني أبناء سعد عليهم ... وما قلت إلا بالذي علمت سعد\n\n', 'العنوان: البحر الطويل\nالمحتوى: فتقطيع البيت الأول هكذا:\nألاء كقومي إن بنو أح سنلبنا\nفعولُ مفاعلين فعولن مفاعلن\nوإن عا هدو أوْفَو وإن ع قدو شددو\nفعولن مفاعلين فعولُ مفاعلين\nفالعروض مقبوضة والضرب هنا صحيح وكذلك في بقية الأبيات الأخرى.\nوالخلاصة:\n1 إن عروض الطويل مفاعلن\n2 أما الضرب فهو:\nمفاعلن، أو مفاعلْ بسكون اللام، أو مفاعيلن.\nفإذا رمزنا إلى العروض بالرمز\n(أ)\nأيضًا كان نظام قصائد الطويل كما يلي:\n1 قصيدة فيها الوضع هكذا:\n---- أ ---أ\n---- أ ---أ\nأي مفاعلن في العرض ومفاعلن في الضرب حتى نهاية القصيدة.\n2 وقصيدة أخرى تكون العروض مفاعلن أي\n(أ)\nوالضرب مفاعل أي\n(ب)\nفيكون نظامها كالآتي:\n--- أ ---ب\n--- أ --- ب حتى نهاية القصيدة.\n\n', 'العنوان: البحر الطويل\nالمحتوى: 3 وقصدة ثالثة تكون العروض مفاعل أي\n(أ)\nوالضرب مفاعيلن أي\n(جـ)\nفيكون نظامها هكذا:\n--- أ ---- جـ.\n--- أ ----جـ حتى نهاية القصيدة.\nوالخطوط الأفقية تمثل حشو البيت.\nالتصريع.\nوالتصريع هو أن يجانس الشاعر بين شطري البيت الواحد في مطلع القصيدة أي يجعل العروض مشبهًا للضرب وزنًا وقافية.\nويحدث في النوع الثاني الذي ضربه\n(مفاعل)\nأي\n(ب)\nوفي النوع الثالث الذي ضربه\n(مفاعيلن)\nأي\n(جـ)\n.\nومثال النوع الثاني مطلع قصيدة في الرثاء لشاعر معاصر:\nأفيقوا وإن جل المصاب أفيقوا ... وصونوا عيونًا للدماء تريق.\nوقولوا هنيئًا للألى وهبوا العلى ... نفوسًا إلى نيل المرام تنوق\nوتقطيع الشطر الأول:\nأفيقو وإن جللل مصاب أفيقو\nفعولن مفاعيلن فعولُ مفاعلْ\n(بسكون اللام)\nوتقطيع الشطر الثاني:\nوصونو عيوننلد دماء تريقو\nفعولن مفاعيلن فعولُ مفاعلْ\n(بسكون اللام)\n\n']"," لتحديد البحر الذي ينتمي إليه البيت الشعري، يمكنك اتباع الخطوات التالية:

1. **تحليل البيت الشعري**: اقرأ البيت الشعري بعناية وحاول تحديد التفعيلات المستخدمة في تركيبه.

2. **مقارنة التفعيلات**: قارن التفعيلات التي حددتها مع قواعد وأوزان البحور الشعرية المعروفة.

3. **استخدام الجداول أو المصادر**: يمكنك الرجوع إلى جداول البحور الشعرية أو المصادر التي تشرح كل بحر وتوضح أوزانه وتفاعيله.

4. **التحقق من التفعيلات**: تأكد من أن التفعيلات المستخدمة في البيت تتوافق مع قواعد وأوزان البحر الذي تريد تحديده.

5. **التحقق من التفعيلات المتكررة**: بعض البحور تتميز بتكرار تفعيلات معينة في كل شطر من البيت الشعري.

6. **التحقق من العروض والضرب**: العروض والضرب هما التفعيلتان الأخيرتان في كل شطر من البيت الشعري. يجب أن تتوافق مع قواعد وأوزان البحر الذي تريد تحديده.

7. **التحقق من الزحافات والعلل**: الزحافات والعلل هي تغييرات اختيارية تحدث في التفعيلات داخل البيت الشعري. يجب أن تتوافق مع قواعد وأوزان البحر الذي تريد تحديده.

8. **التحقق من التصريع**: التصريع هو تكرار القافية والوزن في مطلع القصيدة. يجب أن يتوافق مع قواعد وأوزان البحر الذي تريد تحديده.

باتباع هذه الخطوات، يمكنك تحديد البحر الذي ينتمي إليه البيت الشعري بشكل دقيق. ",يمكن تحديد البحر الذي ينتمي إليه البيت بتقطيع البيت إلى تفاعيل.,1.0,0.27,,0.873132630913722
ما هو البحر المضارع؟,"['العنوان: البحر الطويل\nالمحتوى: ...\nالبحر الأول:\nالطويل\n1 وزنه:\nفعولن مفاعيلن فعولن مفاعيلن\nفعولن مفاعيلن فعولن مفاعيلن.\n2 عروضه:\nعروض هذا البحر، أي تفعيلته التي تقع في آخر الشطر الأول من البيت، لا تستعمل تامة، بل يحذف منها الحرف الخامس، أي الياء الساكنة فتصبح مفاعيلن مفاعلن.\nوحذف الخامس الساكن له في العروض اسم اصطلاحي هو:\nالقبض،\nوتسمى التفعيلة التي وقع فيها القبض:\nمقبوضة.\n3 ضربه:\nوضرب هذا البحر، أي تفعيلته التي تقع في آخر الشطر الثاني من البيت، قد يكون مقبوضًا في قصيدة أو غير مقبوض في أخرى.\nوإذا جاء البيت الأول من القصيدة مقبوض العروض والضرب معًا لزم أن يستمر ذلك في بقية أبياتها.\n\n', 'العنوان: البحر الطويل\nالمحتوى: 4 حشو البيت:\nعرفنا أن الحشو هو جميع تفعيلات البيت ما عدا تفعيلة العروض وتفعيلة الضرب.\nوحشو البيت في بحر الطويل يحدث فيه تغيير اختياري بحذف النون الساكنة من فعولن الأولى أو الثالثة أو الخامسة أو السابعة في ترتيب التفاعيل،\nوبذلك تصبح فعولن فعولُ بلام متحركة أي بحذف الخامس الساكن:\nفتكون مقبوضة أيضًا.\nوهذا التغيير غير لازم، فإذا ورد التغيير في فعولن الأولى فلا يلزم في غيرها من بقية البيت، كما أن قبض فعولن في حشو بيت ما لا يستدعي قبضها في حشو بقية الأبيات.\nويجب التنبيه على أن هناك فرقًا من جهة التسمية بين التغيير الذي يحدث في الحشو، والتغيير الذي يحدث في العروض والضرب.\nفالتغيير الذي يحدث في الحشو يسمى:\nالزحاف،\nأما التغيير الذي يحدث في العروض والضرب فيسمى:\nالعلة، وهو تغيير يلتزم.\nوكما يكون الزحاف والعلة في بحر الطويل يكونان كذلك في غيره من البحور، ولكن ينبغي أن نتذكر أن لكل بحر زحافًا خاصًّا وعلة خاصة.\nعروض الطويل وضربه:\nعروض الطويل تأتي مقبوضة دائمًا.\nأما ضربه فيأتي على ثلاثة أنواع:\n\n', 'العنوان: البحر الطويل\nالمحتوى: 1 مقبوضًا كذلك، أي بحذف الخامس الساكن لتصير مفاعيلن مفاعلن.\n2 أو محذوفًا، أي بحذف السبب الأخير من مفاعيلن لتصير مفاعي وتحول إلى مفاعلْ بسكون اللام تسهيلاً للنطق، أو فعولن.\n3 أو صحيحًا، مفاعيلن.\nوعلى هذا يكون نظام البحر الطويل على الوجه التالي:\n1. --- مفاعلن أ. --- مفاعلن أ\n2. --- مفاعلن أ. --- مفاعل ب\n3. --- مفاعلن أ. --- مفاعيلن جـ\nمثال النوع الأول:\nمن معلقة زهير:\nومن هاب أسباب المنايا ينلنه ... وإن يرق أسباب السماء بسلم\nومن ها بأسبابل منايا ينلنهو\nااه اه ااه اه اه ااه اه ااه ااه\nفعولن مفاعيلن فعولن مفاعلن\nوإن ير قأسبابس سماء بسللمي\nااه اه ااه اه اه ااه اااه ااه\nفعولن مفاعيلن فعولُ مفاعلن\n\n', 'العنوان: البحر الطويل\nالمحتوى: ومن ذلك نلاحظ أن عروض هذا البيت هي:\nمفاعلن، وضربه كذلك.\nوهكذا يسير زهير في جميع أبيات معلقته من أولها إلى آخرها.\nأما حشو البيت فنجد أن إحدى تفعيلاته وهي السابعة فعولن دخلها القبض فحولت إلى فعولُ بتحريك اللام وهذا غير لازم.\nالنوع الثاني:\nوهو ما عروضه مقبوضة وضربه محذوف أي: مفاعلْ بسكون اللام.\nوقد افترض العروضيون أن أصل الضرب مفاعيلن فحذف من التفعيلة الأخيرة، أي تفعيلة الضرب السبب الخفيف من آخرها فصارت مفاعي، ولسهولة النطق بها تحولت إلى مفاعلْ بسكون اللام أي تفعيلة خماسية.\nوهذا الضرب يسمى:\nمحذوفًا؛ لحذف السبب الأخير من تفعيلته.\nومثال هذا النوع قول أبي نواس في مدح الخصيب أمير مصر:\nتقول التي من بيتها خف محملي ... عزيز علينا أن نراك تسير\nأما دون مصر للغني متطلب ... بلى.. إن أسباب الغنى لكثير\nفقلت لها واستعجلتها بوادر ... جرت فجرى في جريهن عبير\nذريني أكثر حاسديك برحلة ... إلى بلد فيه الخصيب أمير\nفتى يشتري حسن الثناء بماله ... ويعلم أن الدائرات تدور\nفما جازه جود ولا حل دونه ... ولكن يسير الجود حيث يسير\n\n', 'العنوان: البحر الطويل\nالمحتوى: فتقطيع البيت الأول هكذا:\nتقولل لتي من بيـ تهاخف فمحملي\nفعولن مفاعيلن فعولن مفاعلن\nعزيزن علينا أن نراك تسيرو\nفعولن مفاعيلن فعولُ مفاعلْ\nفالتفعيلة الأخيرة من الشطر الثاني أي الضرب محذوفة.\nومثال آخر قول مسكين الدارمي عندما أوعز إليه معاوية أن يقترح البيعة من بعده لابنه يزيد؛\nليعلم رأي قومه في ذلك:\nألا ليت شعري ما يقول ابن عامر ... ومروان أم ماذا يقول سعيد؟\nبني خلفاء الله مهلاً فإنما ... يبوّئها الرحمن حيث يريد\nإذا المنبر الغربي خلَّاه ربه ... فإن أمير المؤمنين يزيد\nفتقطيع البيت الأول هكذا:\nألالي تشعري ما يقولب نُعامرن\nفعولن مفاعيلن فعولن مفاعلن\nومروا نُأَ مْ مَاذا يقول سعيدو\nفعولن مفاعيلن فعولُ مفاعلْ\nالنوع الثالث:\nما كان عروضه مقبوضة وضربه صحيحًا أي: مفاعيلن،\nكقول الحطيئة في المدح:\nأولئك قوم إن بنوا أحسنوا البنا ... وإن عاهدوا أوفوا وإن عقدوا شدوا\nوإن كانت النعماء فيهم جزوا بها ... وإن أنعموا لا كدَّروها ولا كدُّوا\nمطاعين في الهيجا مكاشيف للدجى ... بنى لهم آؤباهم.. وبنى الجد\nويعذلني أبناء سعد عليهم ... وما قلت إلا بالذي علمت سعد\n\n', 'العنوان: البحر الطويل\nالمحتوى: فتقطيع البيت الأول هكذا:\nألاء كقومي إن بنو أح سنلبنا\nفعولُ مفاعلين فعولن مفاعلن\nوإن عا هدو أوْفَو وإن ع قدو شددو\nفعولن مفاعلين فعولُ مفاعلين\nفالعروض مقبوضة والضرب هنا صحيح وكذلك في بقية الأبيات الأخرى.\nوالخلاصة:\n1 إن عروض الطويل مفاعلن\n2 أما الضرب فهو:\nمفاعلن، أو مفاعلْ بسكون اللام، أو مفاعيلن.\nفإذا رمزنا إلى العروض بالرمز\n(أ)\nأيضًا كان نظام قصائد الطويل كما يلي:\n1 قصيدة فيها الوضع هكذا:\n---- أ ---أ\n---- أ ---أ\nأي مفاعلن في العرض ومفاعلن في الضرب حتى نهاية القصيدة.\n2 وقصيدة أخرى تكون العروض مفاعلن أي\n(أ)\nوالضرب مفاعل أي\n(ب)\nفيكون نظامها كالآتي:\n--- أ ---ب\n--- أ --- ب حتى نهاية القصيدة.\n\n', 'العنوان: البحر الطويل\nالمحتوى: 3 وقصدة ثالثة تكون العروض مفاعل أي\n(أ)\nوالضرب مفاعيلن أي\n(جـ)\nفيكون نظامها هكذا:\n--- أ ---- جـ.\n--- أ ----جـ حتى نهاية القصيدة.\nوالخطوط الأفقية تمثل حشو البيت.\nالتصريع.\nوالتصريع هو أن يجانس الشاعر بين شطري البيت الواحد في مطلع القصيدة أي يجعل العروض مشبهًا للضرب وزنًا وقافية.\nويحدث في النوع الثاني الذي ضربه\n(مفاعل)\nأي\n(ب)\nوفي النوع الثالث الذي ضربه\n(مفاعيلن)\nأي\n(جـ)\n.\nومثال النوع الثاني مطلع قصيدة في الرثاء لشاعر معاصر:\nأفيقوا وإن جل المصاب أفيقوا ... وصونوا عيونًا للدماء تريق.\nوقولوا هنيئًا للألى وهبوا العلى ... نفوسًا إلى نيل المرام تنوق\nوتقطيع الشطر الأول:\nأفيقو وإن جللل مصاب أفيقو\nفعولن مفاعيلن فعولُ مفاعلْ\n(بسكون اللام)\nوتقطيع الشطر الثاني:\nوصونو عيوننلد دماء تريقو\nفعولن مفاعيلن فعولُ مفاعلْ\n(بسكون اللام)\n\n', 'العنوان: البحر الطويل\nالمحتوى: فآخر القصيدة مفاعل أي:\n(ب)\nفي الضرب، أما العروض فيكون آخر الشطر الأول فقط\n(ب)\n. أما في الأبيات التي تلي المطلع فتعود فيها العروض إلى مفاعلن أي\n(أ)\nفيكون نظام القصيدة هذا:\n--- ب --- ب\n--- أ ---ب\n--- أ --- ب إلى نهاية القصيدة.\nوأحيانًا يكون التصريع في النوع الثالث،\nومثاله مطلع قصيدة في وصف الربيع لشاعر معاصر:\nإلى الشاعر الظمآن يا موجة النهر ... إلى الشاعر المدود يا نسمة العصر\nإلى شاطئ ألقت إليه قيادها ... سفائن قد ملئت مجاهدة السير.\nوتقطيع الشطر الأول هكذا:\nالششا عر ظظمأ انيامو جتننهري\nفعولن مفاعيلن فعولن مفاعيلن\nالششا عرلمكدو ديانس متلعصري\nفعولن مفاعيلن فعولن مفاعيلن\nفالعروض فيه مفاعيلن أي:\nجـ،\nوالضرب كذلك مفاعيلن أي:\nجـ،\nفيكون نظام القصيدة المصرعه التي من هذا النوع هكذا:\n--- حـ --- جـ\n--- أ ---جـ\n--- أ ---جـ حتى نهاية القصيدة.\n\n', 'العنوان: البحر الطويل\nالمحتوى: والتصريع كما يكون في بحر الطويل يكون في غيره من البحور. والأصل في التصريع أن يكون في البيت الأول من القصيدة، ولكن الشاعر أحيانًا يقسم قصيدته فقرات حسب الموضوع أو الفكرة، فيبدأ الموضوع أو الفكرة الجديدة ببيت مصرع كأنما اعتبر الموضوع الجديد أو الفكرة الجديدة قصيدة جديدة، وكل هذا بشرط اتحاد البحر والقافية، وإلا كانت قصيدة جديدة.\nحشو الطويل:\nوالمشهور في حشو الطويل أن يدخله زحاف القبض وهو حذف الخامس الساكن فتصبح فعولن فعول، ومفاعيلن مفاعلن، كما عرفنا من تقطيع الأمثلة السابقة.\nعلامات الضرب الطويل.\nويمكننا أن نميز أضرب الطويل بعضها من بعض بعلامات منها:\nأ-\nإذا كانت القافية مردفة:\nأي يوجد حرف مد قبل حرف القافية في آخر البيت كان الضرب بوزن مفاعلْ بسكون اللام،\nمثل:\nويعلم أن الدائرات تدور ... فإن أمير المؤمنين يزيد\nوكل الذي فوق التراب تراب\nب- وإذا كانت الكلمة الأخيرة في البيت غير مردفة،\nأي إذا كان حرف القافية قبله حرف صحيح ساكن فإن الضرب يكون بوزن مفاعيلن مثل:\n\n', 'العنوان: البحر الطويل\nالمحتوى: إلى الشاعر المكدود يا نسمة العصر ... لينطق بالسحر المبين من الشعر\nحـ-\nوإذا كان حرف القافية قبله حرف متحرك فإن الضرب يكون على وزن مفاعلن مثل:\nوإنك كالليل الذي هو مدركي ... وإن خلت أن المنتأى عنك واسع\n\n']"," البحر المضارع هو أحد البحور الشعرية في علم العروض العربي. يتميز بتفعيلاته وأوزانه الخاصة. يتكون البحر المضارع من تفعيلتين أساسيتين:

1. مفاعيلن: تتكون من سبب خفيف (مَ) ووتد مجموع (فا)
2. فاعلاتن: تتكون من سبب خفيف (فا) ووتد مجموع (لا) ووتد مجموع آخر (تن)

يتم تكرار هاتين التفعيلتين في كل شطر من البيت الشعري. البحر المضارع يعتبر من البحور النادرة في الشعر العربي ولا يستخدم بشكل واسع مقارنة بالبحور الأخرى مثل الطويل والبسيط والوافر.

مثال على البحر المضارع:

مَفاعيلن فاعلاتن مفاعيلن فاعلاتن
مَفاعيلن فاعلاتن مفاعيلن فاعلاتن

في هذا المثال، تم تكرار التفعيلتين مفاعيلن وفاعلاتن أربع مرات في كل شطر.

يرجى ملاحظة أن هذا المثال ليس بيتًا شعريًا كاملاً، بل هو توضيح لتركيبة البحر المضارع. البيت الشعري الكامل يتكون من شطرين متشابهين ويتبع قواعد معينة في القافية والوزن. ",البحر المضارع يتكون من 'مفاعيلن فاعلاتن'.,0.0,0.31,,0.8760343654782559
ما هو البحر المجتث؟,"['العنوان: البحر المجتث\nالمحتوى: ... وزن المجتث بحسب نظام الدوائر العروضية هو:\nمستفع لن فاعلاتن فاعلاتن ... مستفع لن فاعلاتن فاعلاتن\nووزنه المستعمل هو:\nمستفع لن فاعلاتن ... مستفع لن فاعلاتن\nزحاف المجتث\nيدخل الزحاف حشو هذا البحر كما يدخل العروض والضرب.\n1 زحاف الحشو:\nالحشو في المجتث هو:\nمستفع لن في بداية الشطر الأول والثاني من البيت، ويجوز فيها الخبن فقط، وهو حذف الثاني الساكن فتصبح متفع لن، ولا يجوز فيها الطي،\nأي:\nحذف الرابع الساكن وهو الفاء هنا؛ لأنها ليست جزءًا من سبب وإنما هي جزء من وتد مفروق.\n\n', 'العنوان: البحر المجتث\nالمحتوى: 2 زحاف العروض:\nوتفعيلة العروض في المجتث هي:\nفاعلاتن، وهذه يجوز فيها الخبن بحذف ألف المقطع الأول، أي السبب الخفيف، وبذلك يصبح وزن التفعيلة فعلاتن.\nوهذا الزحاف جائز بمعنى أنه متى ورد في بيت لا يلزم وروده في بقية الأبيات. فكأن صدر التفعيلة داخل حكمًا ضمن الحشو بمعنى أنه يجوز زحافه، أما عجزها فتسري عليه الأحكام الغالبة للأعاريض بمعنى أنه لا تغيير فيه.\n3 زحاف الضرب:\nوالضرب هنا فاعلاتن كذلك.\nويجوز فيه من الزحاف ما يجوز في العروض وهو الخبن:\nبحذف ألف المقطع الأول فيصبح وزن تفعيلة الضرب فعلاتن.\nكذلك يدخل الضرب زحاف التشعيث، وهو حذف عين فاعلاتن فتصبح فالاتن،\nوفيما يلي بعض الأمثلة:\nالمثال الأول:\nمن شعر عبد الله بن المعتز،\nقال:\nقد أقفرت سر من را ... فما لشيء دوام\nماتت كما مات فيل ... تسل منه العظام\nوتقطيع البيتين هكذا:\nقد أقفرت سرر منرا\nاه اه ااه اه ااه اه\nمستفع لن فاعلاتن\n\n', 'العنوان: البحر المجتث\nالمحتوى: فما لشي إندوامو ... ماتت كما ما تفيلن\nااه ااه اه ااه اه ... اه اه ااه اه ااه اه\nمتفع لن فاعلاتن ... مستفع لن فاعلاتن\nتسللمن هلعظامو\nااه ااه اه ااه اه\nمتفع لن فاعلاتن\nويلاحظ أن الحشو مستفع لن في الشطر الأول من كِلا البيتين قد استعملت صحيحة، على حين دخلها الخبن في الشطر الثاني منهما فصارت متفع لن. أما الضرب فيهما فصحيح بوزن فاعلاتن. وكذلك العروض.\nالمثال الثاني:\nقول أحد الشعراء:\nالغيد زهر أنيق ... تعددت ريَّاه\nلكل نوع جمال ... يسبي النهى مرآه\nشقر وبيض وسمر ... دمىً جلاها الإله\nفي أي شكل ولون ... تعنو لهن الجباه\nنعيم كل محب ... وبؤسه وأساه\nتقطيع البيت الأول هكذا:\nالغيد زهـ رن أنيق ... تعدد دت رييا هو\nاه اه ااه اه ااه اه ... ااه ااه اه اه اه\nمستفع لن فاعلاتن ... متفع لن فالاتن\nفالضرب في هذا البيت كما يلاحظ قد دخله التشعيث بحذف العين من فاعلاتن فصارت فالاتن.\n\n', 'العنوان: البحر المجتث\nالمحتوى: المثال الثالث:\nمن قول أبي نواس:\nطاب الهوى لعميده ... لولا اعتراض صدوده\nوقادني حب ريم ... مهفهف الكشح روده\nبدا يدل علينا ... بمقلتيه وجيده\nلا أستطيع فرارا ... من برقه ورعوده\nوعسكر الحب حولي ... بخيله وجنوده\nفالويل لي كيف أنجو ... من حمر موت وسوده؟\nالمثال الرابع:\nمن شعر الزهاوي شاعر العراق:\nقرأت في عين ليلي ... عنوان سحر مبين\nوالسحر إن كان حقًّا ... فإنه في العيون\nيهذب العلم أخلا ... ق أمة ويصون\nإن المدارس إما امـ ... ـتلأن تخلو السجون\nإذا تساهل شعب ... مشى إليه الشتات\nللناس في العفو موت ... وفي القصاص حياة\nسئمت كل قديم ... عرفته في حياتي\nإن كان عندك شيء ... من الجديد فهات\n\n', 'العنوان: البحر المجتث\nالمحتوى: وقت المحبة مني ... قد فات أو سيفوت\nالحب بالشك يحيا ... وباليقين يموت\nالغرب يلقاك من مكـ ... ـره بوجه طليق\nيا شرق لا تأتمنه ... فالغرب غير صديق\n\n']"," البحر المجتث هو أحد البحور الشعرية في علم العروض العربي. يتميز بوزن معين يتكون من تفعيلتين مختلفتين تتكرر في كل شطر من البيت الشعري. وزن البحر المجتث بحسب نظام الدوائر العروضية هو:

مستفع لن فاعلاتن فاعلاتن ... مستفع لن فاعلاتن فاعلاتن

ووزنه المستعمل هو:

مستفع لن فاعلاتن ... مستفع لن فاعلاتن

يدخل الزحاف حشو هذا البحر كما يدخل العروض والضرب. يمكن أن يتغير وزن التفعيلات في بعض الأحيان بسبب الزحاف، وهو تغيير يحدث في بعض المقاطع الصوتية للتفعيلات.

البحر المجتث يستخدم في الشعر العربي القديم والمعاصر، ويتميز بجماله وتنوع استخداماته في التعبير عن المشاعر والأفكار. ",البحر المجتث يتكون من 'مستفعلن فاعلاتن'.,1.0,0.4,0.7692307692307693,0.8708644478373662
